,UserID,Page,Game,Rating,Review,Playtime,PostedDate,Status
5187,76561198832150248,8.0,,Recommended,"gets a lot of hate, but its always gonna have a special place in my heart",54.8 hrs on record																					(15.4 hrs at review time),,
6260,76561198048640355,22.0,,Recommended,"Another one of those games that employ the techno-dystopia theme and fails. It's quite bland, boring and repetative.",0.7 hrs on record,,
2069,76561198025583859,8.0,,Recommended,"Why does Kimmy have no negative reviews? This is a good question, and one I asked myself on starting it. The text is slow with no way to skip and the gameplay is a bit ragged, involving reproducing the rules of various children's games to others in order to play them. None of the awesome alternate rule sets are valid. At just about the time that I was about to quit and leave a negative review, however, I was sucked into the storyline. The children that you play with tell you their cares, and the overall setting is very nostalgic, making for a very comfortable way to tell a story that's still not so light in tone. There were portions that I still had issues with, but the storylines more than made up for them. EDIT: Actually, there are negative reviews? I have no idea why the page says there are only 12.",1.2 hrs on record,,
7259,76561198146303292,5.0,,Recommended,"Yeah its a little too early accessy for me. Your ""AI"" assistant sounds like one of those E-streamers with no personality that keeps trying to crack a joke. Whole game feels bland and boring, its just another generic shooters trying to bait you with that deadspace vibe.",0.2 hrs on record,,
4995,76561198150437413,1.0,,Recommended,Just get it man,18.1 hrs on record																					(17.5 hrs at review time),,
7070,76561198025679656,7.0,,Recommended,"Interesting game that I feel takes itself too seriously.  Although I didn't regret playing it at all.    Dialogue seemed like one of those cliched after-school specials from the 80s.  Music was relatively fitting for the mood of the game; although, the designers seemed to either really enjoy it or pretentiously liked the song performers a little tooooo much.  This is because the interludes where VERY LONG for a NOT that great music number.    I think there was a choice of two different music cassettes for the player to chose from in these sections, in order to create some sort of replayablity......maybe.....idk.    However, there is no way in God's green earth am I going to go back and take an ear peak at a different torturous ditty.   Thank God! they at least gave us the option to skip the scene.   (thank you developers :)    *phewha*   That being said, I do actually recommend it and had a reasonably enjoyable 1.8 hrs of my life I'll never get back.     Oh, and if you like creepy closeups of protagonists ogling an 8-bit cheerleader with butt-hole camel toe!....well then, this might be just for you!   Good luck and have fun!",1.8 hrs on record,,
6535,76561197977935089,1.0,,Recommended,"My original review of the game was lackluster as at the time I was still fresh into my time with it, and at the time I didn't realize that the first 1/4 to 1/3 of the game was heavily front-end loaded with content. At the time, I was not bound, but somewhat obligated not to be critical of the game as I was for a few months a community moderator for the game,  I've since stepped down.  And its been several months since the game was released.  Frankly, the only word I have to describe the game is, an emotional dissapointment The world is huge, but as you exit the first 2 or 3 regions, the content of the game gets less and less.  Dont get me wrong.  When it runs good,  it looks great, its a blast to revisit the world in it's re-imagining.  And for the longest time the thing that had me most interested was the world state and the story. how things changed canonically since the last game. I wont say that I didnt enjoy it,  but I feel like the story was kind of a letdown. Very few questions were answered.  And I feel very strongly that whatever this game originally had for a script, was dramatically altered because of the invasion of Ukraine, Honestly I dont know what I was expecting but a lot of the main story felt like fan service.  It was a shame because the worldbuilding really did shine in some places. The gameplay was passable.  it was hard to get a handle on things when it was clear it was being hampered by bugs.  bugs like the A-life / Spawn circle spawning enemies behind you randomly,  AI refusing to use cover and acting recklessly,  enemies spawning exclusively with endgame gear all over the map.  When it wasn't bugging out or throwing Bullet sponges at me, it was fun. the looting mechanics and gear in general was also passable,  I appreciated much of the new toys but theres a LOT missing.  the artefacts were mostly great aside from the fact that they only spawn in preset locations just like the old games. (some areas theres static artefacts others it randomly generates one but its always the same area).  The weapons and armor were cool... the weapons were kind of a dissapointment in the modificaiton/attachment system though, I guess I thought many attachments would be modular.  especially with sights.  and I thought you'd at least be able to fetch some parts off dead stalkers sometimes.. the UI itself is more or less fine but the way the game conveys information to you is very bad.  if theres a reputation system in this game, I dont know how to read it.... It makes me wonder what the point of having all the different stalker clans is if they're all just passive to you for most of the game unless you attack them.. the older games had entire encyclopedias that would explain to you who the groups were, and they'd usually inform you too of their relations or attitude towards you. Political events in real life nearly killed the game,  multiple times over.  Its a miracle the game survived.  But unfortunatley, the honeymoon is over.  And the state of this game is not much better than Cyberpunk 2077 was in its first 6 months.  It has the potential to be great. But its going to lose considerable time to bugfixing and optimization, that will not be spent on new content. it will be worth checking back in a year or two.  Im not mad at GSC, I still like Stalker 2. Watching stalker die, return from the dead, and go through the ringer to get here again was a traumatic and emotional experience. Im glad we got it, it wasn't what I expected. But I still accept it. Until we meet again, old friend.",78.4 hrs on record																					(78.0 hrs at review time),,
5609,76561198128879258,1.0,,Recommended,make a third one and make it good,273.3 hrs on record																					(80.8 hrs at review time),,
5340,76561198170036259,6.0,,Recommended,good game 11/10,4.9 hrs on record																					(0.8 hrs at review time),,
1941,76561198002458772,4.0,,Recommended,"The game is ♥♥♥♥♥♥, but spending 0.99ct to sate all your gambling needs is a healthy investment and will save you millions!",0.4 hrs on record,,
10407,76561198201248007,26.0,,Recommended,"Hehe, cute girl with demonic presence wants to catch Strawberries.",8.8 hrs on record,,
7975,76561197998383791,12.0,,Recommended,"One of the most unique top-down games I've played. Really good sound atmosphere and randomisation, so that no playthrough is exactly the same.",36.1 hrs on record																					(18.6 hrs at review time),,
4367,76561198064800033,2.0,,Recommended,Great game almost had a brain meltdown,39.3 hrs on record																					(27.0 hrs at review time),,
9431,76561198009353718,7.0,,Recommended,"a bit short, but a lot of high pace fun",3.7 hrs on record,,
9640,76561198975545285,8.0,,Recommended,your attack missed ⣿⣿⣿⣿⣿⡿⠋⠁⠀⠀⠀⠀⠀⠀⠀⠀⠀⠀⠀⠀⠀⠀⠀⠉⠛⢿⣿⣿⣿⣿ ⣿⣿⣿⣿⡏⣀⠀⠀⠀⠀⠀⠀⠀⣀⣤⣤⣤⣄⡀⠀⠀⠀⠀⠀⠀⠀⠙⢿⣿⣿ ⣿⣿⣿⢏⣴⣿⣷⠀⠀⠀⠀⠀⢾⣿⣿⣿⣿⣿⣿⡆⠀⠀⠀⠀⠀⠀⠀⠈⣿⣿ ⣿⣿⣟⣾⣿⡟⠁⠀⠀⠀⠀⠀⢀⣾⣿⣿⣿⣿⣿⣷⢢⠀⠀⠀⠀⠀⠀⠀⢸⣿ ⣿⣿⣿⣿⣟⠀⡴⠄⠀⠀⠀⠀⠀⠀⠙⠻⣿⣿⣿⣿⣷⣄⠀⠀⠀⠀⠀⠀⠀⣿ ⣿⣿⣿⠟⠻⠀⠀⠀⠀⠀⠀⠀⠀⠀⠀⠶⢴⣿⣿⣿⣿⣿⣧⠀⠀⠀⠀⠀⠀⣿ ⣿⣁⡀⠀⠀⢰⢠⣦⠀⠀⠀⠀⠀⠀⠀⠀⢀⣼⣿⣿⣿⣿⣿⡄⠀⣴⣶⣿⡄⣿ ⣿⡋⠀⠀⠀⠎⢸⣿⡆⠀⠀⠀⠀⠀⠀⣴⣿⣿⣿⣿⣿⣿⣿⠗⢘⣿⣟⠛⠿⣼ ⣿⣿⠋⢀⡌⢰⣿⡿⢿⡀⠀⠀⠀⠀⠀⠙⠿⣿⣿⣿⣿⣿⡇⠀⢸⣿⣿⣧⢀⣼ ⣿⣿⣷⢻⠄⠘⠛⠋⠛⠃⠀⠀⠀⠀⠀⢿⣧⠈⠉⠙⠛⠋⠀⠀⠀⣿⣿⣿⣿⣿ ⣿⣿⣧⠀⠈⢸⠀⠀⠀⠀⠀⠀⠀⠀⠀⠀⠟⠀⠀⠀⠀⢀⢃⠀⠀⢸⣿⣿⣿⣿ ⣿⣿⡿⠀⠴⢗⣠⣤⣴⡶⠶⠖⠀⠀⠀⠀⠀⠀⠀⠀⠀⠀⠀⣀⡸⠀⣿⣿⣿⣿ ⣿⣿⣿⡀⢠⣾⣿⠏⠀⠠⠀⠀⠀⠀⠀⠀⠀⠀⠀⠀⠀⠀⠀⠛⠉⠀⣿⣿⣿⣿ ⣿⣿⣿⣧⠈⢹⡇⠀⠀⠀⠀⠀⠀⠀⠀⠀⠀⠀⠀⠀⠀⠀⠀⠀⠀⣰⣿⣿⣿⣿ ⣿⣿⣿⣿⡄⠈⠃⠀⠀⠀⠀⠀⠀⠀⠀⠀⠀⠀⠀⠀⠀⢀⣠⣴⣾⣿⣿⣿⣿⣿ ⣿⣿⣿⣿⣧⡀⠀⠀⠀⠀⠀⠀⠀⠀⠀⠀⠀⠀⢀⣠⣾⣿⣿⣿⣿⣿⣿⣿⣿⣿ ⣿⣿⣿⣿⣷⠀⠀⠀⠀⠀⠀⠀⠀⠀⠀⠀⢀⣴⣿⣿⣿⣿⣿⣿⣿⣿⣿⣿⣿⣿ ⣿⣿⣿⣿⣿⣦⣄⣀⣀⣀⣀⠀⠀⠀⠀⠘⣿⣿⣿⣿⣿⣿⣿⣿⣿⣿⣿⣿⣿⣿ ⣿⣿⣿⣿⣿⣿⣿⣿⣿⣿⣿⣷⡄⠀⠀⠀⣿⣿⣿⣿⣿⣿⣿⣿⣿⣿⣿⣿⣿⣿ ⣿⣿⣿⣿⣿⣿⣿⣿⣿⣿⣿⣿⣧⠀⠀⠀⠙⣿⣿⡟⢻⣿⣿⣿⣿⣿⣿⣿⣿⣿ ⣿⣿⣿⣿⣿⣿⣿⣿⣿⣿⣿⣿⠇⠀⠁⠀⠀⠹⣿⠃⠀⣿⣿⣿⣿⣿⣿⣿⣿⣿ ⣿⣿⣿⣿⣿⣿⣿⣿⡿⠛⣿⣿⠀⠀⠀⠀⠀⠀⠀⠀⢐⣿⣿⣿⣿⣿⣿⣿⣿⣿ ⣿⣿⣿⣿⠿⠛⠉⠉⠁⠀⢻⣿⡇⠀⠀⠀⠀⠀⠀⢀⠈⣿⣿⡿⠉⠛⠛⠛⠉⠉ ⣿⡿⠋⠁⠀⠀⢀⣀⣠⡴⣸⣿⣇⡄⠀⠀⠀⠀⢀⡿⠄⠙⠛⠀⣀⣠⣤⣤⠄,45.3 hrs on record																					(27.6 hrs at review time),,
839,76561198037222425,4.0,,Recommended,"A very fun original take on the Civilization style gameplay.  Much more detailed economic system (deciding exactly what products you make in your workshops or granaries) and interesting way to resolve combat encounters automatically (if 2 warring factions have military units in the same space, they'll fight) among other tweaks to the standard formula.",4.2 hrs on record																					(4.1 hrs at review time),,
2168,76561197998141809,7.0,,Recommended,"I don't feel like writing out a proper review right now, but I will say that it's good. Really good. It's this weird mix of turn based and real time, board and card game thing. It all meshes together perfectly. That being said, I do wish it were a tad less rng based. Whether you win or lose is too often determined by whether or not you get the right cards at the right time. Also this game is not balanced for coop play at all. I played this with a buddy who had no cards and even then the game became a cakewalk. I can only imagine how laughably p*ss easy this would be if he actually had a proper deck. If you like these kinda games, this is more than worth your money.",14.6 hrs on record,,
9307,76561198043040051,2.0,,Recommended,some themes of this game involve depicting dead hanging children in playgrounds and forcing children to light their teacher on fire while they are tied to a pole.. and this is in the first three levels.. this game ONLY has positive reviews because it's free with cards. you have to be a real degenerate to enjoy this garbage,1.8 hrs on record																					(1.3 hrs at review time),,
11387,76561198020340815,19.0,,Recommended,"Good game, specially if you're interested into stuff that it's not expensive as hell and short, so you can clear it swiftly, get some good enjoyment out of it and still get fed some cool SW lore and some ""spin off changes"" made to the previously estabilished story of the movies as DLC. Worth a buy out of a sale, but if in a sale, dayum son, put this game in yo cart and have fun.",11.6 hrs on record,,
6666,76561197977935089,14.0,,Recommended,"Too early in development to leave a good impression. Massive framerate inconsistencies  and UI bugs Steam doesn't give the option to give a neutral reccomendation, I don't dislike the game, I'm just not comfortable in it's current state to explicitly reccomend it.",2.0 hrs on record,,
5992,76561198011617878,4.0,,Recommended,Got Ip Manned by everybody 10/10,9.5 hrs on record																					(2.4 hrs at review time),,
7289,76561198146303292,8.0,,Recommended,Finally a civ game i can play without needing to be on the spectrum while ingesting copious amounts of stimulants just to lose the playthrought from a few sassy peasants. You just pop up a session and watch the factions fight it out.,0.9 hrs on record,,
1984,76561197974286855,1.0,,Recommended,"Ohh this game can be a huge success in the genre. Although it is in Early Access it doesn't seem there is something important or vital missing. Ok some tweaks here and there maybe needed but other than that it feels and plays like a properly complete release of a game. The mechanic where equipment is bound to the cards is interesting but i would like to have the option to play the classic way as well. Where the cards and the equipment are separate aspects in the game. I understand the critique that Act 1 is really long but i didn't mind to be honest. I am 6 hrs into Act 1, i am close to finish it and i am not bored at all. So, having said that i would like to see some things added or tweaked to the game, if the devs are up for it. 1) I would like it to have a multiplayer coop mode/option. I mean, i really would love to play this game with 2 or 3 of my friends, forming a D&D like pose and go after the missions. It would be really fun and unique as i don't know any other games (apart from a few classic RPGs) that you can do that. Wot you think devs? is that feasible? 2) I would like to be able to have a party of more than 3 heros. A system like the on used in XCOM2 where you start with few but you can end up with more characters in your squad. 3) As mentioned above i would like a more classic approach mode where equipment is equipment and cards are cards with their individual mechanics and strategy layer. 4)  I would like to see a simpler way as to where or whom the enemies are going to attack. Like by simply hovering on their picture instead of trying to  pick out the tiny attack symbol at the bottom of their figure amongst other tiny infos. 5) I would like a modifier description on what the different terrains do and how they can affect attacks and defences. I hope that the devs will keep developing and supporting the game because they really took a brilliant idea and made moree than the most out of it and that is why we have a very good game in our hands right now.",26.4 hrs on record																					(6.8 hrs at review time),,
8296,76561198808012262,4.0,,Recommended,easy peasy lemon squeasy i like reezes,21.1 hrs on record																					(20.4 hrs at review time),,
461,76561198006756264,29.0,,Recommended,It's great,16.3 hrs on record																					(2.9 hrs at review time),,
9796,76561198147075448,8.0,,Recommended,fun,8.2 hrs on record																					(5.3 hrs at review time),,
4913,76561198037246903,45.0,,Recommended,"You can't choose the wave you want, lots of bugs including sky hook, enemies and sometimes Elizabeth. If your game crash during progress, your progress is lost until your manual save which you can only do before wave one. Kill all enemies with this ribbons are really annoying because often one of them falls or killed by another enemy. However there are 4 different voxophones in this game, so maybe buying it with bundle while it's on sale is a good idea.",0.0 hrs on record,,
7498,76561198146303292,29.0,,Recommended,"Australia is hell on earth. Everything is out to getcha, if its not the cheeky snakes its the damn magpies slapping your scalp with their damn claws! I mean holy sh!t! they even have spiders raining down from the sky when the winds pick them up in a storm..",6.0 hrs on record																					(5.3 hrs at review time),,
10573,76561198201248007,43.0,,Recommended,Very HOT gaaem.,2.2 hrs on record,,
2858,76561197991784193,4.0,,Recommended,"After only 7 hours in I am really enjoying this game. If you see alot of thumbs down steam reviews complaining about how the game is dumbed down from HoI 3, don't let that put you off! HoI 3 was a nightmare to operate (and a mess at launch), I did like the game after seveeral expansions but there's only so many times you can spend hours of your life reorganising the OOB before unpausing at the start of each game.",275.1 hrs on record																					(30.2 hrs at review time),,
11324,76561198020340815,13.0,,Recommended,"In most cases a 2 bucks game would be a tremendous disaster or a simple shovelware, but there is charm and enough content to back this fella up, even if it's roughly 1 hour long. Runs well and plays fine, just the damage output is quite high and if you're careless you're gonna kiss the floor quite fast, but I still recommend this little gem.",1.1 hrs on record,,
1592,76561197992783558,12.0,,Recommended,"Fun multiplayer, not so much single player, good gameplay with some unfortunate problems. Combat is fun, characters play differently, there are decent build options via the skill tree and gear. Single player gets quite grindy with it being tough to pass mid-tier missions in one go. Playing with friends is much better,  clearing most missions in 1 attempt. Having a healer to support your damage and vice-versa makes a world of difference. It feels like a game that was built for multiplayer not single-player, and it could work really well if the population playing wasn't so small. It's very easy to drop into other players' public games mid mission which is nice. It uses a gearscore system, where your gear level defines how powerful you are, so in order to keep advancing you have to constantly throw out gear you like to slap in whatever new high level thing you find. Unfortunately it means you can't try to assemble gear into some kind of build while leveling. An absolute mistake in a game like this. The end game (gearscore 130+) is extremely repetitive, requiring 10+ runs to farm up decent parts to build just 1 piece of good gear. My crew gave up after we realized how slow progress was. Still, getting to that point was a good time. There is a very serious bug - if you get revived by a partner, there's a split-second window before temp invuln kicks in where you can be killed. After that there is no way to bring you back, even if your team advances to a new wave in a Colosseum. Other than that the game crashes a lot more than it should. Both issues are frustrating but don't happen frequently enough to completely ruin the game. Aside from the various issues listed above, it's a solid twin stick looter-shooter that I recommend if you can get a friend or two to join you.",77.7 hrs on record,,
10309,76561198201248007,16.0,,Recommended,"It's fine, too bad it's gone.",1.9 hrs on record,,
6854,76561198961717161,7.0,,Recommended,"one of the most fun, entertaining, creative games i've ever played; never buy it, it genuinely ruined my life forever",468.5 hrs on record																					(455.2 hrs at review time),,
1608,76561197992783558,13.0,,Recommended,"A cute base builder with solid mechanics but lacking a little depth. As always I recommend treating Early Access games as if they're complete, that way you can't be disappointed if updates are slow or stop. It has all the basics you'd want - a nice tech progression, needs to meet (air, water, food, power), exploration and foraging mechanics. Combat is new and could use some tweaks, it's not good but it's not bad. My only complaint is lightning is a little too harsh - get caught too far from base and it's easy to get zapped twice and die :x Most players should expect 6-12 hours to feel ""done"". Once you've explored the surrounding area and teched and built what you want, there's nothing to keep going for. The price is fair, the content is limited but decent, and the cuteness is 100% delivered. There's better games out there but if you are interested in this one and are good with the (relatively) short playtime, then I recommend this game.",8.0 hrs on record,,
10924,76561198045196300,4.0,,Recommended,"I usually reserve my reviews for when I complete the game, but seeing how I have essentially seen everything this game might have to offer after almost 5 hours of play, I think I can say that Gungrave G.O.R.E is just dumb fun. Admittedly I haven't played the previous games in the series, but I have seen the anime adaption of the first entry which I do recommend for people that are looking for a loose but faithful adaption of the source. To put it bluntly, this game has you playing as the most badass but edgy anime protagonist ever created, Beyond the Grave is his name and mulching goose-stepping punks is his game. Armed with his pistols, Cerberus, and lugging his coffin the Death Hauler, Grave is equal parts Desperado and Frankenstein, which is the highest honor you could give to a man like him. Throughout my almost 5 hours, the objective was simple. Kill everything or in this game's own words “Kick their Ass"" which you will probably do with absolute glee. There is a story here but don't expect it to be some groundbreaking story with a moral lesson to learn, it's simple set dressing for Grave to kill thugs in droves and honestly that's all you really need. This game does feel dated and a little shoe string, but from what I've read that's always been the case for this series and if you can turn your brain off for a few hours I think you will find yourself having a lot of fun. The best description I can give is it's a hot brass ballet of bullets and carnage where the bad guys are locked in the room with you, not the other way around.",22.9 hrs on record																					(4.6 hrs at review time),,
9188,76561198011413162,2.0,,Recommended,"Coming from a long time player, this game through its various iterations has always been fun for survival role-playing with your buddies, exploring the random gen maps and it's solid base building and defending mechanics. I think the devs have hit a sweet spot with this latest update. PVP servers are ok, they do have cheaters and the game really isn't built around PVP balancing but that's not where this game shines, it really shines in its always amazing randomly generated maps and its increasing difficulty and various vehicles and goodies for patient players. this isn't just minecraft with zombies. its so much more, this game has made lasting friendships and memories, even from its earliest buggiest builds. but don't be dissuaded by that statement, its a solid game for solo players and mostly how i like to play it these days. i think you guys should add a perma-death toggle and go gold. once you've done that try and port it to consoles and add cross-play amongst some visual updates and bug fixes and i swear this game will be a solid staple for years to come, maybe decades if you keep refining mod support. also that new intro is sexy. give the devs some love people! its been a long road but they have been faithful and this game has earned its full price tag",607.5 hrs on record																					(525.4 hrs at review time),,
7228,76561198146303292,2.0,,Recommended,Its more stomping gushing goodness.,0.0 hrs on record,,
2215,76561197998141809,11.0,,Recommended,"There is beauty to be found even in the grotesque. I'll write a proper review someday when I can be arsed to but right now I'll just say that this is one of my favorite vn's ever, and the one with easily the best writing I've ever read, but to be fair my list isn't really all that big. Sometimes life kinda gets in the way of doing the things you wanna do. One big pro to this, other than the stellar writing, is full voice acting. Also, the free upgrade patch for those who own an old physical copy of this from way back when removes those obnoxious watermarks that for some dumb reason they left in the steam uncut version. F*cking WHY >:/ But yeah, an easy way to fix that is just copypaste that folder ontop of the steam folder. Voila! No watermarks on your uncensored r*pe scenes. Oh and like other people have pointed out, this was written by the Urobutcher, the guy wot did the script for Madoka and Fate/Zero and other stuff. So if you've ever watched Madoka, you should have a vague idea of what to expect in this. Just uh, like 100x more f*cked up, lol. As good as Madoka was, I personally think this is his magnum opus. I've been thinking about this vn ever since I first played it uh, how many years ago? Probably over 5 years ago. Had a lot of interesting thoughts about it. Like for one, it reads like a biography of Jeffrey Dahmer's personal life. I've read that maybe it's supposed to be an analogy of the hikki-neet lifestyle, and while I don't know if that was the intention, I can definitely see that. Honestly, one of the biggest reasons why I don't try to do reviews for sh*t like this and Planescape: Torment is because I'd have to write up an entire f*cking essay to even begin to do these things justice. And frankly I just can't be arsed to, not when I have an *ssload of stuff I want to do.",0.3 hrs on record																					(0.1 hrs at review time),,
8544,76561198353192608,6.0,,Recommended,Best puzzle game I've ever played. Only bad thing about the game is It is criminally short,5.1 hrs on record																					(2.8 hrs at review time),,
