,UserID,Page,Game,Rating,Review,Playtime,PostedDate,Status
1219,76561197964099717,13.0,,Recommended,"............................................________........................ ....................................,.-‘”...................``~.,.................. .............................,.-”...................................“-.,............ .........................,/...............................................”:,........ .....................,?......................................................\,..... .................../...........................................................,}.... ................./......................................................,:`^`..}.... .............../...................................................,:”........./..... ..............?.....__.........................................:`.........../..... ............./__.(.....“~-,_..............................,:`........../........ .........../(_....”~,_........“~,_....................,:`........_/........... ..........{.._$;_......”=,_.......“-,_.......,.-~-,},.~”;/....}........... ...........((.....*~_.......”=-._......“;,,./`..../”............../............ ...,,,___.\`~,......“~.,....................`.....}............../............. ............(....`=-,,.......`........................(......;_,,-”............... ............/.`~,......`-...............................\....../\................... .............\`~.*-,.....................................|,./.....\,__........... ,,_..........}.>-._\...................................|..............`=~-,.... .....`=~-,_\_......`\,.................................\........................ ...................`=~-,,.\,...............................\....................... ................................`:,,...........................`\..............__.. .....................................`=-,...................,%`>--==``....... ........................................_\..........._,-%.......`\............... ...................................,<`.._|_,-&``................`\..............",0.2 hrs on record,,
6890,76561198116934331,4.0,,Recommended,its just not mature enough. destiny has the same problem. from first glance you get the impression of something cool and dark and serious but you get in and its nothing but jokes and lightheartedness. and the weapons just feel weak. in ninja gaiden you do cool moves and chop body parts off. dark souls has great impact. this game jsut feels arcady in its combat. feels like  a cartoon overall,1.0 hrs on record,,
5792,76561198088342032,8.0,,Recommended,An RTS classic,16.1 hrs on record,,
2754,76561197960269409,2.0,,Recommended,"I don't want to get too hot take-y here but...... this is the best VR game I've ever played. At least as far as narrative-driven ones go. Even better than Alyx. At it's core, it's a puzzle solving adventure game, but with a lot of care taken so the puzzles are great for VR. The premise is fantastic: you start in an apocalyptic future caused by someone travelling to pivotal moments in time and altering events.  So you have to travel behind them and set things right. (Think Quantum Leap for all you 80s people.) The narrative sounds fine for a game but for VR... it's so fantastic to suddenly appear in historically significant events and live that out. Such an awesome VR premise. There are 5 primary moments, as well as 2 main ""home base"" settings, all of which are beautifully rendered in Unreal. It's triple A quality. Most of the puzzles involve using items from one era or another in another era, so you're bouncing back and forth using hi-tech solutions to low tech problems... or vice versa. It has a generous hint system if you want it, but everything is very intuitive. Most difficulty is honestly just keeping track of where and *when* (cuz, time travel, you know) you left some random doohickey. All the systems work really well together, and just every aspect seems so well polished for VR. I cannot recommend it more highly.",8.6 hrs on record,,
10574,76561198201248007,43.0,,Recommended,"Another day, another gem from Supergiant.",5.7 hrs on record																					(5.3 hrs at review time),,
6925,76561198116934331,7.0,,Recommended,"its fun to destroy! would be wicked sweet if we  got Marvin Heemeyers ""mk tank""  and a recreation of Granby, Colorado",20.4 hrs on record																					(0.7 hrs at review time),,
8339,76561198808012262,8.0,,Recommended,good,6.1 hrs on record																					(3.0 hrs at review time),,
9279,76561198133583400,4.0,,Recommended,,6.3 hrs on record,,
7176,76561199023634809,3.0,,Recommended,"If you want to cry in your room at 1 a.m because some of random people's save date is getting lost , then play this one.",73.4 hrs on record																					(57.7 hrs at review time),,
14,76561198032898393,2.0,,Recommended,"This was one surprise of a game for me. The concept sounded good, but I figured it might be one of those games that you really need to invest loads of time into to learn all the various parts, skills, techs and strategies. Far from it! The game mechanics are simple enough and there's not a lot here that will confuse people (although some perks are a little unclear as to what they do) but man, it will challenge you! The game is challenging and your death and demise is ALWAYS your fault! There is no luck here. Laziness and lack of forethought will be your undoing. That's the beauty of this game. Randomly generated levels combined with solid game rules and permadeth equals loads of replayability and agonising consequences for screwing up. If you like games where it's all about planning without the effect of luck, undpredicatble levels and the risk of losing with one mistake, this is for you. It's not a shooter, in fact, that's your last and often unwanted resort. It's a stealth game to the max and it teases you with the random levels, as sooooo many times I've died just wanting to explore that next room, even though I've completed my mission and the exit is JUST THERE!!! Do you leave an unconscious agent so at least your game can continue, or or do you attempt to strategically resue them knowing that the gaurd numbers ar eincreasing and that they will find you eventually. Great game. If you love strategy and stealth, do not hesitate. One of the best pickups I've had in years. Updates are pretty regular, and I have had zero bugs that I am aware of. I thinkn the tea, are approaching final game stage now.   10/10",53.5 hrs on record																					(20.7 hrs at review time),,
