assigned topic,keywords
Character,"buddi, tomt, eric, caesar, karl, joe, biden, isaac, pack, everi, bundl, custom, placehold, dress, bdsm, grenad, tier, awesom, bundl, unnecessari, pvp, bone, otherwis, map, decent, challeng, stori, charm, diablo, satisfi, simplest, enjoy, successor, bad, dual, instanc, depth, build, ezio, ryzen, arent, faction, gradual, satisfi, overshadow, decent, replay, empir, game, glock, sad, hangov, cowboy, much, carton, csgo, adapt, shet, batman, satisfi, subplot, openworld, orign, play, fact, oppos, wasnt, motiv, excel, overstretch, mmorpg, carbon, horribl, enjoy, true, constraint, vietnam, releas, falloutvers, metafict, choic, samurai, text, libertarian, involv, whini, everyth, hey, fire, privat, enjoy, permiss, sit, engag, matrix, tough, twin, patch, tabl, upgrad, submit, opinion, pinbal, overlap, motiv, reinterpret, bethesda, samurai, boardgam, clunki, realism, remast, impress, pipe, qualiti, els, doesnt, fun, gameplay, aesthet, bother, benchmark, timeless, offer, lotr, besid, seri, isnt, roguelikelit, base, true, grindi, wrap, deck, hybrid, tactic, enjoy, decent, roguelik, deckbuild, upgrad, attract, break, sot, quasimorph, mindless, immens, form, psycholog, fair, rtx, jumpscar, sorri, guard, rpg, enjoy, ultracop, subermass, simpl, differ, ui, tire, fun, varieti, dimension, didnt, someth, elect, addict, cent, entertain, extrem, kinda, start, hour, realist, everyon, td, bear, easi, didnt, gameplay, supercool, bias, offer, consist, grindi, stupid, soul, ok, prescenc, nobodi, tower, special, play, cleanser, depressuris, morgott, deck, requir, easi, chararact, havent, pathway, sure, unpredict, excel, semirandom, dungeon, prick, base, break, candi, complet, nft, play, ui, wolfstay, battlerit, sad, babi, play, hive, hour, cartman, innov, multi, leagu, play, realli, lock, lortespil, kinda, linear, cnt, fetch, nxt, journey, gameplaywis, invest, bother, ct, anybodi, fairli, rate, realist, excel, month, shooterstealth, linear, mostli, alot, prompt, exfiltr, uninterest, affin, wear, likeabl, cyberpunk, astonish, excel, hike, bethesda, honest, releas, stress, everi, keyboard, dungeon, hypocrisi, transmit, apiec, fatiguehungerthirst, batch, vocabulari, ineffici, princip, havent, gameplay, washingmachin, youll, qualiti, overwhelm, censor, tho, glitech, unlock, rememb, beta, deckmenu, tooltip, rippoff, phasmophobia, everi, say, select, casual, splitscreen, gameplaywis, excel, capabl, skip, pathet, gladli, amd, fact, entri, enjoy, gameplay, becom, glad, passiv, tarnish, empir, catalogu, didnt, everyth, elizabeth, rpg, alreadi, didnt, improv, earlyish, render, dialogu, anymor, ambianc, decent, gameplay, glad, evenicl, upsid, expens, sure, prologu, swindl, varieti, wasnt, clearli, break, steamdeck, requir, concept, upgrad, beta, strategi, ui, see, game, smartest, citi, layer, humbl, battl, guid, liter, decent, challeng, gameplay, glad, becom, nonogram, paus, redeploy, elabor, spend, realli, underwhelm, grind, terribl, becam, cursor, construct, shouldnt, area, everyon, expedit, tilelay, puzzl, minimalist, combat, legit, grand, isnt, eleg, srpg, pretend, base, game, majest, citi, excel, redefin, doesnt, wow, charact, chill, anymor, rpg, icariu, softlock, congratul, rememb, sure, lack, versionwel, anymor, linear, dungeon, realist, easi, skip, chines, playabl, collect, grind, function, treesstonescopp, puzzl, gameplay, necessarili, havent, optim, major, tax, alland, hardcor, start, gameplay, coolest, poorli, wast, templar, dialogu, structur, limit, linear, batallion, casual, strategi, salem, requir, easi, sit, half, mean, easier, disabl, dungeon, tip, simul, concept, break, involv, upgrad, thankyou, alot, checkmat, playtim, transport, trim, excel, workerplac, couldnt, inflationari, teach, definetli, requir, gameplay, workplac, upgrad, ok, unnecessari, chequebook, dungelot, maintain, infrastructur, array, rpg, mercenari, havent, likeabl, upgrad, cheer, express, fact, racingderbi, contrast, rpg, necessari, showcas, keybind, principl, stay, optimis, alot, introductori, doesnt"
Gameplay,"replay, minut, quit, stomach, hour, couldnt, annoy, gunplay, soak, talk, bundl, fish, didnt, offshor, useless, alreadi, buyabl, play, system, spi, deck, abilitiesunitsbuild, cancelconfirm, true, fullscreen, readi, autopilot, rival, threshold, basic, digit, worlf, rulebook, everybodi, play, ui, boardcard, okayish, mechanicwis, consult, ui, watermelon, play, hell, interfac, hous, crash, chang, minut, youll, rpg, alreadi, overcomplex, didnt, pregger, nirvana, equip, innov, sit, shootingbombingfootbal, crunchi, humor, servic, youll, ectoplasm, unstabl, command, borderland, wick, calori, littl, reflex, game, neat, metroidvania, goofi, fr, bruh, gud, make, gamepad, releas, exportimport, favourit, spawn, inabl, view, fraction, sorri, phonetablettactil, rpg, didnt, jurass, linuxproton, underwhelm, disconnect, microtransact, anymor, display, fact, roguelik, react, worthless, sit, wasnt, interfac, headglitch, halo, ui, devpublish, keyboard, properti, isnt, skip, fighter, pergam, reload, ssft, becom, medkit, combat, suppli, havent, offer, artstyl, usag, react, everyon, tweak, unintent, gameplay, slidingontheoppsinspaceforcingthemtocreatemymegaspaceship, aesthet, wellthey, definetley, battl, refund, warfar, sit, becam, play, realli, everyth, dull, isnt, minut, gimmick, tediou, formula, dragslay, rpg, calori, cutscen, stupidest, enjoy, slog, introduct, peac, spectrum, quit, puzzl, besid, concept, gamebreak, franchis, chang, hr, children, didnt, dialogu, rpg, autocomplet, qualiti, didnt, sit, rate, fact, upgrad, multitaskingfriendli, confid, rpg, sanctu, polishingbut, didnt, improv, trine, react, half, motiv, uboot, combat, privat, didnt, likeabl, keybind, vocabulari, nocheckpoint, multitask, satisfi, becam, rpg, settingsurround, beauti, hadnt, weakest, sequenc, stay, adrenalin, recomend, minesweeperesqu, rpg, consciou, upgradeslevel, splashscreen, likeabl, fact, slog, optimum, didnt, crew"
Music,"hood, yup, bites, much, classic, good, nope, ye, yeah, buck, creativ, sea, laughabl, friend, bankrupt, eo, mani, hair, worth, game, anythink, vibe, monument, damn, grandper, littl, abandon, meltdown, look, wow, wth, stuff, great, job, brilliant, gta, opinion, nutshel, hong, stori, hybrid, entri, sleep, tho, probabl, halflif, hasnt, life, multiplay, haha, discourag, remak, complet, mani, insuffer, casual, delight, bug, room, voic, play, puzzl, gmod, first, clair, doom, basic, inaccur, justifi, rememb, podcast, hear, shotgun, greatest, workunfortun, payn, true, diablo, ujibfdiyugvbdyuhgvf, worth, maxpayn, peopl, quit, comput, rock, rockstar, bdsm, card, dumbest, awesom, remak, play, suppos, tri, origin, fun, inexpens, ludicr, ton, meet, ye, special, world, price, alot, game, favourit, fromsoft, inde, folk, first, titl, hollow, goti, hotlin, clown, bless, overwatch, getoutofmyheadgetoutofmyheadgetoutofmyheadgetoutofmyheadgetoutofmyhead, base, play, havent, ohio, men, twa, gamer, unpolish, proudest, ape, wast, scroll, day, review, ok, lick, music, wouldnt, ubisoft, templat, monologu, similiar, checkpoint, warsaw, honestli, gamewis, tediou, entertain, didnt, atmospher, qunari, anymor, polish, risk, purest, sunday, duck, societi, videogam, havent, peopl, lolwat, aton, play, unfortun, hexcel, scam, anymor, flag, charact, fsr, cuz, start, ratio, playlist, recommand, playabl, wouldnt, definetley, euro, mow, amaz, pun, consid, refund, learn, earli, choos, roguelit, excel, half, havent, resurrect, froggi, strengthen, guitar, gtao, satisfi, polish, etc, unnecessari, stay, dlc, havent, church, weakest, play, german, satisfi, crazi, didnt, list, destruct, granbi, micro, hehe, stori, doesnt, gibson, gameplay, instakil, remast, clementin, bland, run, everyth, mechan, peopl, stamina, reset, sequenc, isnt, decent, occasion, preview, mous, gameplay, regularli, tast, involv, havent, indi, microtransact, compat, half, tea, play, mechan, arent, everyth, experi, challeng, divisiontyp, highland, difficult, vibe, grind, easi, blightstorm, arent, seamstress, upgrad, challeng, technic, anymor, display, music, didnt, ubisoft, dialogu, sniper, overpr, excel, countless, laughabl, expens, gameplay, everspac, honestli, complet, see, corpor, mcz, skip, add, scanner"
Performance,"gamemod, buggi, orc, stay, stori, recent, clunki, allow, import, half, pretti, manipul, refund, dull, everyth, jump, yeah, curv, crosshair, element, game, weirdest, badass, scroll, salim, complet, fpsrpg, greatest, van, wont, ubisoft, everyth, boycott, patch, requir, multiplay, suggest, rockstar, unecessari, refund, underground, annoy, divorc, testicl, havent, freeman, necess, biolog, baddest, relax, frog, wont, play, masterpiec, detect, littl, crazi, miami, crack, someon, gamebreak, properli, expans, excel, honest, comput, orwel, mbitss, saveload, skip, hacker, obligatori, refund, fact, manag, anymor, react, start, nexu, wouldnt, odin, upgradedirect, strateg, tooltip, resolidifi, lowqual, engag, vaulter, autopilot, swayingswingingdestruct, rpg, necessari, lmfao, speedbump, everyon, downgrad, perform, walk, stealthbackstab, dialogu, unlock, sluggish, waypoint, rememb, wander, programhardwar, purchas, ocd, premis, charact, gameplay, paywal, stupidlysimpl, paus, asid, havent, rampag, vsync, weakest, enjoy, gameplay, goti, androidiphon, whisker, rtard, linear, everyth, spend, amaz, havent, rpg, pausableslowmo, didnt, mous, fact, becam, raceclass, standard, deckbuild, sequenc"
Score & Ranking,"hate, busta, tax, stand, game, bah, everyth, divin, gon, caus, pay, extrem, chines, certifi, swim, social, sensit, intern, govern, element, gameplay, fastpac, got, honestli, excel, spire, deckbuild, spend, predetermin, cuz, realli, rate, gameplaywis, metro, jumpscar, youll, poor, excel, logist, easi, gameplay, essenc, stalwart, carddeck, hasnt, sure, excel, everincreas, minmax, easi, gameplay, becom, honestli, pebbl, superweapon, excel, transit, rate, disappoint, sequenc"
Social Experience,"ok, guess, sure, good, zombi, firearm, hell, multiplay, list, move, famili, stupid, activ, mess, playthroughid, underpr, microwav, stupid, scandanavian, alot, invest, demon, releas, environ, game, surviv, realli, multipl, decentish, stay, didnt, environ, scari, kinda, realli, twinstick, enjoy, wouldnt, peopl, nerv, steampunk, addict, btec, lag, gta, passabl, suggest, unchart, voic, multiplay, doesnt, pirat, naruto, translat, playabl, preteen, sir, beautifuluniquefunrelax, half, coop, havent, definit, empir, needless, gta, humbl, expens, pointless, payday, wont, zombi, nope, play, peopl, coop, glad, funcreepi, express, hour, couch, anyon, addict, play, coupl, lovecraft, varieti, casual, persist, see, groundbreak, gunspetrolmatchstick, cook, coop, everyth, faction, fantasi, rockpaperscissorsapproach, cyberpunk, underwhelm, doesnt, dozen, linear, play, determinist, mobi, practic, polish, cant, boringrepetit, faction, multiplay, underpow, excel, decent, gatheringcraft, penalti, quit, realli, sequenc, impress, everyth, type, youll, crater"
Story,"expans, inde, neat, much, ah, cool, playstyl, citi, censorship, crazi, lightbear, modern, terraform, heret, wander, textur, simul, slumlord, flight, play, wickth, presid, collaps, godzilla, sydney, liter, vampir, bland, tunnel, trigger, survivorslik, testament, sure, goodreplay, tetris, major, addict, youll, readi, challeng, wonder, year, spend, littl, suck, healthier, gay, timeless, bound, hustl, enjoy, dull, chartin, wast, weaker, play, rpg, cautionari, shame, bread, depress, releas, overload, cancer, realist, chase, redempt, amaz, play, alien, brutal, undersea, baldass, peopl, first, oppress, gameplay, remind, gladiat, chang, dialogu, sens, underr, station, traffick, encourag, tux, legend, dish, cluncki, cqc, battl, year, itll, radioact, wolf, deathloop, curs, middl, annoy, sure, textur, cook, famili, standoff, manga, rpg, necessari, hasnt, limit, automap, cheerlead, upgrad, pace, dialogu, compliment, gameplay, amazingli, havent, curs, futur, sarcast, sexism, lite, ye, disneyland, rpg, consequ, youll, structur, upgrad, bland, victorianedwardian, exponenti, motiv, select"
