UserID,Page,Game,Genre,Rating,Review,Playtime,PostedDate
76561197986997483,9,ENDLESS™ Legend - Shifters,"RPG, Strategy",Recommended,"One of the best expansions, in my opinion.  The race is fine, it's kinda cool that it is very mobile.  This comes up especially if you also have some of the additional quests DLC's that make you travel to far flung corners of the map to complete them.  I suppose maybe they added those quests specifically to make this faction more competitive since I've seen people say they are under powered in multiplayer.  (I couldn't say because I only play multiplayer cooperatively) But the best part of this expansions is the Altar of Auriga and Pearls. Pearls are a new resource that shows up in winter and can be sacrificed at the Altar of Auriga for a variety of bonuses.  Some of the bonuses are nice little boosts but some feel so necessary you almost look forward to winter.  Winter and Dust Eclipses (from a later expansion) add such a nice change of pace to the game, and whereas winter originally mostly put on the breaks, with this expansion it's much more interesting and dynamic.",0.0 hrs on record,N/A
76561197986997483,9,ENDLESS™ Legend - Guardians,"RPG, Strategy",Recommended,"This feels more along the lines of DLC than a full expansion.  The additions are not necessary.  I do like most of them, but I'm not sure i'd notice if they went away.  Mostly this adds Legendary buildings, which are like Wonders from CIv, but I think they are are more powerful and there are also fewer of them.  I find I almost always get them before the AI.  I like that they count as a district but don't require a pop to build them allowing you to expand the borders of your city a bit more rapidly.  Also, like districts, they can also be upgraded by being surrounded.  That's a lot of fun. There are also legendary deeds.  These are basically competitive quests.  The rewards are a nice bonus but not enough that I would every change my tactics to try and achieve one.  If I happen to get one while I do what I would be doing otherwise, that's fine. Midway in quality between these two things is the Guardians.  They are powerful late game units, maybe a bit like Behemoths in Endless Space 2.  They are expensive to build and must be researched first.  Is it worth it?  Maybe...  I think the best thing about them is that they look cool. So, I recommend this expansion mostly for the wonders, but if you're going to skip an expansion, this is second from the bottom.",0.0 hrs on record,N/A
76561197986997483,9,ENDLESS™ Legend - Shadows,"RPG, Strategy",Recommended,"I have played games with cool espionage options.  7 Kingdoms II, for instance is all about espionage, and although it's been a LONG time since I played it, I'm certain it's more interesting than what Amplitude has done with it in this and Endless Space 2.  At least in this it's not an actual chore, but it's strange that it has so little effect on the game unless you're actively pursuing it.  Plus it takes a hero to do it and heroes are so expensive, that is not what I want to use mine for.  Pillage is fine as a wartime option, but definitely not worth the price of the expansion.  This is the only Endless Legend expansion I'd give a thumbs down to.  But....  if you're getting everything (which I'd recommend) it's not going to make your experience worse to have it turned on.  You probably just won't notice it.",0.0 hrs on record,N/A
76561197986997483,9,ENDLESS™ Legend - Inferno,"RPG, Strategy",Recommended,"I can't comment too much on the Kapaku, and maybe I should play more of them before I review this expansion, but even if I hate playing as them, I would still heartily recommend this DLC for the Dust Eclipses!  So much fun!  More strategy games should add weather effects like this to keep things interesting from turn to turn.  I love the shrines reopening and the temporary bonuses to pick up on the map.  I love having something for you armies to do when you aren't in the middle of a war and would otherwise just be pressing end turn (not that this game has nearly so much of that as a certain other massively popular 4X strategy game.)  And also it's just so pretty.  Big thumbs for this from me.",0.0 hrs on record,N/A
76561197986997483,9,ENDLESS™ Legend - Symbiosis,"RPG, Strategy",Recommended,"Both the mykara and the Urkans are great.  For me the Urkans take the place of what would be a minor civilization in other similar games.  They pop up on the map during the midgame in unclaimed territories and claim them for themselves.  There are basically two ways to deal with them, you can bribe them or attack.  if you manage to gain control over them, you get a super powerful unit you can move around.  I think it adds a lot of interest, and gives something for your troops to do if you don't want to be fighting the other players. The mykara are also interesting.  I'm not so sure about their quest line since I didn't get very far into it before being on a different path to winning, but I enjoy playing with one beefy city, but still being able to claim resources outside your border.  I imagine they are easier to play on larger maps with few players and more unclaimed land, since you can't claim resources under your opponents' area of control.  I had a bunch of other nations right on top of me in my game, but fortunately none of them were too war hungry. I'm a bit boggled by the number of poor reviews on this expansion, even moreso than I was with the last Endless Space expansion.  I feel like people want an expansion that leaves the game exactly the way it was before so they don't have to adjust any of their tactics.",0.0 hrs on record,N/A
76561197986997483,9,The Invisible Hours,"Adventure, Casual",Recommended,"Overall, I liked this game.  The mystery was interesting.  And I liked choosing to follow this group of people or that group of people around and eavesdrop on them.  What it reminds me of most is actually a text adventure, Suspect, by Infocom (and I think they had other detective games as well)  But to solve it, you had to play it many times as well, and the NPC's in the game would be in different places at the same times, so you could only follow up on one thing at a time.  This is obviously a lot more advanced than that, but I do feel like there's still a way to go in the genre.  Particularly, the end of this game isn't very satisfying, and I think it's because even at the end you're still pulled one way or the other, and even following on what should be the main mystery feels like tying up a loose end. (I have an additional complaint about one of the resolutions but I don't want to talk about it because it would be a spoiler.)  So, yeah.  The game works when it works and it doesn't when it doesn't, but I definitely think it's worth your time if you like detective novels.  Here's hoping Tequilla Works really hits it out of the park with more interactivity and more thought to a climax next time, because I'll definitely be playing it.",4.4 hrs on record,N/A
76561197986997483,9,Four Last Things,"Adventure, Indie",Recommended,"The art is just wonderful, and it's a great pleasure to admire it so clearly and in such detail.  I like seeing the different paintings all together and interacting and animated, too.  The premise of the game is fun and probably attracts a few people to buy it.  The actual gameplay is a bit abbreviated, however.  None of the puzzle require much thought and as fascinating as all the characters have been drawn, I would personally like to learn more about them and get to interact with them more.  There's a book by Umberto Eco called Baudolino that I suppose I had similar feelings about.  The first half of that was a very accurate portrayal of the middle ages, then in the last part the character journeys to the East, but instead of finding China he finds all the weird creatures from the marginalia of scribe's books.  That's such a great idea, but unfortunately, he didn't do much with them and then went home again.  As I say I feel a bit similarly about this.  Here's hoping the sequel turns all this gorgeous art into a living world.",1.8 hrs on record,N/A
76561197986997483,9,Pony Island,Indie,Recommended,"I guess I feel like this game is a bit derivative of Frog Fractions, which was more surprising to me because I just clicked on it randomly on Kongregate, which I think is how you have to find something like this.  When reviewers act like they do with this game (""Just play it!  I can't tell you why!!!"")  That's as good as telling you why.  But it's not like what it is is hidden anyway, even on the store page. Surprises aside, it is mostly two games, one is an endless runner where you click the left button to jump and the right button to shoot.  The other is a game that tries to appear like a coding game, but isn't.  a cursor progresses to the bottom of the screen and you put instructions in its path to move left or right or warp.  Well, I don't really care for the endless runner game, and the other is too simple to really be a logic puzzle game, and its method to get harder is just to make you move the instructions faster.  Of more interest is exploring the devil's computer in between the levels, and I think a lot more could have been done with this.  Personally, I didn't find much of interest here.  and shouldn't there be?  Two games that I thought were more interesting that involved involved exploring a strange operating system interspersed with puzzles include Sorry, James, and Macdows 95, which I would recommend over this.  But I would be interested in this designers other games, especially Inscryption looks promising to me.  I heartily enjoyed the demo.",2.5 hrs on record,N/A
76561197986997483,9,Poker Night 2,"Casual, Sports",Recommended,"It's kind of fun to have the characters you're playing against in video poker carrying on conversations.  Although, it's probably only good for two or three plays before the start repeating.  But maybe that's enough, if the game is cheap enough.  Currently it's unavailable, so I suppose that doesn't matter.",8.5 hrs on record																					(7.3 hrs at review time),N/A
76561197986997483,9,Ahnayro: The Dream World,"Adventure, Casual, Indie, Strategy",Recommended,"I haven't finished this, but probably won't.  For how much the store page talks about ""puzzles"", all I've seen so far is more along the lines of trivia.  You'll be shown a couple of pictures and some text and be asked to choose some letters from a ""sigil"" to spell out what the pictures are asking for.  Well, either you immediately recognize what the clues are of and put in the answer, or you just type the clues into google and maybe you read a wikipedia article and then type in the answer.  Perhaps the game gets harder?  But I get the idea that harder would just be more obscure trivia--not things that I would call puzzles, which would require another step once you get the trivia.  I mean to say, using the facts in some clever way to get the answer, not just inputting them directly. The story isn't very engaging either, perhaps because of the way it's presented with you reading some woman's dream journal and looking at documents from the psychiatric facility she was being treated at.  It's all out of context and just doesn't feel very immediate or real. If someone has completed the game and I am wrong about what the puzzles look like going forward, please reply to my review.  I am willing to give the game another chance.",3.8 hrs on record,N/A
76561197986997483,10,Pivross,"Casual, Free To Play, Indie",Recommended,"Pretty fun.  Easy controls.  Because you're constantly having to turn the puzzle around to look at all the sides, it kinda feels a bit like a hidden object game mixed with a nonogram.  :-P  Give the demo a shot and see if you like it as much as I do.  I'm going to buy the level pack.",0.5 hrs on record,N/A
76561197986997483,10,hexceed,"Casual, Indie, Free To Play",Recommended,"Too easy.  I never find I ever get stuck unlike similar games.  I pushed all the way though the first world hoping I would open up harder things in later worlds, but they remain the same kind of levels just in a different color scheme.  The only method the game has of increasing the difficulty is to make the levels enormous.  This works only because you get a bit zonked clicking all the hexes that are so obviously empty or filled and you click the wrong mouse button on one.  Really there are much  better minesweeper variants out there.  Maybe even nonograms are a better bet.",3.0 hrs on record,N/A
76561197986997483,10,Phantasmagoria 2: A Puzzle of Flesh,Adventure,Recommended,"It's difficult to find positive things to say about this game, but I will try.  It's nice it has a bisexual main character, and the acting is okay.  That's about as far as I'll go. There really isn't any game here to speak of.  The closest thing to a puzzle in the whole game is telling your pet rat to get your billfold under the couch, and my gosh if that isn't pathetic.  There are also a couple of guess the password puzzles for breaking into computers, but those are so simple too, and a puzzle at the end of the game involving an alien circuit board that is not on the level of anything from Myst or the Dig. So, maybe it's an interactive movie?  Those are quite popular these days with titles like the Walking Dead and Life is Strange.  Well, those usually involve some choices you have to make.  There is only one choice here and it's at the very end of the game to decide which of two equally unsatisfying and short endings you get.  The lack of choice is a problem overall.  You have to do everything and get every single movie clip unlocked in order to move on.  this includes doing wrong things like trying to open a bolted shut toolbox with a screw driver that will not open it.  If you don't do this, the new chapter will not trigger.  Very tedious.  Really the game is click on every single hotspot, watch the associated movies, click on every single hotspot again and again until you've made the rounds enough times for the story to progress.  It's ridiculous.  Why is it a game instead of a movie? There might have been some room for your choices to affect the game as far as which of three love interests you wind up with.  but here to you have to pursue each one as far as the game will let you, and can't choose to focus on one, and the game has predetermined which one you will end up with. So, yeah, really this ought to have been a budget movie, if it needed to be anything.  As it is, the interactivity is really a hindrance to getting involved in the story because it's just a stumbling block of ""where haven't I clicked yet today?""  that ruins any hope of any suspense.  In general, I would say I find horror games scarier than horror movies because you are forced to open that door where something might jump out at you, while in movies when it gets scary you can disassociate from it a bit.   Here the game does the disassociation for you by stopping things every 2 to 3 minutes. If you want to play an FMV game, I recommend Gabriel Knight 2, the best in the genre and one of the best adventure games period.  Also, there are some newer FMV games, too.  There's one here on steam called Yoomurjak's Ring, that I'm about half way through,and has an intriguing story and sort of virtual reality feeling since it allows you to walk around the streets of a real city as though you're in google maps street view.  I wouldn't recommend playing this, if you must know what it's about, maybe try a Let's Play video, the same experience but all the mindless clicking will be done for you.",4.5 hrs on record																					(6.9 hrs at review time),N/A
76561197986997483,10,MIAZMA or the Devil's Stone,Adventure,Recommended,"This is not as good as the first game in the series, Yoomurjak's Ring, the plot of which was far more intriguing, but this one is still worth playing. primarily for the puzzles in the second half.  I think part of the problem with this game compared to its predecessor is the pacing.  Here all the detective/investigation work is in the first half of the game and all the puzzles are in the last half.  Because of this you get a bit bored of each before they are done.  Additionally, I really wish this Steam version had an option for Hungarian voice with English subtitles.  It only has English dubbing, and while a couple of the actors are okay, the majority are terrible.  It's also a bit disappointing that, although it bills itself as a full motion video game, this is only once in a while.  Mostly you look at still images of the actors. Overall, the game is unique and you learn a bit about Hungarian scientists, and their contributions in physics, which is very nice.  I might have heard, at some point, the Hungarians found the first evidence of the neutrino--for instance--but this put it in context and made me care about it.  The puzzles are all logical and solvable without a walkthrough, though a couple of things take quite a bit of trial and error since they don't work the way you'd like them to.  What I don't really care for is all the walking around required to solve them.  And quite often you see just what you are supposed to do and where to go to do it, but even if you go to the proper place, the game won't let you do the thing until you've talked to another person in a different room who tells you to do the thing you already know. So, yes, this is a very weak recommendation.  I'm sure there are better adventures games than this out there to spend your time with, but I suppose I'm clicking the positive button on the review because I didn't regret my time with it and I would like to see another similar educational game in series.",11.6 hrs on record,N/A
76561197986997483,10,Lexica,"Casual, Indie",Recommended,"I recently played a game, Wordland that reminded me of this one and then I saw that I never gave this one a review.  Both Lexica and Wordland are variations on word jumbles, but Lexica is a bit harder.  In it you have letters on the outside of the board that can be slid into place on the main board.  You have to slide them so that all the blanks are filled with real dictionary words.  It's fun if you like the sorts of games in newspapers.  I like that it opens in a tiny window and is multitasking-friendly.",4.8 hrs on record																					(4.7 hrs at review time),N/A
76561197986997483,10,WORDLAND 2,Casual,Recommended,"It's a lot of fun.  The video makes it look like it might be too easy, but in harder modes (available from the start) extra letters are added which make the word not quite so obvious.  I'd recommend it if you think you'd like a harder and more interesting spin on a word jumble.",1.2 hrs on record																					(0.5 hrs at review time),N/A
76561197986997483,10,ENDLESS™ Space 2 - Awakening,Strategy,Recommended,"Nakalim are fun to play.  I wish some of the runner up positions for the Academy were more useful, but from my playthrough it doesn't seem like getting an extra fleet is game breaking.  It's a nice bump for players who are more economically minded.  Of course, getting it costs quite a bit of Dust so it's a give and take for them.  For me this expansion is a win.  None of the expansions are strictly necessary but I would rank this one right below the Vaulter's expansion. Then the Hissho one.  The Umbral Choir expansion is the one I don't like.  I find all the hacking stuff tedious.",0.0 hrs on record,N/A
76561197986997483,10,Seven Kingdoms 2 HD,"Indie, Simulation, Strategy",Recommended,"I'll post a more complete review later, but I saw a couple of reviews saying this has problems running on windows 10 (perhaps it's been updated since those reviews?).  It works perfectly for me and I enjoy that it's in widescreen unlike the original version of the game.",1.4 hrs on record																					(1.3 hrs at review time),N/A
76561197986997483,10,Tabletopia,"Casual, Indie, RPG, Simulation, Strategy, Free To Play",Recommended,"Tabletopia has a ton of different board games and generally good controls for most of the games.  A few cost money, but the vast majority are free.  For playing with other people online I prefer this to sites like boardgame arena where it forces the rules on the rules on you because it's easy to take back moves if someone doesn't understand something, and also you don't run into problems where you click a thing and it does something different than you intend.  If a person in your group has a spotty internet connection it will cause problems in this game and a piece may disappear for some people.  But I don't think that's really the fault of the game.  I will also add that the browser version of this game seems to work better than the steam version.  Sometimes the steam version hangs when loading the game if in fullscreen, but I've never had any problems with the browser version.  I can't compare this to tabletop simulator, but that costs $20 and apparently does the same thing, so if I don't have any complaints here, I can't imagine what I'd get out of them.",296.5 hrs on record																					(200.6 hrs at review time),N/A
76561197986997483,10,Dust: An Elysian Tail,"Action, Adventure, Indie, RPG",Recommended,"I think the basic game mechanics, the combat and abilities, are fun.  But there are a lot of negatives when it comes to level design and story.  There's just so much backtracking in this game.  If you find a chest, you might not be able to open because you also have to find a key which is also hidden around the world.  So whenever you find a key or two then you have to go back and refind the chests you couldn't pick up at the time.  Also many of the quests involve you talking to the character you received the quest from again, well it's pretty tedious to walk through the quite large town area looking for the character again.  Everything is just repeated. Also, playing on normal difficulty the combat is a bit simple, so I'd recommend you start on a harder one.  On this note, I question the experience point system.  There's an area near the beginning of the game where you have to do this flying attack thing to get a chest far above the level, it is difficult to pull off and if you empty the air of enemies you must leave the screen and try again.  Well, in a normal platforming game without experience points, trying the same thing over until you get it is fine, but here while I was trying and failing I probably gained half a dozen levels and each level gives you an enormous stats boost.  Now, I'm definitely overpowered for the nearby monsters.  Why have an experience point system at all in a game like this?  Just make the monsters for the area as tough as you think is appropriate for the player's skill level.",5.5 hrs on record,N/A
76561197986997483,11,MANDAGON,"Adventure, Free To Play, Indie",Recommended,"Nice pixel art, nice music.  Nothing interesting about the gameplay or story.  But I suppose it's free, so I'll give it a positive review in hopes that the designer makes something more interesting with a little encouragement.",0.7 hrs on record,N/A
76561197986997483,11,Simply Chess,"Casual, Free To Play, Indie, Strategy",Recommended,"Although I think this was a pretty good app long ago. now, lichess online is a much better option.  It uses the same AI, but after you've finished a game, it will generate an analysis of your game afterward to help you improve.  It also has puzzles and a large community when you're ready for playing against humans.   I suppose this isn't much of a review about this app, but it isn't an original game, and it's competing against a lot of applications that do the same thing better.",5.8 hrs on record,N/A
76561197986997483,11,Zen Chess: Mate in Two,"Casual, Strategy",Recommended,"Well, I haven't finished the game yet, but I see a lot of reviews saying some of the puzzles have more than one solution, but the program only accepts one.  I haven't seen a single such problem yet.  I think the developers would have save themselves a lot bad reviews if they'd have included enough of a chess engine to show people why they are wrong with their supposed solutions. I think these games are great fun.  I just hope they are making me better when it comes to my end game in actual chess.  Since you know the checkmate is two moves, you know to look and look until you find it.  In a real game it's more difficult because you don't know how far away the checkmate might be.",3.4 hrs on record																					(2.3 hrs at review time),N/A
76561197986997483,11,Zen Chess: Mate in One,Casual,Recommended,"I'm a player who is reasonably good at the mid game of Chess and (at least against other relatively unskilled players) can usually keep up an advantage in captures.  But I've never been very good about pinning down the king at the end and things fall apart for me unless I have still have two rooks, or a rook and a queen.  This program lets me practice just that end game, and so it's getting me better at seeing where a king can and cant' move and how different pieces besides the rooks can be used to check mate him.  If something could be added perhaps after beating the levels they could be collected by what pieces were used in the check mate so I could look at one after the other and see just what made up the patterns.",7.0 hrs on record																					(4.2 hrs at review time),N/A
