UserID,Page,Game,Genre,Rating,Review,Playtime,PostedDate
76561197986997483,1,Age of Wonders III,"RPG, Strategy",Recommended,"I could never really figure out why I didn't care for the Age of Wonders series when I liked all the other similar games like Disciples, HOMM, Etherlords.  On the one hand, the games are often the prettiest examples of the genre at the time they came out, but then you open the package and everything is just so slow.  All the units move slow, there's nothing very interesting to explore on the map other than cities you have to conquer, when you finally upgrade your hero, none of the skills are exactly game changing.  the first game had some terraforming spells and units and I always hope the new ones will build on that but if anything terraforming becomes less important (certainly compared to the slightly more Civ-like game Warlock).  I don't know.  I just need more of a feeling of exploration and development beyond a bigger army and conquering the map.",16.5 hrs on record,N/A
76561197986997483,1,Pilgrims,"Adventure, Casual, Indie",Recommended,"This game isn't really my sort of thing.  First of all it looks like a card game, but there's no card game element at all.  The cards are just items like in any other adventure game.  Basically, the game is that you drag the items over various things in the environment and see what happens.  it's not really puzzle solving like in a traditional adventure because the game wants you to try every combination so you can see all the cute animations.  It also wants you replay the game many times because you can't see all the combinations in one play through.  I guess I find all the trying everything a bit tedious and would rather the story be presented more straightforwardly as a choose your own adventure, maybe.",1.0 hrs on record,N/A
76561197986997483,1,Cosmobreeder Yiffai,"Action, Adventure, Indie",Recommended,"I really like the map layout and all the secrets and upgrades and extra things to do in this platformer, but the boss fights are really difficult slogs that I'm just not up to.    The game offers cheats if you die and i've decided to take them and make my attacks twice as strong for each boss, I guess because the cheats are suggested by the game, I will still give it a thumbs up. Again, the parts that aren't the boss fights are fabulous.  It's probably the most enjoyable platformer I've played since Monster Boy and the Cursed Kingdom on that account.  I would have a love a Star Fox game like this one the SNES back in the day.",5.7 hrs on record																					(5.3 hrs at review time),N/A
76561197986997483,1,Samorost 3,"Adventure, Casual, Indie",Recommended,"I played Samorost way back in the Kongregate days and thought it looked neat but there wasn't much game there.  I think my sister bought me Samorost 2 here on Steam, though I may be wrong about that, but regardless, I didn't really care for that.  it was very short for a premium game and the art was about the same as Samorost 1.  In neither case were the puzzles worth mentioning since there were all click on everything that is clickable then find out if you progress.  But THIS GAME is GREAT.  It has so much more to show than Samorost 2 and the puzzles finally feel more like puzzles.  Part of why this is possible now, is because the game does more to tell you what the goal of the area is rather than just let you find out when it happens.  The environments have a lot more diversity and detail too.  I like the universe which at times reminds me of The Little Prince or Fantastic Planet (La Planete Sauvage) and even a bit of the works of my favorite animator, Jan Svankmajer, I say it reminds me of these things, but it is still very much it's own thing. After a kind of neat first game, and a disappointing second game, finally there's one that's highly recommended.  And I probably wouldn't have found this out if the developers hadn't been supporters of Ukraine.  I bought the game because it was on a sale where they gave all the profits to a humanitarian aid charity for Ukraine.",2.2 hrs on record,N/A
76561197986997483,1,Samorost 1,"Adventure, Casual, Indie",Recommended,It's cute.  It's free.  It's short.,0.2 hrs on record,N/A
76561197986997483,1,Demeo,"Adventure, Indie, RPG, Strategy",Recommended,"The package is very nice.  The controls to zoom around and turn the camera work really well in VR.  But it's missing the parts of an RPG that make it interesting for me to play.  There's no focus on story or solving puzzle or riddles, just opening doors and fighting monsters.  A bit like Hero quest, I guess.  Not for me.",0.3 hrs on record,N/A
76561197986997483,1,Isles of Sea and Sky,"Adventure, Indie",Recommended,"I haven't finished this yet, but I love what I've played so far.  i particularly how they fit more than one puzzle onto 1 screen and that there are lot of different types of puzzles, some of which are sort of secrets you'd see in NES games but are much better clued here (but you don't necessarily recognize the clue when you see it.)",24.1 hrs on record																					(4.0 hrs at review time),N/A
76561197986997483,1,Aeon's End - The New Age,"Adventure, Indie, Strategy",Recommended,"The campaign mode is great--not because of the boring story but because I like the way you upgrade the cards you buy from the supply from boss to boss.  It makes me feel like I'm developing my characters and gives the game a bit more substance.  I think it could be better still.  Rather than choosing different heroes each time, it'd be nice to have the same ones and choose ways for them to develop too like in the Legacy version of this.  I really hope they make more of this.",0.0 hrs on record,N/A
76561197986997483,1,N/A,N/A,Recommended,"The colors seem really over saturated to me.  it's not as nice to look at as the original game.  i suppose that's just personal taste, but it doesn't make me want to rebuy it.  Also, it's kind of blurry when I run which makes me feel a bit sick.",0.3 hrs on record,N/A
76561197986997483,1,A Date in the Park,Adventure,Recommended,"I always leave reviews of games I complete partly just for myself.  I do feel a bit bad about leaving a poor review for a free one that wasn't overly bad, but I really wouldn't recommend this.  Its ending isn't really very satisfying.  It feels like the bad ending in a game that should have three endings.  And leading up to it is just walking everywhere and looking at everything over and over again with little direction until the plot advances (reminds me a bit of Phantasmagoria 2 on that account.)  But I suppose this is probably a first attempt by the developer to get experience to build a proper game, and I would be happy to try that game.  All the other games by Cloak and Dagger Games look intriguing.  (although also given the role of the duckling in this game, I'm not sure I would agree with this designer's moral outlook, so do I really want to spend more time in their world?) For this game to get a good review it would have to at least add in the other endings it calls out for based on your choices, Especially because it does seem to ask you to make some more moral choices along the way like do you help the duck (although I think you probably are forced to make them for the game to advance so I guess they aren't choices....)  For this game to knock it out of the park, it would need puzzles and for the ""riddles"" to actually be riddles you have to solve.",0.9 hrs on record,N/A
76561197986997483,2,Star Wars™ Pinball VR,Simulation,Recommended,"The other Zen Studios PInball VR game works great on my Meta Quest 2.  This one I can't get to work with the meta quest controllers or my steam controller.  In the forums it looks like people are getting it to work with xbox controllers, but I don't have one of those. I've checked allow comments.  I've returned this game but I would rebuy it if it gets updated.  If it does, please comment and tell me.",0.5 hrs on record																					(0.4 hrs at review time),N/A
76561197986997483,2,Pinball FX2 VR,Simulation,Recommended,"Love it.  Works great, with a few caveats  (sometimes the game doesn't recognize the buttons on my controller and I have to restart it.  also, every once in a while the quality degrades and things become choppy and make me sick.  but if I hold out for a bit it gets better again) I like how things change around you and not just on the table.  I do really wish Star Wars VR was part of the same app though.",2.0 hrs on record																					(0.5 hrs at review time),N/A
76561197986997483,2,Chants of Sennaar,"Adventure, Indie",Recommended,"This is a very pretty game.  I think there should have maybe been a ""hard"" mode where they never provide you with the official translations of the hieroglyphs.  In real life, you can be wrong about a symbol for a long time.  Just in general you see little glimmers of what the language puzzles could be but never quite get to.  For instance, early on in the first area you might notice that places that store things are a box with a rudimentary version of the symbol for the thing inside.  Well, it's nice that you notice that but you're never asked to extrapolate information like that to progress the game or even to open side things (although in the final area which is for some reason in a different style and even simpler than the earlier ones) you are shown this idea more explicitly. I think it would have been nice to have some characters you could interact with and say things to and give instructions to, but maybe it would have been too hard to code. But yeah, I did quite like exploring the tower.  I liked that the stealth portions were simple enough to not frustrate you (and it's fine to have them there for a little variety)  I love that the puzzles were of a genre that was only at most ever touched on in other adventure games.   I just wish the plot and puzzles were a bit more complex.  I suppose that's my feeling about most modern adventure games.",10.5 hrs on record,N/A
76561197986997483,2,Almost My Floor: Prologue,"Adventure, Indie, Free To Play",Recommended,"This was a demo, not a prologue... I like the art style and the sense of humor.  The sense of humor even makes it through the at times awkward translation.  The plot reminds me of Downfall by the guy who made the Cat Lady, but this isn't on that level.  This is so short it's difficult to have much of an opinion on it but it's the kind of game I like so I'll probably get the full game when I have a free weekend.",0.6 hrs on record,N/A
76561197986997483,2,Zaccaria Pinball,"Action, Casual, Indie, Simulation, Sports, Free To Play, Early Access",Recommended,"Changed my review to negative until they roll back the update that replaced the art on 50 tables with AI art.  There's not even an option to not use the AI art.  This isn't the game I bought anymore. Several years ago I got several of these tables in a bundle for cheap.  And it was kind of interesting that they were based on real life tables, but compared to more Pinball FX (or even real life tables I was more familiar with like those by Williams and Stern and Gottlieb) these were pretty simplistic tables and could only hold my interest for so long.  I think the makers of the game realize that and have lots of ideas to make them interesting nonetheless.  These include Story Mode and Campaign mode.  Story mode takes you on a tour of all of the tables available in the game (seemingly in approximately the order they were made) and gives you a goal on each one of a specific (not usually very difficult to achieve) goal to achieve on each one at which point you immediately advance to the next table.  It seems to include tables you don't even own which is pretty cool.  Campaign Mode arranges the pinball tables in a map reminiscent of Slay the Spire-style roguelike games.  It has similar goals to story mode but you get gold for completing the goals which gives you upgrades to things like your flipper length or the amount of time you have to complete the goal.  Both of these modes are really cool. Finally, they have some remakes and deluxe tables, neither of which exist in real life.  The remake tables are probably what you want to buy if you're getting the game to play on your desktop computer.  They reinterpret the themes of the real life tables into games that are more or less equivalent to Williams and Stern complexity and make them more interesting to play and unlock things.  The deluxe tables are NOT things you want to buy to play on your desktop computer.  they have many levels to the tables and ramps and things that crossover each other and obscure the ball.  They look messy and not fun to play on a desktop computer.  HOWEVER, I also got the VR DLC and THAT is what these deluxe tables seem to be made for.  They are really very cool to look at in VR.  And you can see the ball and the entire maze like levels that way.  I highly recommend the game with the deluxe tables in VR.  It's probably the most fun I've had with my VR headset yet and the best virtual pinball I've played.  As a competitor for pinball fx on a 2D-desktop computer, this whole game just a curio, however. *I will add however, that the VR is a bit glitchy.  If this was a game where you had to move around a lot you'd probably throw up.  This game claims to still be in ""early access"" so I'll give them the benefit of the doubt that they will fix it up.",8.6 hrs on record,N/A
76561197986997483,2,Pinball FX,"Simulation, Free To Play",Recommended,"It's difficult to review this game because it is certainly worse in a number of ways from the previous iteration, Pinball FX 3.  However, the new tables are good, and if I didn't have Pinball FX 3 to compare this to, I would definitely give this a positive review. Among the things I don't like about the program is the main one most people will complain about, which is that the tables from Pinball FX 3 don't port into it.  Furthermore, Pinball FX is split into two programs, this one and Pinball M (which has teen rated tables in it) so you have to have three programs installed on your computer to have access to all your tables and you have to close them and open them in order to switch between them.  What's more, Pinball FX 3 and Pinball M are both around 7-9 Gb, PInball FX is over 40, and it has a fraction of Pinball FX 3's tables! So, yeah, there's that.  There's also how long it takes to load the main screen.  I suppose because it's all 3D crap.  This is really part of the complaint about having to have three separate programs installed because it takes so long to switch between them.  So, you're stuck really with just the handful of new tables you have here.  Why not just have a simple menu to choose pinball tables.  Zen could even maybe create a frontend that would list all of your tables and let you load into whichever one you like? A third, and more minor, complaint is that in Pinball FX3, each table was associated with one achievement that was fun to unlock, it gave me the feeling of ""completing"" a table.  Here you seem to be constantly unlocking little achievements for every minor thing and a huge splash or bunch of numbers obscure your screen to tell you you've done it. I mostly have the Zen originals here.  None of the new licenses really appeal to me, except Princess Bride, and although I don't have it yet maybe the pack that includes Battlestar Galactica and Xena (maybe they'll make an SG1 table in future?)  Because of that, I haven't bought the other licensed things, with the exception of Universal Classics which came in a bundle.  The Universal Classic tables aren't good.  The Princess Bride table has some good ideas but gosh it takes a long time before that table gets to any of them.  The Zen Orignal tables are all fabulous however, and that's why I have to give this game a recommendation despite my frustrations.  Pinball Noir solid.  Grimm's Fairy Tales solid.  the samurai one, the jules verne one, the air pirates one.  They're all creative and great fun.  In the bundle I also got a Williams pack (my third one if you count the two williams packs I have on FX2) and Black Rose might be my favorite table over all. Well, it's fun, just be aware of dedicating a chunk of hard disk space and waiting on long loading times.",11.1 hrs on record																					(7.4 hrs at review time),N/A
76561197986997483,2,Legend of Grimrock,"Adventure, Indie, RPG",Recommended,"I really want to like Legend of Grimrock.  I've reinstalled it and given it another go probably a dozen times, but I never get very far because even though I like puzzle dungeons, I just hate the combat system, which is run away while firing in real time.  I guess it's enough for me to not play a game that otherwise seems practically designed with me as the audience.",10.9 hrs on record																					(10.2 hrs at review time),N/A
76561197986997483,2,The Feast,"Adventure, Casual, Indie, Simulation, Free To Play",Recommended,"I think the allegory of the game works really.  I was reminded a bit of the absurdist film, The Exterminating Angel.  But as a horror game it fails.  You're told who the various characters are, but you don't really get to meet them or become involved with them, so nothing feels real which detracts from the suspense.  Instead, it's almost a comedy, just one with no jokes.  I think I must have gotten the game for free at some point, but if it's free somewhere (it's off of steam completely now), I'd say it's certainly worth playing once, and seeing what you think of it.  As I say, the allegory is intriguing and works.  But I probably won't be playing it again to unlock the various endings.",0.4 hrs on record,N/A
76561197986997483,2,Gray Dawn,"Adventure, Indie",Recommended,"I think it's pretty good.  It's mostly what is termed a ""walking simulator""  but there are a few hidden object and light puzzle elements so that that's not all you do.  I like that the story is a bit ambiguous.  But the really selling point on this one is the neat visuals.  The only thing I don't care for is that you can miss some of the collectibles without any warning which makes attaining the ""good"" ending impossible.  I might be willing to replay the game to try and get it again, but I would want to do so after a while rather than right away, and then I think I'd be just as likely to miss the collectibles again....  But yeah, I'd recommend it if you like games like Layers of Fear, and play it mostly for the art.",3.5 hrs on record,N/A
76561197986997483,2,The Lord of the Rings: Adventure Card Game - Definitive Edition,"Adventure, RPG, Strategy",Recommended,"This is a weak recommendation.  What's good about this game is the cosmetic stuff.  The story, the voice acting, the card art.  Unfortunately the game play is dated are repetitive.  Cards are troops that each side lines up and tries to take out.  It never makes me feel like my choices aren't predetermined, or makes me want to come back to the same fight with a different deck build to see how things will go differently.",15.4 hrs on record,N/A
76561197986997483,3,Kingdom Two Crowns,"Adventure, Indie, Simulation, Strategy",Recommended,I guess I don't understand what the gameplay is.  You seem to just walk back and forth and drop coins whenever it lets you.  I don't seem to be able to make any choices.....  The lighting effects are pretty.,1.3 hrs on record,N/A
76561197986997483,3,Aeon's End,"Adventure, Indie, Strategy",Recommended,"So, the theme of this game (post-apocalyptic sorcerers vs. Cthulhu) does absolutely nothing for me and I wouldn't have looked twice at it except that we sell two different flavors of it (the base game and a legacy version) in the board game store I work in.  I thought I maybe buy it long enough to demo it so I knew how it worked, but surprise surprise, I enjoyed it quite a bit and decided instead to buy all the DLC. If you like Legendary, it is broadly similar to that.  On the negative side there's a bit less of an adventure game feeling over the length of a session than Legendary, which has more of a feeling of exploration and puzzle solving with the bosses, however there's a lot of other neat things to make up for that.  I like that you purchase new cards from piles that always available, like Dominion.  The fact that you can choose what order you can stack your deck is neat too, for pulling off combos (presumably, I mostly have used the function to destroy cards I don't like that are sitting on top of my discard, but I'm interested in exploring it more later)  The different heroes also feel very different from one another despite the fact that they are building their decks from the same cards, but the designers have really used what is available to make each mage unique as creatively as possible. I suppose the main negative is the lack of mulitplayer.  I don't love playing different characters by myself, in the forum it says they are planning multiplayer but it's been a couple of years since the last expansion, so I think the game is probably as complete as it will be.  Still, there's a lot here already.  I wish it were as popular as their other game, Sentinels of the Multiverse, which I didn't care for at all.",6.9 hrs on record																					(2.7 hrs at review time),N/A
76561197986997483,3,Supraland Six Inches Under,Adventure,Recommended,"Well... 96% finished, and I think that's good enough, I'm getting tired of wandering through the same areas listening for beeps.  It's not like the last few chests I've found have been associated with puzzles, they've just just been in out of the way crannies. The first Supraland was like candy to me that I couldn't stop eating until I was finished with it.  This one has it's moments.  I liked the bank and prison area particularly, and combat--while not good yet--is much better than in the first game. But quite a bit of it was same old/same old, and also I'm not convinced about the overall structure of the game.  In this game you complete the story at around 50% and then there's still more upgrades and chests to find for the second half of the game.  I like the little dudes and their humorous observations, so the game really lost something once there was no more of that. I also think that since the second half of this game is almost entirely backtracking, there should be things that change in the places you revist.  Particularly in the area bad guy's dungeon.  You've defeated him but there are still prisoners down there and they say the same things. So yeah, I recommend it.  I think you'll enjoy yourself, but I suppose I think you'll get tired of it before you 100% it.",29.0 hrs on record,N/A
76561197986997483,3,Altered,"Indie, Strategy",Recommended,"Love this game.  It's 4 Sokoban variants, that all make you really think about the puzzle in a different way.  The fall colors are very nice too.",2.5 hrs on record																					(2.3 hrs at review time),N/A
76561197986997483,3,Dark Lord,"Adventure, Casual, Simulation, Strategy, Free To Play",Recommended,"Loads of fun.  It's similar to other games where advisors and petitioners come up to you and you just make yes/no decisions, but it includes greater strategic depth because you have to keep your levels of different resources balanced.  It also includes a city building part in between the rounds similar to Darkest Dungeon.  I'll probably expand my review once I finish it but it seems like there's going to be a lot of fun in the story, too, and it will be interesting to navigate the rivalries between your advisors.",1.8 hrs on record																					(1.2 hrs at review time),N/A
76561197986997483,3,Dark Lord: Disenchanting Ritual,"Adventure, Casual, Simulation, Strategy, Free To Play",Recommended,"I decided to buy this because I really liked the main game and I thought since that was free maybe I would give the developer a tip.  (there is also a support the developer DLC but this sounded more interesting than that.)  So, I'm not really upset that I paid $3 for this since my point was to tip the developer.  However.  If you are not buying this for that reason, there is next to no content here.  It says it's a short story, well it's shorter than a short story; it's not even five minutes.  If the developer intends to make more paid DLC, I think also releasing this is a bad idea, because people who bought this might be inclined to not take a chance on other DLC if they think it's going to be equally as slim.",0.0 hrs on record,N/A
76561197986997483,3,"Dr Livingstone, I Presume? Reversed Escape Room","Adventure, Indie",Recommended,"Well,  humm.  The house that the story takes place in looks nice, but otherwise there are a lot of frustrations.  The narrator is very slow and the story doesn't have enough explanation to be understandable (and I read Henry Stanley's book!)  The gestures for moving things are very difficult to accomplish, at least for me.  taking long swipes with the mouse in unintuitive directions for even simple things like opening doors.  Turn screws is worse and half the time I barely start them turning in the proper direction and then I get to the edge of my mouse pad and after recentering the mouse, I start pulling it in the same direction and the screw starts turning backward.  Really I could pull my hair out. Otherwise I suppose it comes down to the puzzles and mostly they are just finding things, and once you've found them there's generally not much to do to put them into action.  Not really worth all the frustration.",4.2 hrs on record,N/A
