UserID,Page,Game,Genre,Rating,Review,Playtime,PostedDate
76561197986997483,15,Tales of Nebezem RPG: Red Peril,"Adventure, Indie, RPG",Recommended,"So, some time ago I posted a review of a partial playthrough of Red Peril and gave it a good review because I liked the Tales of Nebezem series and at that time the game didn't have any reviews yet.  I wasn't able to complete the game at that time but I went back and restarted and finished it over the last couple of days.  I was 4 hours into it on my first review, Steam says I have 18 hours now.  I must say there was not nearly enough plot to justify 14 hours, which is why I have changed my review from positive to negative. I believe the author put a lot of work into this game particularly into balancing, since it keeps about the same difficulty throughout.  Also the in battle skills are all generally interesting.  But you'd have to really love this kind of jrpg turn based combat to enjoy this game.  Because I as I already said there is hardly any plot at all, and this is surprising because that was a really strong point about Elemental Link that made up for the relative lack of difficult puzzles. The writing itself isn't bad.  The characters have almost too much personality.  But their characters never develop anywhere.  I think maybe this is due to them not really interacting with the plot and having an effect on it.  They follow the trail of the arsonist, they learn their identity and motivation, they defeat the arsonist.  Who they are as characters never comes into it, not to affect the plot or to be affected by the plot.  Their having personality only exists to allow them to provide commentary.  (which is itself nice since there are 8 possible characters, though only 4 will be seen in the game).  This set up reminds me of Seiken Densetsu (Secret of Mana) 3.  There you chose a main character and two sidekicks from a choice of--I think--6 total characters.  But in that game, the main character provided the main storyline for the game and each sidekick contributed a substantial sidequest to the experience.  I think in many ways it was the most replayable RPG ever because all those combinations were really different experiences.  This game could have use a similar system were different events in the world triggered for different characters, as opposed to the same events just triggering different dialogue from them. I've kept my original review below, because most of what I say there is still true, and it addresses the plot and battle system in more depth.  I still love the Nebezem world and will buy the next title, but I do kind of wish I'd better spent my time than put 14 (or 18 total) hours in here. I usually wait to finish a game before I give it a review, but I thought I'd make an exception since this is a long game and it doesn't have any reviews yet. I will update my review once I've finished the game. Tales of Nebezem is a great series of adventure games on Kongregate. This is the second of two premium games in the series. The first, Elemental Link, was a story driven adventure game which strangely had less of an emphasis on puzzles than the Kongregate games, but it still served up an interesting story to which this is a close sequel. You will be interested in the plot of this game if you've played Elemental Link. So far the game is about one of the gray people from the end of the previous game who works as a guardsman and whose house was burned down by an unknown arsonist. You quickly find out that the same thing has happened to other people and you take up the culprit's trail. Interestingly. for both the main character and the first two companions you are given a choice between two options. I'm not sure how much difference this makes to the overall plot, but it makes a lot of difference to the dialogue. I think that probably in the long it will make the whole game replayable at least one time. The gnomes are back, and this time they are particularly interested in what's making wildlife attack everyone who comes near which brings us to what makes this game different from the others in the series: the addition of combat. The combat is turn based without positioning and reminds me of earlier Final Fantasy titles. I'm not a big fan of this style of combat and I wouldn't be playing this game if I wasn't invested in the series. It just feels like you do the same thing over and over again in every fight. However, the magic system is interesting with different schools of magic working better against different enemies. If your character isn't magic, you have skills that you can use like spells but that require you to be attacked by the enemy so taunt is more useful in this game than in any other similar game I've played. I think if you like this sort of combat this game should be different enough to appeal to you. I just long for a world where grind was a thing of the past. I haven't seen a lot of puzzles yet, which is disappointing, but I have hopes they are coming. The main reason to play this game so seems to be the story, and the interesting characters inhabiting the world. I sure hope the robot from the most recent of the Kongregate games shows up soon. :)",18.1 hrs on record,N/A
76561197986997483,15,Recettear: An Item Shop's Tale,"RPG, Indie",Recommended,I quite like the concept but the endless dialogue and excessive cutesiness is way too annoying for me to get very far in it.,3.7 hrs on record,N/A
76561197986997483,15,Pinball FX3 - Bethesda® Pinball,Simulation,Recommended,"You know, I never cared the slightest bit about Doom, but does it ever make a good pinball table.  I don't know if it's the best table Zen Studios has produced, but it sure is in the running.  I love everything about it.  The atmosphere.  The mission variety, and the different methods to defeat enemies.  The slight RPG elements, like collecting guns and ammunition.  It's wonderful. Skyrim is also interesting.  Pinball as an RPG. Your upgrades continue from game to game.  This isn't the first time Zen Studios has done this, and in some respects I like the previous attempt (Epic Quest) better.  There is certainly more to do here.  But I just prefer the silliness of that early game better. I'm not very good at the Fallout table for some reason.  And I feel like there must be interesting things to happen here, but I haven't seen them yet....  most annoying is continually hitting the store when i don't have enough bottle caps to buy anything.  couldn't they make it so the ball would just immediately drop out of the saucer if that happened? maybe I'll give it some more time in future and force myself to figure it out, but I'd rather just have fun with Doom.",0.0 hrs on record,N/A
76561197986997483,15,Pinball FX3 - Carnivals and Legends,Simulation,Recommended,"Carnivals and Legends is a bundle of two tables that have nothing in common with one another.  I think Zen Studios might as well sell them separately. Adventure Land, is a table that reminds me a lot of 3D Ultra pinball for Windows 95.  It's certainly more advanced than that.  But I don't care so much for it.  The table is very busy and it's hard to feel like you're doing something specific rather than hitting the ball randomly and seeing what happens next.  Also it's the first and so far only table that pushes the limits of my graphics card, not enough to affect the game but every once in a while I notice it losing a frame or two.  So, I don't play it much. Hercules is a lot better.  It feels a lot like it could have been a Marvel superhero table, but I'm happy it isn't.  Here the story is very clear, and every labor of Hercules feels distinct and very representative of the labor.  It is a hard table.  But the ingenutiy is more than enough to motivate me to defeat Hera.",0.0 hrs on record,N/A
76561197986997483,15,Pinball FX3 - Marvel Pinball Original Pack,Simulation,Recommended,"The four tables in this pack aren't going to wow you with any of their ideas.  They are all a bit simple, but they do have some fun layouts. The Blade one is probably the most interesting I kinda feel like it's a first attempt at what would become the Moon Knight table (but it's not as fun).  It has an RPG flavor with things to collect and vampires to kill. Spiderman and Wolverine are very basic tables, but well done.  Wolverine has a spinner that would be fun to use on a real table and a fun bit where you can drop your ball on Hand Ninja heads.  Spiderman has a two level playing field and it's fun to move between the two levels.  Mysterio reminds of the sorts of things that can happen on the stellar Infinity War table in another pack. And then there's Iron Man.  This table is fine in that it doesn't feel unfair, like some of the ones I hate like Avengers.  but nothing interesting happens.  It has 12 missions split between Tony Stark missions and Iron Man missions, which is a good idea.  and you can tell whether you are doing Tony Stark missions or Iron Man missions, so the idea does come across.  But the problem is that 5 of the Tony Stark missions are just hit the same ramp 6 or 12 times.  And the Iron Man missions are just hit the flashing lanes.  It's more a test of boredom to complete the game than anything else.",0.0 hrs on record,N/A
76561197986997483,15,Pinball FX3 - Marvel Pinball Avengers Chronicles,Simulation,Recommended,"This pack has three of my favorite tables in Pinball FX's library, Fear Itself, Infinity Gauntlet, and World War Hulk.  It also has the Avengers Table, which is in the running for the worst table available. Really nothing remotely interesting happens on that table, and the playfield is kinda small this area in the middle that you are often asked to hit but can result in your ball bouncing back straight down between the flippers. The rest are all good, however.  Infinity Gauntlet has really fun challenges that make massive changes to the table as you collect each stone.  Fear Itself has a lot of fun boss fights.  And World War Hulk just feels fun with its theme and all the interesting ramps  (although it's not as good as the other two).",0.0 hrs on record,N/A
76561197986997483,15,LEAVES - The Return,"Adventure, Indie",Recommended,"And I thought the first Leaves was on the easy side.  Still nice art, but brain dead puzzles.",2.8 hrs on record,N/A
76561197986997483,15,ENDLESS™ Space 2,Strategy,Recommended,"Endless Space 2 continues with the asymmetrical gameplay of Endless Legend to create a game with a great deal more replayability than Civilization, the game I think it is most similar to.  Every race has very different mechanics for things like how they colonize new worlds or how they use resources, and it results in feeling like you get 8 games in one.  Even better than Endless Legend, these different mechanics don't force you so much into a particular playstyle because once you've started you can do a lot tinkering with the race's government and techs to fit the play style you need for your situation.  This is why it is a better game than Civilization, in my opinion.  Because you have such control over what your alien race is and how they deal with the universe both among themselves and in interacting with the unknown. It possibly gets over complicated at time.  If you're just pressing end turn waiting for something to be built or a tech to be researched, you're probably missing out on a great deal of choice.  Your civilization includes your starting race and alien refugees who have settled on your worlds.  Shuffling the populations around between planets and later systems, and encouraging some to reproduce more rapidly is just some of the ways you can what your civilization is and how efficient it is.  But by the late game you have a quite a lot of worlds to manage and it can start to being a micromanagement chore. Diplomacy was quite simple when the game came out, but it has become a lot more complex recently.  I do think the AI doesn't know so well, what's in its best interest here.  It seems to undervalue systems and overvalue techs.  But it's a lot of fun wheeling and dealing and putting pressure and demanding tribute from lesser civilations, eventually to consume them through politics or conquest.  (I generally prefer the former.) The tech tree is much improved from the former title in the series.  But it doesn't seem to tell you all the information you'd like to know, especially in the military portion of the tree.  What will this gun actually mean to the fire power of my ships relative to what they are currently at, can they equip them, how much does it cost, are all questions that seem out of reach.  similarly, it would be nice to highlight techs that you can use easily.  such as, show me only techs that have to do with resources I have. Economy is interesting but another area that is poorly explained.  You can make a lot of money (dust in the game) by buying and selling luxury resources on the market and the game does tend to alert you when this is a good idea.  you can also set up trade routes which take a lot of time and resources and are a bit of a gamble because your trade ships can be easily destroyed often before they've paid for themselves.  I suppose it is more like commerce from the old days in that respect.  But here too, how much each trade you get earns for each trip is never told.  So, when you see the price increase for each new one go up, you have a hard deciding whether it is worth it.  Just in general this lack of specifics in places where there's no reason for it not to be is a problem. Which brings me to the final problem  there really needs to be an ingame almanac or manual.  There is an out of game manual, but it doesn't have specifics of how the systems work, either, and it is out of date, since quite a lot has been added to the game since launch.  I highly recommend Endless Space 2, but as a new player, you may not like it.  The game is all about preparation.  You have to have put some work into every aspect of managing your civilization before it you run into problems, so you can solve them before they arise, and it's nearly impossible to do that when some times you don't even know that the mechanics are in place to solve them in the first place.  I remember even just conducting a siege involved knowing about ground troops and upgrading them and man power and all kinds of info, that's hidden away on subscreens. You may even think you've research the proper tech, like tanks, but there's they are going to do no good for you if you don't know where to go to add the tanks to your armies or how to upgrade them and what would be a good proportion of tanks to infantry to bombers by seeing the positives and negatives of each one.  So, you will lose and have to restart the game and start planning earlier the next time.  and this will keep happening because after learning about sieges there will be something else like politics that screws you in the next game.  But eventually you'll start to get the picture and you'll realize this is the most detailed 4X game yet.",134.0 hrs on record																					(56.6 hrs at review time),N/A
76561197986997483,16,ENDLESS™ Space - Definitive Edition,Strategy,Recommended,"I feel like there's no reason to buy this now that that the vastly superior Endless Space 2 is out.  But at the time this came out it was a very elegantly designed game  with a massively too complicated tech tree.  I'll give it a positive review because I liked it at the time, but it has nothing on Endless Space 2 and Stellaris.",21.6 hrs on record																					(20.6 hrs at review time),N/A
76561197986997483,16,Beyond Good and Evil™,"Action, Adventure",Recommended,Doesn't work on windows 10,4.4 hrs on record,N/A
76561197986997483,16,The Way,"Action, Adventure, Indie",Recommended,"I very much enjoyed The Way and here I had been avoiding it from indie platformer fatigue, however it sure is a cut above the rest with an interesting story and puzzles, a few surprising ideas. I liked the way the story was told with a minimum of dialogue, it's not quite the no dialogue whatsoever of Another World, but it keeps the pace up.  I think the puzzles were fairly good (particularly the ones to to turn off the generators), and although they mostly don't resemble the sort of situational puzzles in Another World (except maybe for the ones involving the bounty hunter), I very much enjoy exploring ruins and fooling around with machinery. Negatively, some their ideas didn't work so well with their engine.  For instance, there was a programming puzzle where you couldn't see the entire area at one time, so you had to basically put a single new command at a time see where the robot ended up and then add one more command and run the robot again.  The engine similarly tripped them up for a desert chase toward the end, where in a normal game you'd easily change lanes by hitting a direction once, in this one you had to very precisely find your lane with continuous movement and it was a real chore. The platforming is a bit difficult, particularly in a lengthy and questionably necessary sequence at the very end, but overall the game was a blast.  And the real winner is the story which is about an entire life and not just one event in that life.",10.0 hrs on record,N/A
76561197986997483,16,Space Pilgrim Episode I: Alpha Centauri,"Adventure, Indie",Recommended,"I hemmed and hawed about leaving a review for this at all because it is so cheap (it's often only $0.50 when it's on sale), and when I played it I found it just wasn't for me, but I suppose it could be for someone else.  Then I reread the description of the game in the steam store and I realized why I'd bought it in the first place.  ""Solve puzzles and begin to engage in an epic science fiction narrative written with humour and passion for the genre.""  There aren't really any puzzles, just collect the things and use them in the most obvious ways.  It's more like an RPG without combat than it is like an adventure game.  And so I thought I'd leave my review just to warn adventure game lovers.  If you don't care about puzzles and just want to watch a (not very) interactive story you might like this (although even from that perspective there's no control you have over where the story goes even as far as whether to trust a prisoner or not).",1.3 hrs on record,N/A
76561197986997483,16,Year Walk,"Adventure, Indie",Recommended,"I had thought this one was going to be a walking simulator rather than a proper adventure, and so left it unplayed for a long time after I received it is a Humble Bundle for artistic games.  It turns out it is an escape room (forest) game similar to the Cube Escape series, which is a series I like quite a lot. The story here was very interesting, and self contained (unlike Cube Escape which seems to still be working on a resolution). I quite liked that the areas and characters seemed unrelated while you were playing but were eventually connected in an unorthodox manner.  The best part of the game involved the brook, although one of the puzzles to complete that portion was an out of the box thinking sort of puzzle that I thought didn't belong in the game.  I ended up resorting to the ingame hints for it (and only it) and rolled my eyes at the solution.  It took me out things and everything else works so well atmospherically. I liked the map and the encyclopedia a lot, but I didn't care for the movement so much.  I wish it had been a clearer where the paths were so you didn't have to keep watching the arrows to show up in the letterbox portion of the screen. Overall, it feels like an early project from a designer who is going places.  I would definitely recommend it.",3.1 hrs on record,N/A
76561197986997483,16,The Eyes of Ara,"Adventure, Casual, Indie",Recommended,"So, there are some bugs.  Let's get that out of the way first.  Sometimes you'll put in the correct answer to a puzzle and the game won't recognize it.  This happened to me 4 times.  the first time I moved on after a while and did other things.  I just thought my answer must have require more nuance I wasn't seeing.  The second time it was awful.  I spent maybe 2 hour checking everywhere high and low for things I might have missed relating to the puzzle.  finally I turned off the computer frustrated.  the next day I turned it on started searching again, but for fun put what I thought might be answer in again and it worked.  So, if you think you've done something correctly and it's not recognizing save yourself some trouble and restart the game. On top of that, my save game corrupted.  I am in the epilogue. I've played for 17.3 hours according to steam.  but I can't log into my save game.  the title screen says I've played for 0.00 hours.  So I guess I won't see how it ends because I'm doing all of that again at least not any time soon. but I'm still giving the game a good review.  Maybe I shouldn't because other people may be less forgiving than me.  But it's so very much what I want out of a game.  There were two other big Myst games that came out recently Obduction which was too simple and had the most punishing loading screens of all time (especially during puzzles that involved teleporting!) and Quern which was just too hard for me being a color blind person.  I don't know why games refuse to give options for that (also I found the art of that one boring).  But this one is wonderful.  The puzzles are hard and I like the hidden object element to occupy you when you are stuck in the larger puzzles.  (I do wish the hidden object puzzles had a better cheat.  the shimmer was completely useless and eventually you will want to give up on looking for the coins)",17.3 hrs on record,N/A
76561197986997483,16,Primordia,"Adventure, Indie",Recommended,"There's a lot to like about Primordia, but I do think the negatives outweigh the positives.  Mostly the problems are the art which is all monotone brown so it's very hard to know what you're looking at, and the fact that the ""puzzles"" are very light.  The only memorable puzzles in the whole game are the small set of puzzles involving searching an archive.  Those were good.  The rest is far too simple to test your gray matter.  If you ever get stuck, it's simply because you couldn't pick one brown thing out of the background.  The characters were good for this kind of humorous sci-fi.  I wish, however, it had been serious sci-fi because the premise is an interesting thing to think about, but can only be taken so far when the robots have to be human stereotypes for the comedy.",5.6 hrs on record,N/A
76561197986997483,16,The Whispered World Special Edition,"Adventure, Indie",Recommended,"Full of nonsensical ""puzzles"" that make sense after you do them, and an obnoxiously mopey protagonist.",4.1 hrs on record																					(2.7 hrs at review time),N/A
76561197986997483,16,Hollow Knight,"Action, Adventure, Indie",Recommended,"You know all the reviews both from online sites and steam reviews keep telling me how wonderful this game is, and I keep plugging along expecting to see it, and I just don't.  The art style is all blandly homogenous, so you never feel much like you're exploring somewhere new.  and the story is sparse.  and puzzles far between.  I think it's too little stretched over too vast a world.  and I think I'm going to go buy the new La Mulana and see if that scratches my platforming itch instead.",4.9 hrs on record																					(3.8 hrs at review time),N/A
76561197986997483,16,Gone Home,"Adventure, Indie",Recommended,"Why is the Super Nintendo in Sam's room in the trailer but not in the game? So, I kinda knew I wouldn't like this because the store page said it was an adventure game with no puzzles.  But I decided to buy it in the pack with Tacoma which I was more interested in.   I was right.  I don't like it.  And it's because it's just not enough.  A story is more than characters, in my opinion.  And some things just don't make a lot of sense.  Like why is the fort still set up in the living room?  Does no one in this house clean?  And some red herrings would have actually made a more interesting plot than what was delivered.  The parents' room being a mess, for instance.  I thought, perhaps there has been a break in?  or the business with the possible ghost.  But apparently the makers of the game agree with the sentiments of the grandfather in the nasty letter to his son that was discovered in the basement:  that authors today cloud up their work with too much plot and it should just be about people.  Well, in my opinion it just has to be about things happening to the people.  Here's hoping I like Tacoma better.",2.1 hrs on record,N/A
76561197986997483,17,Cultist Simulator,"Indie, RPG, Simulation",Recommended,There is just so much waiting and repetition in this game.  I think I could have liked it if was turn based.,2.0 hrs on record																					(1.5 hrs at review time),N/A
76561197986997483,17,"Hamlet or the Last Game without MMORPG Features, Shaders and Product Placement","Adventure, Indie",Recommended,What is the point of name dropping Hamlet if it has nothing to say about the play?  I guess I expected some sort of parody.  But they've just borrowed three names.  Claudius murdered both of Hamlet's parents?,0.4 hrs on record,N/A
