UserID,Page,Game,Genre,Rating,Review,Playtime,PostedDate
76561197986997483,22,Hexcells,"Casual, Indie, Strategy",Recommended,"It took me 1.5 hours to complete the game with a perfectionist rating.  I'm not really sure there is enough here to justify the price.  I usually think of games as being worth a dollar an hour.  And it just never gets even a little difficult.  Just put the squares where it tells you next.  There's never ever higher order thinking like you might expect from, say, Battleships.  The hardest thing is retraining yourself to switch the right and left clicks from what you are used to doing with Minesweeper. On the pro-side it's very well presented with calming music.",1.5 hrs on record,N/A
76561197986997483,22,Millie,"Action, Casual, Indie",Recommended,"I like the idea of making Snake a puzzle game, but I hate that you can see so little of the maze at once.  There is really no reason for it.",0.6 hrs on record,N/A
76561197986997483,22,Nimbus,"Indie, Racing",Recommended,it's quite a bit of fun.  it's interesting how varied they can make the dexity puzzles with so few elements.  It also gets quite hard.,3.7 hrs on record,N/A
76561197986997483,22,Heroes & Legends: Conquerors of Kolhar,RPG,Recommended,Poorly written dialogue paired with uninteresting combat.,0.2 hrs on record,N/A
76561197986997483,22,The Room,"Adventure, Indie",Recommended,"The Room is a series of five or so puzzle boxes which you must open.  It is not too difficult but still is fun to do.  I wish the puzzles would have worked together in some way in the end, as it is opening them is a bit anti climactic, and the mystery is just Lovecraft nonsense again.  But I think anyone would enjoy playing with them for the cheap price.",3.8 hrs on record,N/A
76561197986997483,22,Mind Games,Indie,Recommended,"Mind Games features a good selection of traditional puzzles that are right away on the more challenging end of the scale.  I would recommend ignoring the negative reviews, more than a few of which seem to think the early Nim puzzle is impossibly hard.  If you think you would like the sorts of puzzles shown in the screenshots, you will like this game.  If you think peg solitaire is too hard or want totally original puzzles, I'd keep looking. There are a few negatives in fact that there appears to be no way to play in a window and that you can't select a puzzle to play but must play them in order.  Also there are some poor translations in the rules for the puzzles.",4.0 hrs on record																					(3.2 hrs at review time),N/A
76561197986997483,22,The Secret Order 3: Ancient Times,"Adventure, Casual",Recommended,"I don't really get the point of time travel if you aren't going to real historical periods.  In this game you time travel to a generic fantasy land filled with dragons, elves, dwarves and fairies.  Everything is too simple and the plot makes no sense.  I also don't care for how large the area is over which you must traipse back and forth with the objects you pick up.",3.9 hrs on record,N/A
76561197986997483,23,The Secret Order 2: Masked Intent,"Adventure, Casual",Recommended,"It has some nice art, but not much going on in the plot department and all the puzzles are things we've seen before.",4.1 hrs on record																					(4.0 hrs at review time),N/A
76561197986997483,23,Astral Heroes,"Free To Play, Indie, Strategy",Recommended,"Astral Heroes is a new card game in a series of similar card games.  The early ones were Astral Masters and Spectromancer. This is free and worth trying to see if you like the style of game, but I feel like it's a step back from Spectromancer.  In Spectromancer, you got all the cards you could possibly play right at the beginning of the game, and so you could proceed along a longer term strategy.  Here you have a hand and draw at the end of your turn like a normal card game.  Frankly it's a lot less interesting.  The core game is good, but I'd just go buy Spectromancer if I were you.",5.3 hrs on record																					(1.6 hrs at review time),N/A
76561197986997483,23,Dark Heritage: Guardians of Hope,"Adventure, Casual",Recommended,Pointless activity.  and I haven't a clue what the plot was supposed to be about.,4.1 hrs on record,N/A
76561197986997483,23,PRICE,"Adventure, Casual, Indie",Recommended,"Dripping with style and definitely worth spending the hour with it.  It tells a sad story about a brother and sister who are a bit too close to one another.  Aspects of it are a bit vague due to the translation, particularly the after credits sequence, but it's very interesting, and I'd love to see more from the developer.",1.2 hrs on record,N/A
76561197986997483,23,Mythic Wonders: The Philosopher's Stone,"Adventure, Casual",Recommended,"An extremely rote HO adventure.  Nothing going on in the plot.  There are certainly worse ones out there, but these need to do something original to get me to recommend someone else purchase them.",5.1 hrs on record,N/A
76561197986997483,23,Moebius: Empire Rising,"Adventure, Indie",Recommended,"The game starts off really well, with an intriguing plot an interesting, if somewhat unlikeable, main character, and his much more likeable love interest. But it kind of stalls out.  The dialogue is good, too, but the plot line never really comes together in a particularly intriguing way.  The ""memory"" puzzles, while novel at first, become a bit waring by the end because they never really develop into anything.  In fact, just generally the puzzles never do much. I was excited for this because I really enjoyed Cognition immensely, and of course I liked Jane Jensen's Gabriel Knight a lot, but this fell flat for me.  That being said, I thought characters were very well realized and I would visit them again if there were another game in the series.  So, I suppose I will still give it a positive review.  Hopefully too, a new game will be less 90's innuendo about Malachai and his boyfriend's relationship.",8.6 hrs on record,N/A
76561197986997483,23,Lost Civilization,"Adventure, Casual",Recommended,"I'd had some hope for this based on the publisher, but it is really a very inferior hidden object game with a really poorly written plot.  Placing objects instead of finding them is one mildly interesting thing to distinguish it from the other HO games.",3.4 hrs on record,N/A
76561197986997483,23,Eventide: Slavic Fable,"Adventure, Casual",Recommended,"Pretty fun.  I liked the characters.  Doesn't really do anything special with the puzzles, though.",3.8 hrs on record,N/A
76561197986997483,23,The Last Door - Collector's Edition,"Adventure, Indie",Recommended,"There is definitely some good art here to be sure, but the experience really falls apart in the game portion.  There aren't really any puzzles to speak of.  Anything nearly along the lines of a puzzle like pulling levers or adjusting the hands on a cuckoo clock to the proper time are incredibly simple.  Most of the game is just wandering around hoping one of the rooms you've passed through 10 times before has something different in it.  A slow story that really never does get anywhere even in the last act is made mind numbingly slower by giving you nothing to do. There are some nice effects in the pixel art--although that is a mixed bag as the overall crudeness of it makes it sometimes hard to see what might be worth clicking on.  But the light and shadows in the art is very nicely rendered.  The aural landscape is very good, except in the last chapter where they seem to have forgotten it.  If the Edgar Allen Poe/H.P. Lovecraft pastiche had been more interesting or the puzzles more present, or your direction through the game less vague, I would have recommended it.",8.8 hrs on record																					(3.8 hrs at review time),N/A
76561197986997483,23,Crime Secrets: Crimson Lily,"Adventure, Casual",Recommended,"Since the puzzles in these hidden object games are so similar to one another, I think the story has to be of some interest, and in this one it's practically nonsense.",4.0 hrs on record,N/A
76561197986997483,24,Cognition: An Erica Reed Thriller,"Adventure, Indie",Recommended,"Cognition is an absolutely wonderful mystery/thriller with a well plotted story that is very satisfying to play through.  Everyone who thinks they might like it should definitely buy it. I want to make that very plain at once because everything else I have to say about it is complaints.  The constant frustrations from beginning to end are just astounding.  Towards the beginning they are most game design issues, while in the last two chapters they are mostly technical issues.  In fact the last two chapters froze up so many times, I felt like I'd played through them both twice by the end.  The suspense was primarily situated in whether I would make it all the way through a cut scene or if it would hang between lines of dialogue.  And this is particularly troublesome because the last two parts are wonderful and genius.  Before I got to them, I thought the game was good, but not as good as Still Life.  In the first two chapters there are a lot of poor busy work puzzles, two absolutely obnoxious characters (the CSI guy and the coroner), and this horrible idea of giving you a cell phone but ALWAYS forcing you to actually go visit a person when you have to talk to them.  It's like the cell phone is taunting you.  The other bad thing, is all the time you spend watching slow jerky walking animations.  Why are the sets so large with about three things to interact with on each?  They could easily all fit on screen.  But no, invariably you must walk back and forth slowly and jerkily over at least two screens just to find out there's still something you need in another location completely.  The worst offender is the beautiful apartment in chapter 3.  (You notice how I'm compelled to compliment it even while complaining about it?)  In this apartment where you spend most of your time you must walk back forth around kitchen counters, islands, and coffee tables and dining tables that fill the screen.  The game seems to mostly be how to find a pixel's worth of floor space you can click on to get Erica moving in the right direction. The only problem I have with the plot is that there is a suggestion throughout the last chapter that you will have some opportunity to decide what happens to certain characters, whether you kill them or bring them to jail, I'm fine with what the game decides to happen but not so fine with the fact that it suggested you'd have more agency in it when you do not. The game is so good.  While the busy work puzzles are generally awful or unbelievable, the central puzzles are always wonderful, the way the various psy powers work out always very inventive and intricately planned out, the plot is very well done and never disappointing.  I like too that you don't have to like the good guys or dislike the bad guys.  Cognition is wonderful gem, but really Phoenix Studios, shape up.",17.6 hrs on record,N/A
76561197986997483,24,Vampire Legends: The True Story of Kisilova,"Adventure, Casual",Recommended,This has to be the most boring vampire story ever written. On top of that the game was clearly intended to be played with a full screen resolution and all the graphics are squished top to bottom.  This remains the case even if you play in windowed mode.  The resolution is poor for the hidden object portion and the puzzle portions are all so easy as to be beside the point.,3.6 hrs on record,N/A
76561197986997483,24,Grim Legends 3: The Dark City,"Adventure, Casual",Recommended,"These are all very well done, but I think too similar to one another, in terms of gameplay.  There are a lot of repeated puzzles in particular.  In terms of plot this one is so different I'm a bit at a loss as to why it is part the ""Grim Legends"" series.  The first one had a vaguely fairy tale/Angela Carter feeling to it.  The second was the fairy tale of the Seven Swans.  This one has nothing to do with fairy tales but seems more inspired by steam punk.  At first it was a welcome change, but as I played I found the story a bit irritating.  You play a girl with amnesia fighting against people whose sins have opened them up to being possessed by other dimensional monsters.  But your own story is rather non-existent throughout the whole thing.  Also the moral seems to be a bit based on Pandora's box.  The boy in the story causes all of the trouble by investigating the occult and not submitting to the natural order, which is a point of view I've always taken as being anti-science. Still the game is smooth as ever and about as good as a hidden object adventure can be.  As always I wish the logic puzzles were harder versions of the same puzzles.  Scaled difficulty there would be very nice.",4.3 hrs on record																					(4.0 hrs at review time),N/A
76561197986997483,24,Grim Legends 2: Song of the Dark Swan,"Adventure, Casual",Recommended,"A good second offering for the Grim Legends series.  The previous game was a bit longer, I felt, and the inventory a bit more engaging, but this is a good time waster too.  I always liked the fairy tale this one is based on, it's odd to present the story as a mystery if it's as well known as this one.",6.5 hrs on record,N/A
76561197986997483,24,Grim Legends: The Forsaken Bride,Casual,Recommended,"I can't imagine this would disappoint fans of the hidden object genre.  It has some nice visual ideas and they've done a good job animating it.  There's a good deal of traditional inventory based adventure game puzzles, enough that I'd say the game might appeal to tradtional adventure gamers as well, but it never gets very hard.  Besides that, there's lots of stuff to find that isn't necessary unless you want to get 100% achievements, and I like that as well. The story is okay.  I think it might have benefitted from having a bad guy with a more distinct personality and more obvious motive than ""the abyss"". What I would like to see would be the ability to choose more difficult versions of the logic puzzles.  At one point for instance there is one of the puzzles where you must light up all the streets by placing lights such that they can't see one another.  Well, for anyone who has done this puzzle before, the one in the game is a particularly easy version of it.  And it is possible to make this sort of puzzle quite difficult.  Couldn't there be three versions of each logic puzzle, one for each difficulty?  It would just change the set up, not the art and so forth.  When hidden object games start doing that I will start buying them.",14.6 hrs on record																					(7.7 hrs at review time),N/A
76561197986997483,24,Morningstar: Descent to Deadrock,"Adventure, Indie",Recommended,"$10 seems a bit much for a game that I completed in less than 2 hrs.  And it in general it was a lack luster experience.  The puzzles which impede your progress are too easy to really be considered puzzles.  Easily find a thing and put it on the obvious hotspot.  There was some hope of decoding an alien language toward the end, but all you really have to decode is on and off which I figured out by looking at the first alien console.  So, it didn't take much brain power. Considering the dearth of puzzles, I thought about regarding it more along the lines of interactive fiction.  But it's just all stuff we've seen countless times before there.  I was particularly reminded of the episode of Battlestar Galactica where Starbuck crash lands on an alien world and has to hot wire a Cylon drone to get away. I would like more sci fi adventure games, but I'm not going to give this a good review just because of the genres it's a part of.",1.9 hrs on record,N/A
76561197986997483,24,Fortix 2,"Casual, Indie",Recommended,"I've definitely played this before as a child, but I can't remember what it was called then.  The game is a fun enough arcade game nothing really that adds to orginal formula other than pleasing graphics.  it might have been nice to see a few different level types.",1.0 hrs on record																					(0.8 hrs at review time),N/A
76561197986997483,24,Shadowgate,"Adventure, Indie",Recommended,Oh.  I remember this.,2.9 hrs on record																					(0.4 hrs at review time),N/A
76561197986997483,24,Broken Sword 5 - the Serpent's Curse,Adventure,Recommended,"Certainly the best Broken Sword game so far, and one I can easily recommend--although with some reservations. Despite loving adventure games, I can say I've never really been a big fan of the Broken Sword Series, the first one was alright, but due to the similar subject matter felt a lot like the third Gabriel Knight game, but with worse puzzles and less charasmatic leads.  The second Broken Sword game makes my list of worst adventure games, and the third was fun enough, but its pleasure came in the unusual platforming and stealth areas at which other games have done much better.  So it was that I never really jumped at buying this one. That turns out to be a mistake.  First of all The Serpent's Curse is gorgeous.  I didn't mind a bunch of simple puzzles that did little other than waste my time in the first act, just because I loved seeing every environment.  So much attention to detail in the art too I loved the inside of Bijoux's apartment for instance, which caught her personality even better than her dialogue did. In the second act the puzzles improve quite a bit.  It does in that act include one puzzle they should have axed involving a cockroach that is on the level of the cat hair mustache in GB3 or the inflatable duck to get the railway key in Longest Journey.  However, that excepted, Act 2 has a very nice assortment of puzzles including some particularly memorable ones in which you must decode a map and decipher a hieroglyphic language. The plot is fairly interesting throughout, if a bit safe.  It goes exactly the way you'd expect and never really explores new territory, but that is okay if it's a story you don't mind hearing again.  And it is one which allows the artists to dazzle you.  Also on the negative side is a number of tiresome comic relief characters and an uninspiring will-they-won't-they dynamic between the leads.  Especially considering they have before. I must agree with reviewers that you control George too much and Nico not enough.  There really should have been more balance here and in one place where you DO control Nico, it makes little sense.  There is a scene in which George and Nico must pose as insurance investigators.  George is an insurance investigator in his daily life, yet Nico--who is a reporter--takes the lead? Later, or possibly right before that scene, George interrogates a man who has come to see Nico because of a report she wrote on a robbery--wouldn't it make more sense for Nico--the reporter--to have conducted that interview?  It is bizarre.  And then, of course, there are numerous scenes throughout where it wouldn't matter which character you control except that it is almost always George.  Ah well.  I suppose it is a little thing really. Buy this for the art and the puzzles in the second act.  There is also a story and some characters, those shouldn't annoy you enough to keep you from enjoying it.",9.6 hrs on record,N/A
76561197986997483,24,King's Bounty: The Legend,"RPG, Strategy",Recommended,"This is the best Heroes of Might and Magic-alike that you can get your hands on.  I love how inventive all the troops are, different armies suggest different strategies, and I like how the game forces you to keep changing out troops by only having so many available to hire.  It forces you to find the strategies, as opposed to just something you might do on your own like in another game. Add to this tons of invention in the plot--not the main plot, that is dull as dishwater, but in everything that happens on the way there, from zombie brides to Pinnocchio like whales, there's always something unexpected around the corner. My only negative is that at the end of it all, it's ruined me for the genre, I just can't get into other HOMM-likes now because i've just spent so gosh darn long on this one.  And none of the others seem to have quite this level of imagination.",140.2 hrs on record																					(134.7 hrs at review time),N/A
76561197986997483,25,Deadfall Adventures,"Action, Adventure",Recommended,"I usually reserve reviews until I finish the game, but I am confident I will do so.  I think it's a ton of fun.  I'm playing on hard puzzles (though that's a bit of an exaggeration) and medium combat (although I could probably bump it up to hard since I haven't had any trouble there either).  I think it's a good mix of exploration and action.  The dialogue could use some work but that's about my only complaint, and I quite like that the combat is limited to areas where you know there are going to be bad guys and it isn't like the similarly themed game, the Ball, where you have to handle the combat and exploring/puzzling at the same time. About my only complaint is that it's easy to leave an area accidentally and then you can never return; so it's possible I've missed a few secrets but I will never know.  I wouldn't mind a confirmation screen and one which tells me to what percent I've completed the area.",11.8 hrs on record																					(9.8 hrs at review time),N/A
76561197986997483,25,Rogue Legacy,"Action, Adventure, Indie, RPG",Recommended,"I don't know if I've ever disliked a game for being too hard before.  I have enjoyed my fair share of tough platformers:  Actraiser 2, La Mulana.  Daemon Crest is my favorite platformer.  But there is something about this that my hands don't get, perhaps it is the unusual control scheme, or the somewhat imprecise feeling of the jumping and hit detection, but I just don't seem to make progess except by grinding and getting upgrades--maybe that's the point, maybe that's what the game is.  It IS a roguelike.  But I just like to play longer with the same character, I suppose.  Also the world all this takes place in is very generic with a not actually funny sense of humor.",4.3 hrs on record																					(1.1 hrs at review time),N/A
76561197986997483,25,Hero Generations: ReGen,"Indie, RPG, Simulation, Strategy",Recommended,"I liked the game before and I still like it.  I don't know that there's much of a reason to upgrade if you bought the game before, unless you want to support the developer and he's a nice guy.  If you haven't bought the game yet, definitely go with this version. It's a great rogue-like puzzle game, that reminds me a bit of Oasis.  Uncover the fog of war, maximize your stats, complete some quests, and quickly find a spouse before you've used up your moves.  Great time waster.  And there's lots of stuff to explore. :-)",1.2 hrs on record																					(0.5 hrs at review time),N/A
76561197986997483,25,2064: Read Only Memories,"Adventure, Indie",Recommended,"Personally, I just can't get into the way the story is presented.  If you really like the endless cutscenes in Super Nintendo RPG's, you might feel differently.",1.1 hrs on record,N/A
76561197986997483,25,King's Quest - Chapter 2: Rubble Without A Cause,Adventure,Recommended,"I was absolutely enchanted by the first chapter, but I have to say I agree with the bad reviews this time.  It's not much fun watching your friends starve to death.  I suppose the idea is to replay the game until you do things in such an order that you can save everyone, but... that doesn't make it any more fun.",0.0 hrs on record,N/A
76561197986997483,25,Subject 13,"Adventure, Indie",Recommended,"extremely short.  Only one vaguely interesting puzzle (the one involving the monkey statues) the rest all things we've seen before.  The inventory puzzles are strictly of the understand what you've done after you've done it variety.  And the story is...poorly implemented. On the positive side, the final scene leaves things a bit open to interpretation, so a sequel might be better than this opening act.  Also, like all Microids games it is very pretty, but there are really only three scenes:  the facility, the island, and the temple. Also, the achievements don't all seem to be working for me since I did find all the testaments, but the testament achievement says I found zero.",5.1 hrs on record																					(4.1 hrs at review time),N/A
76561197986997483,25,Castle of Illusion,"Adventure, Casual",Recommended,An absolutely delight.  I like that the levels are short and filled with ideas.  It keeps you wondering what will happen next.,4.6 hrs on record																					(3.2 hrs at review time),N/A
76561197986997483,25,King's Quest,Adventure,Recommended,"This game is surprisingly wonderful.  The puzzles were fun, if not difficult.  The music and animation were top notch.  The story poignant and funny.  The voice acting some of the best I've ever heard in a game.  I think this and Psychonauts are the only games I've ever laughed out loud at.  Part of what makes the humor work is that it is self-effacing.  It realizes what was weak about the earlier King's Quest games and keeps it up while gently poking fun at it.  I can't recommend the experience highly enough.",9.2 hrs on record																					(7.4 hrs at review time),N/A
76561197986997483,25,The Night of the Rabbit,"Adventure, Indie",Recommended,"Nice art and story, but the areas are very large, and you must spend so much time tracking back and forth over them looking for items you missed.  Also, there's simply too much dialogue.  The story and characters are interesting, but the amount you have to listen to them renders them a bit boring.  It's a bit strange to have these sorts of problems when the previous Daedalic games I've played (Chains of Satinav, and Memoria) were such smooth affairs.",5.6 hrs on record,N/A
