UserID,Page,Game,Genre,Rating,Review,Playtime,PostedDate
76561197963260222,3,MARVEL SNAP,"Casual, Strategy, Free To Play",Recommended,"EDIT 3: Even worse monetization policies lately with no refunds and blatant misleading and false advertising (saying X variant won't come back for 6 months and bringing it back before that) and they refuse refunds. Besides the monetization the game is great with Conquest (and some upcoming modes that have been hinted at). Just wish they were really less predatory on FOMO and stingy on giving out new cards. EDIT 2: Still negative because of the horrible monetization they have. But they have fixed a lot of bugs and Conquest is the best thing to the game. If only they made things more accessible and friendly to players... instead it was a side move to have ""Spotlight Caches"" instead of just letting people get stuff more regularly. EDIT: After another 100+ hours I have to give it a negative review. The recent changes and lack of listening to player feedback (especially around the weird Collector's Token breakpoints) has soured me. It is still a bit fun and I play here and there. But the overall game has become a bit bloated and much more ""pay-to-win"" or at least ""pay to get the best meta counters out there."" Mixed positive/negative review. Overall positive though. My reference is from probably 50+ hours on the game now on mobile having gotten to Gold/Platinum multiple times just from casually playing here and there while completing Missions. The game is very solid and reminiscent of the ""Air, Land & Sea"" card game (which itself took inspiration from Battle Line). It is quick and tight and there's a lot of meaningful decisions and cool things going on, especially with the Snap wagering mechanism. The characters make sense logically and the unlock system is neat and different from opening packs. But there are a few key, and major, negatives to consider. Note: This doesn't include any of the current PC bugs which are numerous but I assume will be fixed by the time it leaves Early Access. This is more an analysis of the gameplay and monetization. First negative: The paywall hits hard. After Pool 1 (around level 222) the progression basically slows down to a standstill without paying. You go from unlocking 2-4 cards a day to like 1 card a day. After that it becomes even slower when you start getting into the end of Pool 2 and Pool 3. It isn't the end of the world as you'll still have a lot of options to make different decks, but it does feel a bit jarring compared to recent F2P games like Legends of Runeterra, which are overly generous in comparison. The battle pass is pretty fair overall, but a bit expensive at $10 or $15 for a boost. Feels like it should have been $5 and $10 instead for what you get. Second negative: While the gameplay is really good, it can be overly tight and restrictive at times. Some moves are painfully obvious and thus are sometimes not very interesting. I kinda wish the game started you wtih 2 energy instead of 1, an extra card, and/or you had a larger hand limit. There are random locations which can really do fun stuff, but often the game will come down to a coinflip on the last turn based on a Rock, Paper, Scissors choice. Just wish there was more room for skill expression. Third negative: High variance. No matter how skilled you are at the game you can lose just due to luck of the draw and from locations that counter you. That can be very frustrating at times, but thankfully the Snap mechanism means you can just Retreat and only lose 1-2 rank instead of 4 to 8 rank. Not a huge deal but something to consider. Fourth negative: Lack of information. There are a lot of deck types and it is hard to ""scout"" to know what the opponent might be playing and thus knowing what to play around. If there was more information given then I feel like you could make more meaningful choices and strategize. This also comes into play since you're doing 1 off matches instead of a ""best of 3"" or whatever -- which I think would improve the game a lot. I'll sometimes rematch against the same person and it is much more enjoyable playing them a second time knowing what they are going for and how to counter it. Fifth negative: Few gameplay modes. Right now there's basically only a single type of gameplay mode which is 1v1 ranked. There's no play to try out new builds, challenge specific players, have special gameplay rules, or anything else. I assume they will add these in the future, and possibly even PvE or 2v2 or whatever. So not a huge negative but something to consider. While all this sounds bad, the game is still super solid and slick and fun. Just be mindful of the negatives when playing. To me it is overall a very refreshing F2P title and I just wish they made it have a bit more skill expression and be a bit more generous on new cards (but keep cosmetics at the current cost). Overall solid game and one I'd recommend people try out if you're at all interested. 6.5/10 (would be an 8/10 if you don't mind the monetization / paywall)",51.1 hrs on record																					(0.2 hrs at review time),N/A
76561197963260222,3,Dungeon and Puzzles,Indie,Recommended,"Fine puzzle game overall, but doesn't have a lot of the ""a-ha!"" moments that I really enjoy. Instead, the puzzles are more about optimization and efficiency. While that is enjoyable to a lot of people, I find it to be a bit tedious in that you will redo the puzzle over and over to get solutions with slightly fewer steps. Good if you like those types of puzzles, but for me I wouldn't recommend picking it up unless you get it on sale and don't mind extremely repetitive puzzles in general. 6/10",2.3 hrs on record,N/A
76561197963260222,3,Cultist Simulator,"Indie, RPG, Simulation",Recommended,"Neat idea and fairly unique in terms of execution, but has a lot of problems. The game is a mashup of a lot of elements but it boils down to a semi-worker placement card game revolving around a lot of trial-and-error and hoping to get lucky with the correct combination of things appearing. This idea works in ""Stacklands"" because it is quicker, more focused, and not as punishing. However, here it is very painful as the ""try different combinations to get things to work"" takes time, effort, energy, and more all while other things are ticking on in the background. It is very easy to spiral out of control with not having money or enough resources to solve problems that pop up. Not a deal breaker itself, but there are 2 key issues that result in it being a mess. First, there are no save slots -- it is a rogue-like where you will be spending hours building up and ""rolling the dice"" on finding things that can all end abruptly if you mess up or get unlucky. With multiple save slots you could actually experiment and figure stuff out without dooming a multiple hour game from a single tiny mistake. And second -- the game often boils down to rolling for specific items over and over hoping to get the correct type of magic to progress. There are 9-ish paths of magic and getting pieces of them is largely random. You meander around collecting fragments of lore to complete a mission and only 1/9th of them are applicable (yes some build / help get others but how would you know without more trial-and-error?). That means you're juggling dozens of things just to hope you roll the dice on finding the right combination you're looking for. Even using a Wiki to look up the stuff is difficult because there is just so much thrown together in convoluted ways. This game might have been a borderline recommend if they simple had save states and the ability to undo things... but make some mistakes and you're back to 3+ hours of grinding to get back to where you were all because you did the wrong thing without knowing any better. Ugh. Cool idea, neat theme, and fun mechanisms... but the whole execution is a slog. 4/10. Just pick up ""Stacklands"" instead.",6.1 hrs on record,N/A
76561197963260222,3,Just A Humble Swordsmith,"Casual, Free To Play, Strategy",Recommended,"It is cute and has some charm, but not much else. There isn't much depth or decision making as you just match the best material and best weapon for the best given hero. If you don't get a good match you just lose and try again, usually with better materials or weapons. Really needs something else to make the decisions interesting and meaningful. Seems more like a Game Jam game than a class project and while okay overall just is lacking that last little bit to make it shine.",0.3 hrs on record,N/A
76561197963260222,4,A Monster's Expedition,"Adventure, Casual, Indie, Strategy",Recommended,"Probably Draknek's best puzzle game. It is very relaxing and peaceful with a simple premise. It is a Sokoban-style game where you are pushing trees down and rolling them around -- kinda like Stephen's Sausage Roll but more forgiving. There are very few ""rules"" and even fewer ""exceptions"" (if any), but it has a surprising amount of depth. Most puzzles are very simple and you can breeze along at a pretty quick pace. This is both good and bad. The difficulty in puzzles varies pretty wildly with some being completely brainless to others being pretty complex. This leads to the primary negative aspect of the game (outside the lack of variety), where the paths you take are so free form that you might quickly stumble onto a more complex island and be stumped and frustrated for a while. There is a ""map"" but it is difficult to navigate and very large, which means you can often get lost and/or not easily find more puzzles outside of just looking for unexplored areas. I wish there was a bit more structure and a curve to the puzzle difficulties overall. Maybe even having the islands sectioned into a level manager to make difficulty and navigating more straight forward, quick, and transparent. Outside of ""finishing"" the base game there are some additional puzzles that let you explore more islands and find more human artifacts. That is where it becomes slightly more interesting and fun. And then the final challenge is combining islands together to solve even more difficult puzzles and find ""snowman friends"" -- some of which are incredibly difficult (as of writing this review I'm about 70%+ done all the friends). Thankfully, there's enough here to keep you coming back if you enjoy the basic premise, but sadly there isn't a demo anymore (and won't be according to the dev) to see if you like the basics. Try it out and if you still enjoy it towards 2 hours in then you'll probably be pleased with the game as it is just more of the same. The ""story"" and ""comedy"" is very hit-or-miss, with more towards the ""miss"" unless you're a big fan of dad jokes and/or silly observational humor (like ""Strange Planet"" by Nathan Pyle). But it is overall cute and doesn't distract from the gameplay much. With the addition of the hint system it definitely makes it more enjoyable and casual, which is great for this style of game. I enjoyed it more than Stephen's Sausage Roll, but far less than Recursed and some other Sokoban-style games like Baba Is You / Patrick's Paradox. If you really like puzzle games with a simple premise that is repeated over and over with very tiny twists here and there then I'd recommend it. For me it is good and relaxing, but I was left wanting a bit more complexity and innovative solutions outside some of the ""meta"" friend stuff. 7/10",61.7 hrs on record																					(37.9 hrs at review time),N/A
76561197963260222,4,Stacklands,"Casual, Indie, Simulation",Recommended,"Fun and cute card game. There's a bit of RNG in progression, but it isn't that bad. Overall, it is a fun 3ish hours. I'd recommend getting it on sale since it is definitely a ""one and done"" game as there isn't much progression after finishing it. Feels kinda like Simmiland but better. Definitely recommend this over their other games. 7/10",7.5 hrs on record																					(3.9 hrs at review time),N/A
76561197963260222,4,The Looker,Indie,Recommended,"Really funny and clever. Surprised he didn't charge like 99 cents for this... I totally would have paid to play it. ""puzzle zÌ¶uÌ¶pÌ¶pÌ¶lÌ¶e maze zÌ¶aÌ¶mÌ¶e aÌ¶mÌ¶zÌ¶e AM EZ bÍŸrÍŸeÍŸaÍŸkÍŸtÍŸhÍŸrÍŸoÍŸuÍŸgÍŸh""",1.7 hrs on record,N/A
76561197963260222,4,Spirit Hunters: Infinite Horde,Action,Recommended,"Fun stuff. Amazing art and has a few interesting twists on the ""Magic Survival"" / ""Vampire Survivors"" swarm auto-shooter genre. Definitely curious to see where they go with it as it has a few rough edges at the moment. But that's to be expected for such a new release. If you're really into that genre then definitely pick this up and give feedback to the devs so they can make the most of it.",4.2 hrs on record																					(0.5 hrs at review time),N/A
76561197963260222,4,Vampire Survivors,"Action, Casual, Indie, RPG",Recommended,"EDIT 2: Game has since evolved into something so much more than just ""Magic Survival"" and stands on its own. Great game with a lot of content and neat things. The game does get a bit repetitive, the naming of stuff and the weird humor is odd, but overall it is still solid and something I'd recommend people pick up. EDIT: Review still stands, but the game was almost a direct copy of the mobile game ""Magic Survival"" ... which is actually better overall. Check that out if you enjoy ""Vampire Survivor"" and want something to play on the go. Decent rogue-like (with very minor rogue-lite elements) for the price. Not great, but a good 3 hours of fun. Pretty repetitive and samey after that as enemies are largely the same and there's not much to dodge. The items and upgrades are okay, but generally it is a ""play a bit and put down."" Reminds me of some older Flash style games. If that's what you're looking for it is fine at the price, just wouldn't say it has much staying power after that. 8/10",102.0 hrs on record																					(8.1 hrs at review time),N/A
76561197963260222,4,The Forgotten City,"Adventure, Indie, RPG",Recommended,"It is good, but not great. Like a worse Outer Wilds, which makes it still something I'd recommend, but would suggest getting it on sale. If you like ancient Rome / mythology and philosophy more than exploration, figuring out puzzles, and thinking outside the box, then this might be better for you than Outer Wilds, but outside of that just go for Outer Wilds. There's a lot to like, but some really clunky and out of place things. For a game about solving a mystery, there are some odd design decisions around ""action"" sections. I also noticed a few bugs or other minor problems with some dialogue options. Feels like this game could have been polished a lot more and more work done to having more viable options at a few key areas. Often feels railroaded and pushing you into a specific choice instead of a more free form game, which hurts it. For me, the game was incredibly easy and I figured out almost everything pretty early on. Granted, I've studied mythology and philosophy pretty heavily, so this might be cool to someone who is interested in the topics but hasn't done a dive into it. I do wish the company best and will be curious to see what games they make in the future, but for now just wait to get this on sale or if you REALLY want another ""time loop deduction-ish"" style game and nothing else is scratching that itch for you. 6.5/10",12.9 hrs on record,N/A
76561197963260222,4,Storybook Brawl,"Casual, Free To Play, Strategy, Early Access",Recommended,"Interesting take on the auto-battler genre. Overall, it is a mixed recommend. As the game stands, it is VERY swingy with a LOT of variance. Lucking into a few early combos really can snowball people into victory. This is very much a ""rich get richer"" game with a lot of RNG behind it. The best people will generally get in the top 4, but even then it has a lot of variance. There's also a shared pool of units with no scouting... which means if you go something someone else goes for then you both suffer. Some core design issues, balance problems, and sheer amount of variance, but overall it is still fun and I hope the devs fix these issues and improve the game. Lots of potential for it and if you don't mind losing sometimes due to being unlucky, it can be quite fun.",221.0 hrs on record																					(107.7 hrs at review time),N/A
76561197963260222,4,Sea Brawl Autobattler,"Casual, Free To Play, Massively Multiplayer, Strategy",Recommended,"Good way to play Hearthstone: Battlegrounds without supporting Blizzard. It plays almost identical to HS:BG. Which is both good and bad. It sadly doesn't innovate on much and feels a bit more swingy and random at times. Also, the animations and 3D models make it very hard to read what is going on... they also added more complexity to things just to add it. Not bad but also not amazing. Scratches the HS:BG itch, but I just wish they innovated more on the core gameplay like Storybook Brawl did.",1.8 hrs on record																					(1.0 hrs at review time),N/A
76561197963260222,4,Inscryption,"Adventure, Indie, Strategy",Recommended,"This is 3x the game that ""The Legend of Bum-Bo"" wanted to be.",15.8 hrs on record																					(3.7 hrs at review time),N/A
76561197963260222,4,Outer Wilds - Echoes of the Eye,"Action, Adventure",Recommended,"Every night, I wake up in a cold sweat from my nightmares about owl-elk, green fire, and whitewater rafting. Spooky, linear, frustrating, anticlimactic. 7/10 (Only because of the specific option in the menu) *** MILD SPOILER REVIEW BELOW: Imagine a single planet from the base game, but two to three as many puzzles within it, that are largely linear puzzles, and there are anglerfish all over the place that are twice as responsive and twice as fast. I feel like there was a lot of potential here that was squandered. Took some of the worst parts of the base game and made it about half of the expansion. *** MAJOR SPOILER REVIEW BELOW: First, there is no text to read so every story element is told in a series of image snapshots. That's fine, but I wish you could have translated and understood the mentality of these people more. Why do I care about these people outside of, ""ooo another place to explore""? You don't care. Second, there's a lot of backtracking and doing the same things over after you learn slightly new things. This was fine in the base game since a lot of the backtracking was on other planets, which opened other puzzles and interesting things. Here it is the same basic location over and over. Third, the ""stealth gameplay"" flies in the face of the ""explore freely"" mentality of the base game. Having some stealth sections would be fine, but they are so overdone, especially towards the end of the game when going to the archives. The ability to make enemies slower in the options is crucial, if it wasn't for that this game would be like a 6/10. Anglerfish were annoying in the base game, but manageable. Why take that concept and make it so prevalent? Fourth, some of the story elements don't make sense. Why does blowing out candles in the simulation turn off lights in the real world (and why are there no hints for that directly)? Why did the Owl-Elk spend all this time moving these panels with the lock combinations, record moving them, only to then burn them? Why not just burn them and be done with it instead of going through the effort of hiding them? Why lock someone up in this complicated vault with multiple keys and puzzles? Why do the Owl-Elk attack you if they see you instead of trying to communicate? They are an intelligent species so why are they so hostile for no reason? Why are you trying to open someone in a locked vault in the first place? Doesn't make sense. So much of the story just feels poorly executed. Fifth, the anticlimactic ending. You finally get to The Prisoner and get their story, but why do you care? What's the point of freeing them and communicating? There's no real interest except they were (somewhat) wrongly imprisoned. Whoopie. The device stopping the Eye has decayed already. And even after finishing the expansion nothing changes except they show up at the end of the base game. Feels just like the whole Quantum Moon thing with Solanum, which I felt was the biggest negative of the base game. You do all this stuff to unlock and figure out the Quantum Moon and it turns out to not even matter. Same thing here. This expansion could have been a lot better, and could still be better, if a few things were tweaked. I'd reduce the number of enemies and make them slower by default, and even slower with the option on. I'd make the puzzles less linear and spread a few more clues around that hints at some things. There are a few hints already in this vein, like the sleeping, but there could be more, along the lines of the simulation and dying to ignore bells. And the blowing of candles impacting lights in the real world. I'd have multiple solutions to some puzzles, so you don't have to kill yourself to get past the bells in the third lock, and don't have to glitch to open the second lock. Keep those as options, but give other ways to find the codes. I'd have some final answer that the Prisoner gives you to disable the lock on the Eye or something making this expansion tie into the base game more outside of, ""oh that's why the Eye signal disappeared to the Nomai."" And finally, I'd give some upgrade to your translator so you can read a few of their writings, and add more writings outside of just ""look here"" or ""avoid this,"" which seems to be the only things they wrote anyway. Give me a reason to care about the Prisoner and these people! There's literally no motivation outside of, ""it is here so why not fool around with it."" It would be fine if the base game was changed to accommodate the expansion, but instead it felt like they wanted it to exist completely separate from everything else, which made it a much weaker game overall. Still something to play (with the option to weaken enemies on), but a far cry from the brilliance of the original. 7/10",0.0 hrs on record,N/A
76561197963260222,5,Cookie Clicker,"Casual, Indie, Simulation, Strategy",Recommended,"Classic and one of the first idler incremental games. Really should cost $4.99 + the cost of a new mouse. Anyway, while the game is fine and overall fun, there are a few big issues that keep me from giving it a thumbs up at this time. First, there are some bugs with the port. Sometimes the game doesn't save properly and/or sync with the cloud saving. Minor issues where you can just copy your save code and import it and such. But the bigger issue is that there's no way to play other games on Steam while it is running. Normally, when it runs in a browser, it is in the background and isn't a big deal. But the way Steam works means you can't have 2 games playing at the same time with them both being online at the same time. I could go ""offline"" on one computer running it but then I might as well just use the browser, plus that requires 2 computers. I wish they would enable a way for the game to be closed and still function at 100% ... they would need to rework how the ""idle while game is closed"" bonuses for other things work, but it would free up the ability to play other Steam games while also ""playing"" Cookie Clicker. If they can fix these two issues the game would definitely be a thumbs up for the nostalgia, history, and overall decent idle gameplay. P.S. I hope some other idlers/incrementals come to Steam... maybe in some group bundle including: Candy Box 1/2, A Dark Room, Crank, Universal Paperclips, The Prestige Tree, Antimatter Dimensions, and others. EDIT: The main issue I was having was due to cloud saving sync issues with Steam. The issue still remains if you have Cookie Clicker running on one computer and want to play a game on the other. No easy way to solve this since it is on Steam's hands, but it would be nice if Cookie Clicker had an ""offline idle"" with 100% values instead of requiring upgrades. Steam is a different platform than browsers and as such should be designed slightly differently.","3,003.9 hrs on record																					(72.9 hrs at review time)",N/A
76561197963260222,5,Slipways,Strategy,Recommended,"Very ""board game""-like feel. No conflict or fighting and just about setting up a network of trades for places that create and take a variety of goods. While it is fun and there are some interesting decisions, it does get repetitive. The campaign is nice and offers some cool tweaks -- I wish there was more like that and maybe more diversity in the game-to-game interactions. It often seems like re-rolling to get a good tech combo offering and good starting spot, which is meh. Also, the achievements are all over the place from being super easy to incredibly impossible and luck-based. Wish they weren't so heavily determined by luck at times, but oh well. So, while I do recommend the game, be aware that it can get same-y and that all the content isn't there yet. The campaign is only up to Act 1 and they are working on the rest. For now I'd say wait until the game is on sale for <$10 unless this is a game that pushes all your buttons on what you want. For me, it comes close, I just wish there was a bit more variety and depth and interesting decisions going on at times (and maybe a mode with conflict / other factions). But still a fun game overall. 7/10",49.3 hrs on record																					(38.5 hrs at review time),N/A
