UserID,Page,Game,Genre,Rating,Review,Playtime,PostedDate
76561198043830933,1,Golden Lap,"Casual, Indie, Racing, Simulation, Sports, Strategy",Recommended,"Si les coupes mulet ne vous ont jamais effrayé, que la moustache est l'accessoire indispensable pour tout bon garagiste et que la tension de survivre à une course effréné vous font vous sentir vivant, alors Golden Lap est fait pour vous. Vous allez gérer votre petite écurie de formule 1 dans les années 70 et vous allez devoir gérer tout ce qui concerne votre voiture, vos pilotes, leurs pneus etc... Attention évidemment, il ne s'agit pas d'un F1 manager optimisable de partout, on est sur un petit jeu à 10 balles et les options sont largement suffisantes pour s'amuser et vivre le frisson de la course en pleine pluie sur un circuit dangereux. Bref, l'essayer c'est l'adopter !",15.5 hrs on record																					(7.5 hrs at review time),N/A
76561198043830933,1,"Yes, Your Grace","Adventure, Casual, Indie, RPG, Simulation, Strategy",Recommended,"Yes, Your Grace est assez intéressant dans ce qu'il propose, pas vraiment un jeu vidéo, mais pas vraiment un film, le média vous propose de suivre l'évolution du Roi Eryk de Davern à travers 52 semaines rythmées d'audience à la cour de son peuple et de sa préparation à travers différentes batailles. Le jeu n'est pas manichéen, il n'y a ni méchant ni gentil, juste des gens intéressés, qui doivent vivre et évoluer en leur temps. L'exploitation du thème médiéval est bien utilisée, même dans un univers fictif, on y retrouve les vieux croûtons en quête de jeune maîtresse, les trahisons, les règlements de comptes, les moeurs plus ou moins léger, bref, tout ce qu'on attend de ce genre de fiction. Les râleurs et les râleuses déploreront le manque d'impact de nos choix mais c'est absolument faux, et comme le dit très bien un commentaire anglophone, nos choix n'ont pas d'impact dans la progression de la structure narrative, mais ils en ont bien dans l'histoire et c'est tout ce qu'on demande. Le jeu va du point A au point B, il l'annonce dès les premières secondes de jeu et ne vous ment pas, il vous propose juste de suivre l'histoire que vous voulez développer. Je ne pense pas que je le relancerai pour autant, je ne pense pas que le jeu ""nécessite"" d'être fini à 100%, je me plais à me dire que le média auquel je viens de jouer m'a donner son histoire qui est l'histoire que j'ai voulu vivre et voir.",5.3 hrs on record,N/A
76561198043830933,1,Grotto,"Adventure, Indie",Recommended,"Grotto est une pièce de théâtre interactive à mes yeux, découpé en trois actes distincts et qui offrent chacun des émotions nouvelles. Dans les grandes lignes, voilà un jeu immersif dans lequel vous serez un espèce d'oracle muet, capable de lire dans les constellations l'avenir de ceux qui viennent chercher des réponses à leurs questions. Dans les faits, il s'agit d'un jeu basé sur le langage et la communication qui offre quelque chose de nouveau par rapport à tous ceux que j'ai pu faire : ici rien n'est cryptique en soit, vous ne devez pas trouver la signification et comprendre, mais VOUS faire comprendre. Comment le chef d'une tribu comprendra l'interprétation de la constellation du volcan éteint ? Quelle constellation fera comprendre à ""Celui-qui-guette"" que son ami est sain et sauf ? C'est à travers tout cette évolution et les interactions avec les membres d'une même tribu qui habite le flanc d'une montagne que vous allez vivre. Et d'ailleurs, cette montagne... Pour des raisons évidentes de spoilers, je ne vous dirais pas quels sont les ressorts scénaristiques qui font le deuxième et troisième acte. Je dirais juste que c'est une belle suite logique d'évènement. Alors tout n'est pas juste, certains choix sont cornéliens, d'autres faciles, d'autres factices mais réconfortants, mais ce sont des choix qui auront un impact dans l'immersion. Le scénario tient la route du début à la fin, on voit parfois arriver certaines choses mais ça n'est pas gênant, on s'attache à cette tribu, on la déteste, on l'apprécie, on va la défendre ou la haïr, mais il y a quelque chose dans Grotto qui ne nous laissera pas indifférent. Dire que je ne l'ai eu qu'à un euro pendant les soldes steam est une chance, maintenant que je sais l'expérience qu'il offre, je pourrais mettre le double de son prix initial, une chose est sûre je vais suivre de très prés ce que fait le studio.",6.4 hrs on record,N/A
76561198043830933,1,Combo Card Clashers,"RPG, Strategy",Recommended,"TL, DR : J'ai buté un boss parce que mon ours l'a attaqué 4 fois et qu'un rat géant mort dans un slime que j'ai apprivoisé l'a fini. 11/10, je le rachèterais une deuxième fois si je pouvais. Sous son nom qui nous rappelle les bonnes heures des jeux flash des années 2000, Combo Card Clashers, ou CCC entre intimes, nous propose un système innovant de construction de ""moteur"", à savoir ici une mécanique ou vos cartes/tuiles vont être jouées dans l'ordre (de bas en haut, de gauche à droites comme lorsque vous lisez ce paragraphe) et provoquer des combos. L'originalité vient du fait que selon le placement de celles-ci, elles feront s'activer les effets d'autres (par exemple ""la tuile du dessous coutera 10 mana de moins"") à vous donc d'organiser votre ""moteur"", maléable entre chaque tours, pour battre vos ennemis. Petit point négatif : vos premières runs avec chaque personnage (au nombre de 5 pour le moment) se ressembleront probablement, digne héritier des roguelikes de deckbuilding et compagnie, il vous faudra davantages jouer pour débloquer artefacts et cartes qui agrémenteront vos prochaines runs. Mais à part ça, c'est une petite pépite indé qui je l'espère trouvera son succès, d'autant que si je ne me trompe pas, on est encore sur un jeu développé en solo ou en toutes petites teams, et entre Break the Loop, Backpack Battles, Balatro et ça, on mange bien ce premier semestre 2024.",26.0 hrs on record																					(3.1 hrs at review time),N/A
76561198043830933,1,Hidden in Plain Sight,"Action, Casual, Indie",Recommended,"At first glance, it might seem bland, even devoid of charm, simply not pretty. But for those who dare to look beyond its modest appearances, it hides a treasure trove of memories and intense laughters. It was in these rudimentary graphics, in these slightly stiff animations, that I discovered a little gem that indelibly marked evenings with friends. This game was the scene of unforgettable moments with my friends, hours spent laughing, insulting each other, promising vengeance, deploying strategies from the most to the least subtle. It may not have the epic grandeur of other titles, but it has that rare quality of creating deep bonds between those who immerse themselves in it. So, I recommend that anyone looking for authenticity, simplicity and precious memories, give this seemingly banal game a chance. Because beyond its imperfections lie hidden treasures of emotion and nostalgia, ready to be discovered by those with the courage to look beyond appearances. Because, as the name suggests, this gem is Hidden in a plain sight.",23.5 hrs on record																					(20.8 hrs at review time),N/A
76561198043830933,1,Balatro,"Casual, Indie, Strategy",Recommended,"Imagine playing a single card, a simple 2 of... diamonds, why not. Easy, that's 2 points. Now you're 10 hours deep in the game and the same card, at a different Ante, give you 16,145,032 points. That's it, that's the feeling of Balatro. Last time i know a game would give me so much playtime and joy was Slay the Spire. Before it was Mario Kart : Double Dash. There is absolutely no doubt I'll buy the game on other platforms. Nice one LocalThunk, you just made a classic. Can't wait for my next run(s).",222.8 hrs on record																					(8.7 hrs at review time),N/A
76561198043830933,1,Baldur's Gate 3,"Adventure, RPG, Strategy",Recommended,"Ok Google, how to romance Orin ? I can fix her.",123.0 hrs on record																					(121.8 hrs at review time),N/A
76561198043830933,1,To The Core,"Adventure, Casual, Indie",Recommended,"Stupdily good incremental game, the laser goes pew pew, and the drill goes brr brr and grenade goes prk prk and the orbital goes OHMYGODTHATSFANTASTICILOVETHISGAMETHOSESPINARETHEYBEYBLADES. Buy it.",5.1 hrs on record,N/A
76561198043830933,1,Sapiens League,"Casual, Indie, Early Access",Recommended,"Vraiment très surpris du bon niveau de culture que de jeu nécessite et de la proposition multiple des minis-jeux, peut-être revoir le déplacement sur la carte mais à part ça c'est super et surtout, je ne m'attendais à ce petit secret dans le niveau des 1000 portes !! Je n'en dis pas ;) Mais si vous dépassez les 100, vous aurez remarqué la combinaison à rentrer sur un autres des minis-jeux où apparemment, il ne faudrait que glisser des cartes ;) ;) mais on ne nous la fait pas et on l'a trouvé avec les copains. Et pour les moins téméraires, mettez l'épreuve au niveau le plus simple, ça vous évitera de manger trop de portes, il parait que c'est pas comestible lol ! C'est à toi que je pense Valérie !! lol ;)",0.7 hrs on record,N/A
76561198043830933,1,Ravenswatch,"Action, Adventure",Recommended,"Je ne recommande absolument pas ce jeu et pourtant je continuerais d'y jouer. Pourquoi ? Demandez à un crackhead s'il recommande de consommer du crack et vous aurez une réponse du même acabit. Les points forts avant tout : Le jeu a un potentiel énorme de lore, le choix des personnages habituellement très secondaire de contes, c'est un grand oui, ne serait-ce que celles et ceux choisis pour le JDR du Battle 4 autour du jeu. Ce qui fait que chaque façon de jouer avec les personnages est intéressantes, ils sont à la fois versatiles dans leur gameplay et ne possèdent pas du tout le même sur le principe... Fin des points forts Les points faibles sont bien trop nombreux et, attention, je suis le premier à demander la clémence pendant un Early Access, mais là il s'agit clairement d'une bêta voir d'une alpha payante : 4 persos et 2 déblocables, une seule map, un mode cauchemar 10 déblocable en très peu de temps pour peu que vous vous investissiez un peu dans le jeu, un skill gap idiot entre le jeu de base et le cauchemar 1 puis inexistant entre le 1 et le 10, des persos CLAIREMENT unbalanced (le chaperon rouge peut finir à 150k+ de dégats pour peu que vous ayez une tête capable de rouler sur un clavier, je déconseille donc les têtes carrées, désolé), des skill path identiques pour pouvoir jouer à force... Et ça c'est que pour le gameplay, je ne vous évoquerai pas ici les known issues depuis le jour 1 : Crash répétitifs en pleins combats, personnages intangibles, disparition d'ennemi à la moitié de leur vie ce qui fait qu'on peut casser le jeu en laissant ceux à qui ça arrive taper les dit ennemies. Le problème ? Ben déjà je ne joue pas pour manquer de challenge et surtout, les ennemis deviennent invisible pour eux mais toujours ""physiquement"" présent : ils sont mort mais ils ne peuvent pas bouger au travers, comme un mur invisible. Erreur de gains de loot également, on clear une zone à 4 mais seul un peut prendre le contenu d'un grimoire ou d'un coffre et puis des freeze frames en veux tu en voilà, le jeu freeze tellement que le watercooling en est jaloux. J'ai tout fait pour aimer ce jeu, pire, j'ai vendu le jeu à un tas de compagnons pour pouvoir en profiter tous ensemble, je pense qu'on a passé la première heure à l'époque à juste se rejoindre, rien n'est stable, les codes ne marchent pas, et puis quand on peut jouer on se rend compte que tout est loin de ce que promettent les trailers... Non vraiment, je sais que dev un truc c'est difficile, que cocorico ce vendeur de rêves est français mais bon sang, c'est un raté et c'est vraiment, vraiment dommage. Alors j'y reviendrais, très certainement, trop certainement, mais je n'encouragerais pas d'autres joueuses et joueurs à s'y frotter...",29.7 hrs on record																					(17.7 hrs at review time),N/A
76561198043830933,2,Sunset Routes,"Indie, Strategy",Recommended,"Si vous avez aimé Luck be a landlord / La chance du locataire, arrêtez-vous un instant sur ce jeu. On est sur le même concept la roulette à part et la DA bien plus joli (goût perso), pour un euro seulement. Chaque personnage a une utilité, le concept des ressources fonctionne bien, la musique lo-fi en fond suffit à accompagner ce petit filler. On n'a pas une révolution du jeu indé en face de nous, mais on a quelque chose d'étonnamment suffisant pour le prix, et même bien plus, chaque run (parfois un peu trop facile) a un véritable goût de reviens-y, toutes les strats ont l'air de fonctionner. Bref, vous ne pouvez pas vous tromper pour le prix d'un café, Sunset Routes vous l'accompagnera bien !",1.9 hrs on record																					(1.0 hrs at review time),N/A
76561198043830933,2,Raft,"Adventure, Indie, Simulation",Recommended,"J'ai Raft depuis si longtemps qu'il devait me rester des cheveux, j'aimais bien le principe mais très vite à l'époque ses faiblesses s'étaient fait ressentir : passé le bac à sable et la découverte des premières îles un peu plus grande, il n'y avait pas grand chose à faire. Quelle fut donc ma surprise en novembre 2022, quatre ans après son lancement, quand je l'ai relancé ! De nouveaux persos qu'il faudra débloquer pour jouer, des nouveaux matériaux et objets, de la déco à gogo. L'ambiance mystérieuse est bien représentée, le jeu sans être dans l'horreur (heureusement, je déteste ça perso) vous offre son petit lot de frissons, l'histoire y est intéressante et la coopération, bien que plus sympathique pour profiter du jeu, n'est pas obligatoire. Cerise sur le McDo : les difficultés. Que vous soyez casu de l'éternel ou gros hardcore g@m3rz, vous y trouverez votre compte puisque le jeu va vous proposer des principes de difficultés allant de ""tout est calme, le requin ne vous attaque pas, chillez tranquille sur l'eau"" à ""LE DERNIER QUI SURVIT PENSE A ENVOYER UNE LETTRE A MA MERE"". Blague à part, c'est plaisant, il n'y a pas de wiki à apprendre par coeur pour en profiter et chacun.es y trouvera son expérience dans ce style de jeu.",75.3 hrs on record																					(54.3 hrs at review time),N/A
76561198043830933,2,PlateUp!,"Action, Casual, Indie, Strategy",Recommended,"J'ai ouvert une pizzeria à succès pendant 14 jours, des Regina du tonnerre. Le dernier jour, le premier client a changé sa commande une fois que je m'en suis éloigné et que je ne pouvais plus la voir. Il la voulait aux oignons. Pas eu le temps, le restaurant a fermé et c'est game over. J'ai pleuré toute la nuit. Je recommande, 12/10.",363.0 hrs on record																					(12.0 hrs at review time),N/A
76561198043830933,2,Road 96 🛣️,"Action, Adventure, Indie",Recommended,"En 5h de jeu je pense en avoir gratté qu'une légère surface. Une intelligence narrative au service de destins croisés, des personnages vrais et entiers, des propos sous-jacent parfois plus important que ce qui est dit. Si vous avez aimé Firewatch, Gone home ou encore Life is Strange, Road 96 est fait pour vous.",10.0 hrs on record																					(5.3 hrs at review time),N/A
76561198043830933,2,Understand,"Casual, Indie",Recommended,"Mais quel espèce de malade a créé cette beauté ? Un mix de Baba is you et de The Witness sans les fioritures de lore ou d'histoire, du puzzle pur où chacun des niveaux est le même que le précédent avec un twist, et les niveaux ""?"" cassent tout ce que vous avez appris. Le fait de devoir y aller à tâtons pour enfin comprendre en analysant les précédents puzzles fonctionne très bien. Je crois que ça fait bien longtemps qu'un puzzle game ne m'avait pas autant amusé et tenu, pour les nostalgiques de ""This is the only level"", vous retrouverez le même humour conceptuel, sans textes et avec la même satisfaction de complétion.",17.9 hrs on record																					(1.0 hrs at review time),N/A
76561198043830933,2,ISLANDERS,"Casual, Indie, Strategy",Recommended,"Un des meilleurs filler qui existe probablement, sous couvert d'un city builder se cache un excellent jeu de puzzle dont vous ressortirez de chaque partie satisfait.e : Ses couleurs saturées, sa prise en main facile, son envie d'en refaire une alors qu'il est 4h, bref un must have du jeu à faire entre deux sessions.",12.3 hrs on record																					(12.1 hrs at review time),N/A
76561198043830933,2,Deep Rock Galactic,Action,Recommended,"Come to work in space mines, make friend with a creature, call it Steeve, Steeve is great, pet Steeve, collect golds and other minerals, pet Steeve, have to go back, want to take Steeve, don't have enough place, have to leave Steeve, pet him more, capsule go back to ship, last eye contact between Steeve and me when he defends the capsule against his pairs. Shed a tear for Steeve. Rock and stone Steeve. Epilogue : Drunk Dance in the ship and kick barrels is fun, but nothing is as fun as Steeve was. Steeve.",179.2 hrs on record																					(150.0 hrs at review time),N/A
76561198043830933,2,Risk of Rain 2,"Action, Indie",Recommended,"Si vous aimez le chaos, la rigueur et vous coller des steaks de viande à même la poitrine, RoR 2 est pour vous. Attention : Gros risque d'addiction probable.",559.3 hrs on record																					(228.3 hrs at review time),N/A
76561198043830933,2,Mini Motorways,"Casual, Indie, Simulation, Strategy",Recommended,"Autant le dire tout de suite, Mini Motorways n'est pas parfait et souffre de quelques bugs MAIS (car il y a évidemment un mais) on y reviendra. Tapons dans ce qui ne va pas : - Les maisons qui peuvent parfois être inaccessibles - Un principe de jeu un peu déroutant dans son ""lore"" (des voitures qui foncent dans des bâtiments probablement pour acheter/travailler, ça fait pas super rêveur) - Et personnellement, je préférais l'ambiance sonore de Mini Metro (enfin là chacun ses goûts) Cependant les plus : - Une DA impeccable (petit plus pour le choix entre 3 styles différents de cartes, à savoir très saturés, mode nuit et la dernière qui s'inscrit dans ce que faisait Mini Metro) - Un système de puzzle bien plus créatif que Mini Metro (alors oui, c'est la 3eme comparaison avec ledit jeu, mais puisqu'il s'agit du même studio et qu'il s'inscrit dans la même veine ...), créatif donc notamment avec ses principes d'autoroutes, de feux de signalisation qui ont l'air pour certains inutiles mais qui en vrai servent à désengorger vos grosses voies des petites intersections, ou encore le principe pont/tunnel - Une expérience apaisante comme son prédécesseur. Si vous cherchiez un ""Gère ton traffic routier Simulator"", passez votre chemin, il s'agit bel et bien d'un puzzlegame dans la grande lignée : les voitures emprunteront toujours le chemin le plus court même si vous faites une trivoie, quite à créer un embouteillage. Une fois que vous aurez bien encadré ça, tout va commencer à se mettre en place. Concrètement pas déçu : le jeu est à la hauteur de mes attentes, n'en déplaise aux puriste du code de la route, et à ce prix là, il serait bête de s'en passer s'il vous tente. Pour les plus sceptiques, vous pouvez attendre les soldes, mais ça sera des heures de jeu de perdues d'ici là ;) Amusez-vous bien !",25.3 hrs on record																					(10.5 hrs at review time),N/A
76561198043830933,2,SNKRX,"Action, Casual, Indie",Recommended,"Par où commencer tant il y a de très bonnes choses ? Le gameplay déjà, quelle bonne idée cet espèce de Snake Revival où chacun des éléments le constituant sera défini par une à trois classes (sorcier, mages, rangers, rogue etc...) et qui peuvent comboter pour être de plus en plus puissant. Ajoutez à ça qu'en recrutant la même unité, elle finit par devenir de plus en plus puissantes (jusqu'au niveau 3). La musique ensuite : entraînante, pas tellement redondante, elle rythme bien les différents niveau rapide du jeu. Les moins : Certaines unités me semblent inutiles pour le moment sur leurs description (il y en a une qui spawn 2 missiles seulement si elles crit, mais quels sont se dégâts de bases ?), et même s'il est évident que 7 unités devraient suffire à synergiser, je pense qu'une petite huitième ne serait pas de trop. Enfin, les GROS plus : le suivi dans le dev, des considérations de ce que dit ou propose la commu, déjà 2 nouvelles unités en deux semaines et surtout ce prix ? Pardon ? 2,39 euros, j'ai presque l'impression d'avoir volé le jeu tant il est pourvu de qualités qui vont m'offrir des heures de jeu. En bref, tl;dr : Foncez ! Aucun risque de se planter",27.1 hrs on record																					(3.6 hrs at review time),N/A
76561198043830933,3,Teamfight Manager,"Indie, Simulation, Sports",Recommended,"Inattendu, le jeu n'est pas du tout un ""esport manager simulator 3000"", au contraire, on a là une petite bombe qui nous met à la tête d'une équipe qui va devoir s'adapter au jeu auquel elle joue, basé sur un MOBA : faites vos bans, enchainez par vos picks en conséquence et observer en une minute le ""combat"" de vos joueurs, encouragez les et gérer la défaite ou la victoire. Une fois rentrée à la ""game house"", équipez la, entrainer vos joueurs, renseignez vous sur les métas, faites des simulations d'affrontements ... Alors que je pensais juste avoir un petit jeu type filler pour jouer entre deux autres sessions, voilà que TeamFight Manager est en fait un petit bijou ludique qui saura vous embarquer dans la gestion de cette équipe amateur, future championne du monde si vous faites bien votre taf :)",28.8 hrs on record																					(1.6 hrs at review time),N/A
76561198043830933,3,Loop Hero,"Indie, RPG, Strategy",Recommended,"Que dire de plus qui n'a pas été dit ? Sous ses airs austères de premier abord se cache un véritable bijou à la DA particulière mais au final très riche, et qui va vous faire perdre des heures de votre vie sous couvert de cette fameuse phrase ""Aller, une dernière et j'arrête ..."" J'avais déjà passé énormément de temps sur la démo, je viens de passer 16h dessus sur les 30h passées de sa sortie, c'est dire ... Amusez-vous bien !",87.5 hrs on record																					(16.2 hrs at review time),N/A
76561198043830933,3,Hades,"Action, Indie, RPG",Recommended,Il n'y a plus rien à dire sur Hades puisqu'il doit logiquement être élu GOTY 2020.,113.5 hrs on record																					(113.3 hrs at review time),N/A
76561198043830933,3,Monster Train,Strategy,Recommended,"Of all the games that have tried to offer content similar to Slay the Spire, Monster train is the one that, in addition to respecting its elder, has been able to improve it, based on the original ""draw 5 / 3 mana / battle"" format. The game is extraordinarily replayable and the cards and clans are well-balanced. Instead of other ersatz that have copied but never equaled StS, Monster Train has extracted the best from it to offer us a game just as addictive. Let yourself be tempted!",72.3 hrs on record																					(11.0 hrs at review time),N/A
76561198043830933,3,Micro Platformer,"Free To Play, Indie, Early Access",Recommended,"I'm ready to pay an extra ten bucks for this. Worthy heir of Celeste in a way, voluntary lookalike mechanics i guess, but in a way way minimalistic design remembering Flat Heroes. Can't wait for the update, i'll go back into it to try to beat my record now. Nice one dev.",0.6 hrs on record,N/A
76561198043830933,3,Dicey Dungeons,"Indie, Strategy",Recommended,"tl;dr en fin de commentaire ;) A l'heure où j'écris ça, j'ai déjà passé 7h sur le jeu et il est extraordinaire, il est, tout comme l'était Slay the spire (et la comparaison s'arrêtera là), le mix parfait entre jeu de société et jeu vidéo. Non seulement il est à un prix raisonnable (12,49€), mais il est d'une qualité graphique incroyable, complexe, complet, humoristique et la mécanique ... Dingue. Enfin un jeu de dés où l'aléatoire est totalement contrôlable. Il y a tellement de choses à dire qu'il vaut mieux les découvrir par soi même. Je recommande plus que chaudement ! LES + : - Le temps d'une run très rapide qui donne envie d'y retourner - Le choix de style de jeu via les personnages (6 au total) - Son rapport qualité prix qui est juste aberrant, je suis plus que prêt à mettre 20€ dans ce genre de jeu Pour rappel, Tharsis, que j'adore et qui est très jeu de société pour le coup, coûte 15€. Allez faire un tour sur la page du magasin, vous hallucinerez, je le répète, je l'adore, mais à 15 balles on se demande si y a pas moqueries quand on voit Dicey Dungeon pour moins cher ... LES - : - Le jeu ne sort que maintenant, j'aurai voulu pouvoir y jouer depuis 12 ans au moins ;) - Blague à part, l'inventeur n'est vraiment pas super et beaucoup trop aléatoire pour le coup, à se demander ce qu'il fait dans le cast ... - Malgré son air cartoonesque, méfiez vous, il y a des stratégies à développer et n'est pas kid friendly du tout (dans sa mécanique, pas pour le reste). C'est pas forcément un ""-"" mais à l'époque de la sortie de Slay the spire (oui bon encore), des joueurs l'avaient acheté parce qu'ils voyaient leur streamer préféré y jouer et se disait ""olol sa a l'R simple"", pour au final mettre des pouces rouges avec 0.1h de jeu, je crains que ce jeu ne subisse le même revers de médaille. tl;dr : c'est beau, ca se joue vite et c'est complet et le rapport qualité prix a de quoi surprendre. Si vous aimez les dungeon crawler qui propose quelque chose d'innovant, foncez.",29.3 hrs on record																					(7.8 hrs at review time),N/A
