UserID,Page,Game,Genre,Rating,Review,Playtime,PostedDate
76561198006756264,1,SGS Battle For: Fort Donelson,Strategy,Recommended,Good game,5.6 hrs on record																					(3.6 hrs at review time),N/A
76561198006756264,1,SGS Halls of Montezuma,"Simulation, Strategy",Recommended,Decent game I loved the music!,4.0 hrs on record,N/A
76561198006756264,1,SGS Glory Recalled,Strategy,Recommended,This scenario allowed me to finally learn SGS games :D,3.9 hrs on record,N/A
76561198006756264,1,Napoleon's Eagles: Game of the Napoleonic Wars - Kosciuszko,Strategy,Recommended,This one is good,0.0 hrs on record,N/A
76561198006756264,1,"Warhammer 40,000: Speed Freeks",Racing,Recommended,cOOL,1.9 hrs on record																					(0.7 hrs at review time),N/A
76561198006756264,1,Deliver At All Costs,"Action, Adventure",Recommended,Camera is static and there is no third person view camera turning with your car. I need to re-wire my brain to drive correctly and it's not a type of game I want to try-hard to play.,0.5 hrs on record,N/A
76561198006756264,1,N/A,N/A,Recommended,"Enemy retreating forwards to capture your supply points is peak bad design. Also, reinforcements are mighty annoying as you need to detach and attach your leaders constantly running back and forth bringing 1-2 freshly spawned infantry stragglers endlessly",6.1 hrs on record,N/A
76561198006756264,1,Mare Nostrvm,Strategy,Recommended,Brilliant game,22.9 hrs on record																					(22.9 hrs at review time),N/A
76561198006756264,1,Rebel Fury,"Indie, Strategy",Recommended,"This feeling when you maneuver for 40 minutes only for the AI to break and freeze your game forever. Also, the scenarios are weird because its always most beneficial to snipe one enemy unit and then not attack like ever. Victory points for killing enemy units coupled with potential infinite movement and 80% of every map being defensive terrain create extremely bizzare game flow.",6.8 hrs on record,N/A
76561198006756264,1,RBM Studio's Gettysburg,Strategy,Recommended,Cool little game,1.2 hrs on record,N/A
76561198006756264,2,Intravenous 2,"Action, Adventure, Strategy",Recommended,I didn't like the first one but this one is pretty good,1.6 hrs on record																					(1.2 hrs at review time),N/A
76561198006756264,2,Drop Duchy,"Adventure, Indie, Strategy",Recommended,Such a cool game,29.6 hrs on record																					(0.9 hrs at review time),N/A
76561198006756264,2,Cultist Simulator: The Exile,"Indie, RPG, Simulation",Recommended,Cool,0.0 hrs on record,N/A
76561198006756264,2,Clair Obscur: Expedition 33,"Action, RPG",Recommended,Annoying af,1.3 hrs on record,N/A
76561198006756264,2,K2: Digital Edition,"Casual, Indie, Strategy",Recommended,Good digital adaptation,4.7 hrs on record																					(1.2 hrs at review time),N/A
76561198006756264,2,Desperate Place,"Indie, Strategy",Recommended,Cool game,8.4 hrs on record																					(0.9 hrs at review time),N/A
76561198006756264,2,Tempest Rising,"Action, Strategy",Recommended,"Red Alert nostalgia farming. Also, scale of the units is way off, I don't like infantry bigger than tanks.",1.0 hrs on record,N/A
76561198006756264,2,Burden of Commandâ„¢,"Indie, RPG, Strategy",Recommended,"Bullets do not kill in this game. Enemies do not rout, retreat, can't be killed, wounded, broken, rendered combat ineffective in any other way than by forcing them to surrender. If you catch an enemy infantry squad on the open ground, in a machine gun crossfire, fire on them with multiple infantry squads, pound them with artillery, tough luck. If you do not plan to leave your trenches and run into them onto the open field to accept their surrender, don't even bother. But that only works one way. I moved my one guy from the rocks through the rocks into the rocks and tank sniped me from the quadruple maximum garand range distance through the trees in one shot. I thought to myself,. wow, that was extremely unlucky. I moved another officer same way - another tank sniped me. I moved last two officers same way - they died also. That was all in one turn. That's 4 shots from the other side of the map, through the forest into a single man moving from hard cover through hard cover into hard cover. There is something seriously wrong with the combat mechanics. Edit. Honorable mention for hilariously bad tutorial. I haven't seen anything even half as bad in my life. It's so bad that it's good, worth checking out.",20.0 hrs on record,N/A
76561198006756264,2,Nobody Wants to Die,Adventure,Recommended,"I loved the aesthetics and quite enjoyed the first 2/3 of the game. Last parts of the game however were a total let down and the ending was straight up bad. Also, there's not much gameplay (I know, it's an interactive novel) so with no proper save system I feel no desire to replay it X times to get to the true ending.",4.9 hrs on record,N/A
76561198006756264,2,Pentiment,"Adventure, Casual",Recommended,"Yes it's beautiful and unique and it starts off great, but: - murder mystery without resolution, because they thought it doesn't matter for you who did it, after you just spend 15 hours trying to figure out who did it I could stop at this point beacause it's a dealbreaker for me, but let's go on: - horrible pacing, story just drops at one point and never picks up the tempo again - too many fillers. I understand it helps the worldbuilding but after 3 hours of gossip with millers wife I don't need another 3 hours gossip with fisherman's wife or whatever - mind-numbingly boring 3 Act - at some point it changes its tone from authentic and historical to ""let's preach about modern day politics"" -  illusion of choice but it's really linear - no proper save system - everything you do is on time-constraint which some may don't like (I don't mind)",13.2 hrs on record,N/A
76561198006756264,3,Do No Harm,Simulation,Recommended,"Main gameplay loop is not very interesting User interface is awkward, especially using doctor tools No pause is annoying, you can't even read the book properly Game is introducing systems without explaining them - i figured out you pay same the price regardless of the ammount of the restocked medicine only after a couple of days You can go mad from the voice you hear on the stethoscope even if you don't ever use the stethoscope You can go mad from the things you see in magnifiying glass even if you don't ever use the maginifing glass Pig jumping of the clock was rad af, no way I'm using laudanum to get rid of that Why is the priest of Dagon wearing cross, shouldn't he wear like a Dagon sign? They took my fckin owl with no ways of getting it back",5.7 hrs on record,N/A
76561198006756264,3,Nordhold,"Indie, Strategy",Recommended,Nope,0.1 hrs on record,N/A
76561198006756264,3,Grit and Valor - 1949,"Action, Casual, Strategy",Recommended,"Shallow gameplay, boring upgrades",0.4 hrs on record,N/A
76561198006756264,3,Atomfall,"Action, Adventure",Recommended,Respawning enemies & uninspired loot,2.0 hrs on record,N/A
76561198006756264,3,Knights in Tight Spaces,"Action, Strategy",Recommended,"I was hoping for a more weapon-focused gameplay but it's more of a ""take evil skeleton mage to suplex city"" approach",8.6 hrs on record,N/A
76561198006756264,3,Citizen Sleeper 2: Starward Vector,"Adventure, Indie, RPG",Recommended,It's a good game but way worse than the first one. Story is not even half as captivating. Gameplay is fine. I liked the idea of a starship and a crew though.,9.3 hrs on record,N/A
76561198006756264,3,Citizen Sleeper,"Adventure, Indie, RPG",Recommended,"Amazing game, almost missed on it.",8.1 hrs on record																					(6.9 hrs at review time),N/A
76561198006756264,3,Cascadia,Strategy,Recommended,Very good,2.7 hrs on record																					(0.4 hrs at review time),N/A
76561198006756264,3,Door Kickers 2: Task Force North,"Action, Indie, Simulation, Strategy",Recommended,Very cool,56.9 hrs on record																					(0.8 hrs at review time),N/A
76561198006756264,3,Bug Fables: The Everlasting Sapling,"Action, Adventure, Indie, RPG",Recommended,10/10,47.0 hrs on record																					(2.8 hrs at review time),N/A
76561198006756264,4,Climate Expansion,"Indie, Simulation, Strategy",Recommended,Best expansion,0.0 hrs on record,N/A
76561198006756264,4,Stray Path,"Adventure, Casual, Indie, Strategy",Recommended,"Yeah, okay, the game is cool. But why all the characters are not different cats? Like: cat rogue, cat barbarian, cat mage etc. Also: undo button is needed",4.2 hrs on record																					(4.1 hrs at review time),N/A
76561198006756264,4,Life is Strange - Episode 1,"Action, Adventure",Recommended,Boring-ass game,5.2 hrs on record,N/A
76561198006756264,4,Darkest DungeonÂ® II: The Binding Blade,"Indie, RPG, Strategy",Recommended,Very cool,0.0 hrs on record,N/A
76561198006756264,4,Darkest DungeonÂ® II: Inhuman Bondage,"Indie, RPG, Strategy",Recommended,Very cool,0.0 hrs on record,N/A
76561198006756264,4,Concordia: Digital Edition,"Casual, Indie, Strategy",Recommended,"Digital port is good but I really, really dislike the game loop. Also, music is annoying as heck.",0.7 hrs on record,N/A
76561198006756264,4,DYNASTY WARRIORS: ORIGINS,"Action, RPG, Strategy",Recommended,Lu Bu at Xiapi,34.3 hrs on record																					(34.3 hrs at review time),N/A
76561198006756264,4,Evolution: Flight Expansion,"Casual, Indie, Simulation, Strategy",Recommended,Cool expansion,0.0 hrs on record,N/A
76561198006756264,4,Evolution - Biodiversity Promo Pack,"Simulation, Strategy",Recommended,Cool,0.0 hrs on record,N/A
76561198006756264,4,Nowhere Prophet,"Indie, RPG, Strategy",Recommended,Nope,0.6 hrs on record,N/A
76561198006756264,5,Griftlands,Indie,Recommended,Nope,1.3 hrs on record,N/A
76561198006756264,5,Evolution Board Game,"Casual, Indie, Simulation, Strategy",Recommended,Mind-blowing amount of playstyles and possibilities. Solid single player content in a shape of an interesting campaign.,17.0 hrs on record																					(4.0 hrs at review time),N/A
76561198006756264,5,Clank!,Strategy,Recommended,Very good port of a very good game,28.0 hrs on record																					(17.2 hrs at review time),N/A
76561198006756264,5,Lamplight City,"Adventure, Indie",Recommended,"Some cases you may lose because you do things in the wrong order that you have no way knowing about, just pure luck. Other than that, the game is good, but this one is a dealbreaker for me.",5.8 hrs on record,N/A
76561198006756264,5,NORCO,"Adventure, Indie",Recommended,It's an acquired taste for sure. I myself loved it.,7.4 hrs on record,N/A
76561198006756264,5,Chronicle of Innsmouth: Mountains of Madness,Adventure,Recommended,Neither story nor gameplay are particularly interesting. Too many infodumps and all the interesting parts are happening in the cutscenes. Also the dialogues which take a large part of the game are not the best.,6.4 hrs on record,N/A
76561198006756264,5,Red Dead Redemption,Action,Recommended,Pros: - John Marston is cooler than Arthur Morgan - Undead Nightmare storyline - weird west setting is great - gunplay is alright Cons: - obligatory rockstar launcher and social club - general clunkiness (especially horse riding) - separate 2sec loot animation for each of 35 just-killed zombies - Two character movement options: 1. glacial pace walk 2. breakneck sprint - cringe/unfunny humor - real life/politics references breaking the 4th wall,8.0 hrs on record,N/A
76561198006756264,5,Phantom Brigade,"Indie, RPG, Strategy",Recommended,"- ""turnbased"" gameplay is just RTS with extra steps - fog, blur, bloom - poor dialogues and story - UI is annoying",0.5 hrs on record,N/A
76561198006756264,5,Marvel Rivals,"Action, Free To Play",Recommended,Just giving my positive review to piss off evil corporations like Blizzard or Ubisoft even more. The game is good by the way.,2.3 hrs on record																					(0.6 hrs at review time),N/A
76561198006756264,5,Military Conflict: Vietnam,"Action, Early Access",Recommended,Cool game,1.9 hrs on record																					(0.7 hrs at review time),N/A
76561198006756264,6,Vampire: The Masquerade â€“ Swansong,"Adventure, RPG",Recommended,- Writing quality is abysmal - Gameplay is non-existent - Characters look ugly af - Can't simply press a button - hold to do everything - Unskipabble cutscenes - Fat vampires lol,0.7 hrs on record,N/A
76561198006756264,6,Ultimate General: American Revolution,"Simulation, Strategy",Recommended,As someone already said: Explanation of the rules of the game - particularly for campaigns is virtually non-existent. If dev's can't be bothered for 5 minutes to learn me play their game I can't be bothered to play it. I have finished all the previous UG entries so probably I would be able to figure it out eventually but this approach is pissing me off royally.,0.6 hrs on record																					(0.5 hrs at review time),N/A
76561198006756264,6,Crown Wars: The Black Prince,"Adventure, RPG, Strategy",Recommended,What's with the horrible blurry graphics even on the highest settings? And why the characters can't auto-face their enemies even when 1-1?,0.3 hrs on record,N/A
76561198006756264,6,S.T.A.L.K.E.R. 2: Heart of Chornobyl,"Action, Adventure, RPG",Recommended,"- ""why should I even care"" storyline - no progression of any sort - boring and empty world - combat is very bad - it looks ugly - ""survival"" element is extremely lackluster - even on highest difficulty it's too easy as you have literally tons of supplies everywhere",5.0 hrs on record,N/A
76561198006756264,6,Path of Exile 2,"Action, Adventure, Massively Multiplayer, RPG, Early Access",Recommended,It's so good,31.1 hrs on record																					(1.9 hrs at review time),N/A
76561198006756264,6,Age of Water,"Action, Adventure, Massively Multiplayer",Recommended,"It's a fun game, looks nice and sailing is well done.",7.8 hrs on record,N/A
76561198006756264,6,Dustland Delivery,"Adventure, Indie, RPG, Simulation, Strategy",Recommended,Lots of minor gripes,0.3 hrs on record,N/A
76561198006756264,6,Menace from the Deep,"Adventure, Indie, Simulation, Strategy",Recommended,"Yes, yes, very cool game. Love the music and art.",18.3 hrs on record,N/A
76561198006756264,6,Tactical Breach Wizards,"Adventure, Indie, RPG, Strategy",Recommended,It looks stupid but it's very well written and loads of fun.,19.9 hrs on record																					(0.8 hrs at review time),N/A
76561198006756264,6,Dice & Fold,"Casual, Indie, RPG, Strategy",Recommended,Very cool indeed,8.7 hrs on record																					(1.2 hrs at review time),N/A
76561198006756264,7,Monster Run: Downfall of the Empire,"Action, Casual, Indie, RPG",Recommended,"It's like my cat, but more friendly",5.2 hrs on record																					(0.7 hrs at review time),N/A
76561198006756264,7,SuperTux,"Action, Casual, Free To Play, Early Access",Recommended,Tux is the best,5.3 hrs on record,N/A
76561198006756264,7,Dead Season,"Indie, Strategy",Recommended,"Such an interesting game, almost came under my radar.",8.0 hrs on record																					(1.2 hrs at review time),N/A
76561198006756264,7,MechWarrior 5: Clans,"Action, Simulation",Recommended,So I guess casuals wanna play mechwarrior too so they made a game for them. What a piece of â™¥â™¥â™¥â™¥.,2.2 hrs on record,N/A
76561198006756264,7,Showgunners,N/A,Recommended,Nope,1.1 hrs on record,N/A
76561198006756264,7,King Arthur: Legion IX,"RPG, Strategy",Recommended,"To be clear - I love the game and the gameplay loop, combat, character progression, everything. I think Arthur Knights's Tale was GOTY and I loved every second of it. But playing as these undead â™¥â™¥â™¥â™¥â™¥â™¥ jokers is seriously lame. Why can't you give us real, alive and cool-looking roman soldiers? Instead you gave us those silly skeletor-meme guys in goofy masks. It looks like there was a contest of who can came up with the most idiotic mask and the winners made it to the team. To add insult to injury we are suppose to fight and kill our own heroes from the previous game, you know, the ones we actually like and care about. I feel that alignment choice is also very poorly done in this one as we can basically only choose between two flavours of evil. Still, regardless of what you decide, the result is ""whatever"" as it doesn't change anything. Next time instead of trying to come up with a really creative idea just give us normal roman soldiers doing normal roman soldier things and I promise you it's gonna be a â™¥â™¥â™¥â™¥â™¥â™¥ banger. Also, stop simplifing things. We, players who like your games, are not â™¥â™¥â™¥â™¥â™¥â™¥â™¥ idiots. If you're trying to appeal to idiots stop doing turn-based to begin with.",10.3 hrs on record,N/A
76561198006756264,7,Banishers: Ghosts of New Eden,"Action, Adventure, RPG",Recommended,Story and writing is complete â™¥â™¥â™¥â™¥. Combat and animations are â™¥â™¥â™¥â™¥ as well. At least the setting of 17th century New England is cool.,0.1 hrs on record,N/A
76561198006756264,7,Colony Ship: A Post-Earth Role Playing Game,RPG,Recommended,Nope,0.9 hrs on record,N/A
76561198006756264,7,Zero Hour,"Action, Simulation, Strategy",Recommended,"- extremely weird movement - even standing still character is constantly moving slightly, floaty movement with inertion is present as well - lame setting, this fictional india country doesn't work - it's not like old R6 at all, those were smooth af this one is clunky - graphics and animation feel like very-low budget game - extremely uninspired locations, empty rooms with zero authenticity -  placeholder feeling - eg. room is an empty box with one object in the middle or just an empty box with nothing.",0.2 hrs on record,N/A
76561198006756264,7,Starship Troopers: Extermination,"Action, Indie",Recommended,For the guy who came back in the middle of extraction hell risking it all for a wounded stranger and the guy who voluntarily stayed on the turret to cover the escape of others to the end - I remember you.,11.9 hrs on record,N/A
76561198006756264,8,Rogue Waters,"Action, Adventure, RPG, Strategy",Recommended,It's so good they even made the undo button,15.3 hrs on record																					(2.5 hrs at review time),N/A
76561198006756264,8,Miasma Chronicles,"Action, Strategy",Recommended,"What a sad game comparing to Mutant Year Zero. MYZ had a great dialogues, an interesting storyline, a lot of charm and a good tactical gameplay. This one has a lot of cringe dialogues, uninspired storyline, no soul and a mediocre tactical gameplay at best. Also, who came up with the idea to make frog monsters ? Frogs look funny and goofy, it's like you try to make monsters out of koala bears or hamsters.",0.6 hrs on record,N/A
76561198006756264,8,"Warhammer 40,000: Warpforge","Strategy, Free To Play",Recommended,Cool game,22.0 hrs on record																					(19.3 hrs at review time),N/A
76561198006756264,8,"Warhammer 40,000: Space Marine 2","Action, Adventure, RPG",Recommended,It's very decent though I liked Space Marine 1 better,11.3 hrs on record																					(5.1 hrs at review time),N/A
76561198006756264,8,Frostpunk 2,"Simulation, Strategy",Recommended,This game is annoying as f on many levels,5.7 hrs on record,N/A
76561198006756264,8,SOVL: Fantasy Warfare,"Indie, Strategy, Free To Play",Recommended,It's so cool,20.1 hrs on record																					(0.6 hrs at review time),N/A
76561198006756264,8,Soulash 2,"Adventure, Indie, RPG, Strategy, Early Access",Recommended,"No jest wszystko w porzÄ…dku, jest dobrze, dobrze robiÄ…, dobrze wszystko, jest w porzÄ…dku. Jest git, pozdrawiam caÅ‚ego Steama, dobrych chÅ‚opakÃ³w i niech siÄ™ to trzyma. Dobry przekaz leci.",0.1 hrs on record,N/A
76561198006756264,8,Empires of the Void II,Strategy,Recommended,"Not really, no",0.8 hrs on record,N/A
76561198006756264,8,Highwater,"Action, Adventure",Recommended,"This ""game"" is annoying as hell",0.3 hrs on record,N/A
76561198006756264,8,Death Roads: Tournament,"Indie, Racing, Strategy",Recommended,Fun little game,2.6 hrs on record,N/A
76561198006756264,9,Space Prison,"Adventure, RPG, Simulation, Strategy",Recommended,The prison part is alright but the combat part is very very weak.,0.8 hrs on record,N/A
76561198006756264,9,Skull and Bones,"Action, Adventure",Recommended,It's like a pirate game but made by feminists.,1.5 hrs on record,N/A
76561198006756264,9,Paranoia: Happiness is Mandatory,RPG,Recommended,Gameplay is non-existent.,2.4 hrs on record,N/A
76561198006756264,9,Darkest DungeonÂ® II,"Indie, RPG, Strategy",Recommended,Excellent,91.7 hrs on record																					(58.9 hrs at review time),N/A
76561198006756264,9,Knock on the Coffin Lid,"Adventure, Indie, RPG, Strategy",Recommended,"This game is extremely random, be warned.",16.8 hrs on record																					(14.1 hrs at review time),N/A
76561198006756264,9,Ghost of Tsushima DIRECTOR'S CUT,"Action, Adventure",Recommended,Awesome,64.8 hrs on record																					(1.6 hrs at review time),N/A
76561198006756264,9,WARNO,"Action, Indie, Simulation, Strategy",Recommended,Yes !,38.5 hrs on record																					(0.3 hrs at review time),N/A
76561198006756264,9,Men of War II,"Action, Simulation, Strategy",Recommended,Very very awkward controls,0.2 hrs on record,N/A
76561198006756264,9,Mechabellum,"Action, Indie, Massively Multiplayer, Simulation, Strategy",Recommended,"Interesting game, good deal of strategy involved",4.7 hrs on record																					(3.0 hrs at review time),N/A
76561198006756264,9,The Foretold: Westmark Legacy,"Adventure, Indie, RPG, Strategy",Recommended,"No proper save on exit, refunded.",0.9 hrs on record,N/A
76561198006756264,10,Ready or Not,"Action, Adventure, Indie",Recommended,Cool game,48.0 hrs on record																					(5.3 hrs at review time),N/A
76561198006756264,10,Last Train Home,Strategy,Recommended,Cool game,42.4 hrs on record																					(28.2 hrs at review time),N/A
76561198006756264,10,Headquarters: World War II,"Simulation, Strategy",Recommended,It's very easy to the point of being boring,5.4 hrs on record																					(2.2 hrs at review time),N/A
76561198006756264,10,Flash Point: Fire Rescue,"Casual, Indie, Strategy",Recommended,Horrible control/action interface,0.1 hrs on record,N/A
76561198006756264,10,War Hospital,Strategy,Recommended,"Cool game but avoid the tutorial, it sets you up for fail",33.8 hrs on record																					(2.2 hrs at review time),N/A
76561198006756264,10,Terminator: Dark Fate - Defiance,Strategy,Recommended,"Instead of trying to deliever cinematic experience how about you deliver competent real time strategy? You have no clear objectives and the game ""updates"" your objectives a split second before something happens, while it's already too late to react and re-deploy. After each update you need to re-load earlier save and with hindsight what's gonna happen move the soldiers to counteract. Rinse & repeat. It's a horrible gameplay experience.",2.5 hrs on record																					(1.0 hrs at review time),N/A
76561198006756264,10,"WarhammerÂ® 40,000: Dawn of WarÂ® â€“ Winter Assault",Strategy,Recommended,Classic,0.3 hrs on record,N/A
76561198006756264,10,Lock 'n Load Tactical Digital: Heroes of the Nam Battlepack 1,"Indie, Simulation, Strategy",Recommended,"What you doing in the underworld, Taylor?",0.0 hrs on record,N/A
76561198006756264,10,Lock 'n Load Tactical Digital: Heroes Against the Red Star Battlepack 1,"Indie, Simulation, Strategy",Recommended,It's really really good,0.0 hrs on record,N/A
76561198006756264,10,Lock 'n Load Tactical Digital: Core Game,"Indie, Simulation, Strategy, Early Access",Recommended,Gives me ASL PTSD Flashbacks from the late 90's,29.9 hrs on record																					(4.5 hrs at review time),N/A
76561198006756264,11,Spirit Island,"Indie, Strategy",Recommended,Surprisingly good game. It's more complicated than it looks. Good digital adaptation.,24.9 hrs on record																					(3.6 hrs at review time),N/A
76561198006756264,11,Labyrinth: The War on Terror,"Simulation, Strategy",Recommended,Excellent adaptation of an excellent game,15.9 hrs on record																					(1.6 hrs at review time),N/A
76561198006756264,11,"Gremlins, Inc.","Indie, Strategy",Recommended,Good game & good digital adaptation,2.8 hrs on record																					(1.9 hrs at review time),N/A
76561198006756264,11,Fort Sumter: The Secession Crisis,Strategy,Recommended,"Digital implementation is very good but the game itself is very poor. As long as everybody knows the rules and nobody does anything stupid it's pure luck. Also, the game is skewed in favor of Union.",2.2 hrs on record,N/A
76561198006756264,11,Clou - Roll & Heist,"Adventure, Casual, Indie, RPG, Strategy, Early Access",Recommended,Excellent game,8.3 hrs on record																					(3.7 hrs at review time),N/A
76561198006756264,11,Steam: Rails to Riches,"Casual, Indie, Strategy",Recommended,It's an okay game,2.7 hrs on record,N/A
76561198006756264,11,Master of Wills,"Free To Play, Strategy, Early Access",Recommended,The game itself is interesting but the digital port leaves a lot to be desired.,0.9 hrs on record,N/A
76561198006756264,11,Efemeris - DTDA Games,"Indie, Strategy",Recommended,"Lacks basic user interface. You exit the game through the task manager because there is no exit button. There is no save & exit either, obviously. Weak AI and coma-inducing music do not help. Game itself is mediocre at best though I really, really like the aesthetics.",0.6 hrs on record,N/A
76561198006756264,11,Dead Man's Draw,"Casual, Indie, Strategy",Recommended,Fun little game + cool art + good digital adaptation = positive review,2.4 hrs on record,N/A
76561198006756264,11,Light Hunters: Battalion of Darkness,"Free To Play, Indie, Strategy",Recommended,Horrible xD,0.2 hrs on record,N/A
