UserID,Page,Game,Genre,Rating,Review,Playtime,PostedDate
76561198006756264,31,Gears Tactics,Strategy,Recommended,I'm not a great fan of Gears franchise but this game is really decent,38.2 hrs on record																					(15.4 hrs at review time),N/A
76561198006756264,31,Oxenfree,"Adventure, Indie",Recommended,"Night in the Woods for normies. If you're a normie, buy it, you gonna love it.",0.3 hrs on record,N/A
76561198006756264,31,Streets of Rage 4,"Action, Indie",Recommended,Awesome,7.5 hrs on record																					(1.4 hrs at review time),N/A
76561198006756264,31,I am not a Monster: First Contact,"Indie, RPG, Strategy",Recommended,"It's quite fun, I'd rate it somewhere between positive and neutral Pros: - cool setting - visuals - it's pretty damn hard Cons: - no character progress - poor inventory management - melee is useless - space mission was a b.i.t.c.h Edit: Lame-a.s.s ending ruined it for me",29.2 hrs on record																					(11.4 hrs at review time),N/A
76561198006756264,32,Cloudpunk,"Adventure, Indie, RPG",Recommended,"This game consists mainly of driving and listening to the dialogues. While the driving part is so-so, and the city aesthetics are great, problem lies within the second part. Dialogues are extremely stiff, jokes corny and level of writing in general is embarrassingly bad. - Just don't ask what's in the package <wait for it> <wait for it> <wait for it> - What's in the package?",0.2 hrs on record,N/A
76561198006756264,32,Astrologaster,"Adventure, Casual, Indie",Recommended,"Black Adder The Game It's the most hilarious thing I've played in my life. Go forth and buy this game immediately, you won't regret. Huzzah!",7.0 hrs on record																					(1.5 hrs at review time),N/A
76561198006756264,32,To Be or Not To Be,"Adventure, Casual, Indie",Recommended,Wild Thing,0.9 hrs on record																					(0.4 hrs at review time),N/A
76561198006756264,32,Help Will Come Tomorrow,"Adventure, Simulation, Strategy",Recommended,Thumb up.  Eddie rules.,16.7 hrs on record																					(6.9 hrs at review time),N/A
76561198006756264,32,Fort Triumph,"Indie, Strategy",Recommended,Nope,0.4 hrs on record,N/A
76561198006756264,32,The Ballad Singer,"Adventure, Indie, RPG",Recommended,Nope,1.9 hrs on record,N/A
76561198006756264,32,Elsinore,"Adventure, Indie, Simulation",Recommended,"Thumb up! It's brilliant! Seriously, it's such a gem. I don't even care for Shakespeare but this game kicks some major as.s in terms of story and fun.",13.0 hrs on record																					(1.9 hrs at review time),N/A
76561198006756264,32,Ancient Enemy,"Indie, RPG, Strategy",Recommended,Not as good as Shadowhand but still good,13.9 hrs on record																					(2.7 hrs at review time),N/A
76561198006756264,32,House Party,"Adventure, Casual, Indie, RPG, Simulation",Recommended,It's way easier to get laid in real life than in this game,13.6 hrs on record																					(12.2 hrs at review time),N/A
76561198006756264,32,Not Tonight,"Adventure, RPG, Simulation",Recommended,Thumb down,0.3 hrs on record,N/A
76561198006756264,33,Generation ZeroÂ® - Alpine Unrest,"Action, Adventure",Recommended,Awesome,0.0 hrs on record,N/A
76561198006756264,33,"Yes, Your Grace","Adventure, Casual, Indie, RPG, Simulation, Strategy",Recommended,Thumb up,7.7 hrs on record																					(1.1 hrs at review time),N/A
76561198006756264,33,Conglomerate 451,"Indie, RPG",Recommended,"It does not save your progress if you need to exit the game in the middle of the mission. No, thank you.",0.2 hrs on record,N/A
76561198006756264,33,Metro Exodus - Sam's Story,"Action, Adventure",Recommended,Thumb up,0.0 hrs on record,N/A
76561198006756264,33,Death and Taxes,"Adventure, Casual, Indie, Simulation, Strategy",Recommended,I'm great at this job !,3.2 hrs on record																					(1.0 hrs at review time),N/A
76561198006756264,33,TrialsÂ® Rising - Expansion Pass,Racing,Recommended,Thumb up,0.0 hrs on record,N/A
76561198006756264,33,Vampire: The Masquerade - Coteries of New York,Indie,Recommended,"Beautiful art, cool storyline, great music all destroyed by a forced streamlined ending. It would be a great game but ultimately nothing you do affects the story or the outcome (so what's the point?). Operation Wolf felt less on the rails than this one.",10.3 hrs on record,N/A
76561198006756264,33,TrialsÂ® Rising,Racing,Recommended,Thumb up,20.9 hrs on record																					(17.5 hrs at review time),N/A
76561198006756264,33,Bastard,"Adventure, Indie, RPG, Strategy",Recommended,"Quality of the story, dialogues and writing in general is so low than anything else is not relevant. I'd not play it even if someone paid me to.",0.6 hrs on record,N/A
76561198006756264,33,Legends of Eisenwald,"Adventure, Indie, RPG, Strategy",Recommended,"Gameplay is alright but the story sucks. You play as an evil noble who doesn't care about common folk, sacrifices others for his own goals, kills priests and peasants etc. There is zero freedom of choice. I don't necessarily want a paladin but literally anything would be better than this pretentious buffoon that is forced upon you. Also, quest log is complete garbage. In second mission you need to find a guy who ""will be waiting near the south city gate in the shadow of the guard tower"". Except he will not. He actually stands near a small hut and a bridge in a completely different place. Good luck searching where your quest log points you.",13.1 hrs on record,N/A
76561198006756264,34,Steepâ„¢,"Action, Sports",Recommended,Cool game but the user interface is atrocious.,13.0 hrs on record																					(1.3 hrs at review time),N/A
76561198006756264,34,Sniper Ghost Warrior Contracts,Action,Recommended,"First game of Sniper Ghost Warrior franchise I don't like. It feels like a glorified DLC with lacking story, 5 missions and some hi-tech/sci-fi mumbo jumbo flavor. Instead of going military fiction route they made poor man Crysis with super suit, superhero abilities and I don't know what else because refund.",0.7 hrs on record,N/A
76561198006756264,34,Narcos: Rise of the Cartels,"Action, Strategy",Recommended,Complete trash - you get only 1 activation per turn regardless of how many guys you control. That means that if you want to move 5 guys from your squad once each - lonely enemy will get 5 activations/actions/attacks as a response. It boils down to one of your guys fighting and all the others just standing and doing nothing.,0.3 hrs on record,N/A
76561198006756264,34,Blacksad: Under the Skin,Adventure,Recommended,"It's truly awesome game. Desmond O'Leary totally rules and Jake Ostombe is just the best. Also, ""We cats and wolves hunt at night"" 9+/10",10.9 hrs on record																					(0.3 hrs at review time),N/A
76561198006756264,34,Terminator: Resistance,"Action, Adventure, RPG",Recommended,Dark Horse of 2019. This game is seriously awesome.,16.0 hrs on record																					(1.0 hrs at review time),N/A
76561198006756264,34,DOOM,Action,Recommended,Nope,1.7 hrs on record,N/A
76561198006756264,34,Unity of Command II,"Indie, Simulation, Strategy",Recommended,"Game is great with one crippling issue: supply. Supply is a 0-1 method based on % chance. If for example you have 50% supply there is 50% chance you receive full supply and 50% you receive no supply. In practice it looks like this: I have two infantry units sitting in Palermo and on the field adjacent. Enemy is wiped out and all the terrain around is mine. Friendly supply point is on the other side of the island and it's pretty far away so even though I have uninterrupted road from here to there my supply is 50%. First unit is winning coin flip 3 times and is sitting fully supplied all the time on the field while their neighbours sitting in PALERMO lose coin flip 3 times and mass-die of starvation or I don't know what. I remind you that all this time there are no enemy units present so I suppose it's not the issue of running low on ammo and medicines. Also they are standing in â™¥â™¥â™¥â™¥â™¥â™¥â™¥ Palermo and although I realise it's not the same city as today I believe you shouldn't mass-die of starvation there during a period of a week in the middle of a summer. Also, tutorial and manual are sh/t. Press fire to fire, move if you want to move, that's it, you're ready, go! Except you are not. You don't known jack sh/t about many crucial mechanics. I suspect many will get destroyed and wouldn't even know why. Either you learn the rules by yourself or don't bother.",4.8 hrs on record																					(3.3 hrs at review time),N/A
76561198006756264,34,"BEARS, VODKA, BALALAIKA! ðŸ»","Action, Adventure, Indie, RPG, Simulation",Recommended,Masterpiece,0.4 hrs on record,N/A
76561198006756264,34,Seasons after Fall,"Adventure, Indie",Recommended,No,0.5 hrs on record,N/A
76561198006756264,34,Neo Cab,"Adventure, Indie, RPG",Recommended,"Came here for the story, neon lights and Gibson feel but the cringe insta-killed me.",0.3 hrs on record,N/A
76561198006756264,35,Sherlock Holmes versus Jack the Ripper,"Adventure, RPG",Recommended,Arthur Conan Doyle was Jack the Ripper but nice try nonetheless :P,13.9 hrs on record,N/A
76561198006756264,35,Phoning Home,"Action, Adventure, Indie",Recommended,"I know it would be one of the best games ever with amazing characters, dialogues and story but instead it's an exercise in fckin futility where you try to climb a fckin mountain jumping from a platform to a platform for 2 fckin hours. I don't know what fckin genius came up with this whole jumping & climbing content but he ruined a great game. I wasn't exactly expecting Super Mario Bros with botched controls. Shame.",3.4 hrs on record																					(1.7 hrs at review time),N/A
76561198006756264,35,Hell Let Loose,"Action, Indie, Massively Multiplayer, Simulation, Strategy",Recommended,Display server list -> Wait 30 seconds -> Join server 98/100 -> Server full -> Refresh server list -> 30 seconds -> Join server 95/100 -> Server full -> Refresh -> 30 seconds -> Join server 90/100 -> Server full -> FFS -> Refresh -> 30 seconds -> Join server 70/100 -> Server joined -> Join American team -> American team full -> Wanna join Nazis? -> Not rly -> Refresh server list -> 30 seconds -> Join server 90/100 -> Server full -> Refresh -> [15 minutes later] -> Start the game as an american medic -> Spawn 10 kilometers from the front line -> Run for 10 minutes to join your buddies -> I can finally see my team in the horizon -> Almost there -> Hang on guys I'm coming -> Kicked for being idle -> You've got to be kiddin me -> Refresh server list -> Wait 30 seconds -> I can't take it anymore -> Uninstall -> Play other game -> Profit,0.6 hrs on record,N/A
76561198006756264,35,Close Combat: The Bloody First,"Simulation, Strategy",Recommended,Game of elevations and line of sight with AI that force you to manually check elevations and line of sight for each squad every 5 seconds. Also - really awkward UI and controls. Bleak and washed out colour palette of the map and your squads does not help with maintaining control over your troops positions.,0.8 hrs on record,N/A
76561198006756264,35,WARSAW RISING: City of Heroes,"Indie, RPG, Free To Play",Recommended,"I'm sorry, I honestly wanted to love this game but can't make it through the most failed soundtrack/music I've ever heard. It's like the worst kind of mashup of classical compositions about the uprising like Warsaw Concerto or whatever with weird jazz-like flavor. I honestly couldn't care less if it's authentic music from the period, I want a good soundtrack that suits the game not a music history lesson. I know that for most people it's gonna be straight absurd reason for downvoting the game but for me it's one of the most important parts of the experience. I am aware that I can disable the soundtrack and play my own music but I can also just play another game. Edit: Yeah, I refunded but I'm changing to positive to further p1ss off WW2 Germany supporters. Damn these guys are annoying.",0.6 hrs on record,N/A
76561198006756264,35,A Legionary's Life,"Indie, RPG",Recommended,Thumb up,4.6 hrs on record																					(3.0 hrs at review time),N/A
76561198006756264,35,The Long Dark,"Adventure, Indie, Simulation, Strategy",Recommended,Core gameplay is okay but the story and characters are a big no-no,2.0 hrs on record,N/A
76561198006756264,35,This Is the Police 2,"Adventure, Indie, Strategy",Recommended,I loved Rebel Cops so I got this one but haven't made it past Sheriff Lily dictating the letter in the opening sequence. Dialogues are cringy like you won't believe. Actually it's worth getting just to check how far you can make it through the cutscenes and then refunding cause it won't be more than 15 minutes anyway.,0.2 hrs on record,N/A
76561198006756264,35,GreedFall,RPG,Recommended,Cloak and Dagger setting is great and I love the visual style but the whole story is beyond idiotic. I won't delve into details but I can't be ars3d to play through yet another cliche about cartoony-evil inquisitors/colonists/capitalists and noble natives. Disney's Pocahontas had better story nuances than this game.,22.3 hrs on record																					(3.2 hrs at review time),N/A
76561198006756264,35,Rebel Cops,Strategy,Recommended,"Wow, I have not played previous games of the series as I'm not a fan of cops vs criminals genre but this one is a hidden gem. It should appeal to all avid turn-base tactics players as it's really demanding and if you're stupid you can always blame RNG so it's a win-win situation!",35.1 hrs on record																					(3.9 hrs at review time),N/A
76561198006756264,36,Overland,Strategy,Recommended,"Wow, it's amazing how bad and awkward UI can you make in such a simple game.",0.3 hrs on record,N/A
76561198006756264,36,Comanche 4,"Action, Simulation",Recommended,Second best thing in the world right after Comanche 3 :P,0.1 hrs on record,N/A
76561198006756264,36,Shadow Warrior,"Action, Adventure",Recommended,I don't even like FPS games that much but Lo Wang is best action hero ever. Level design is also amazingly good.,18.8 hrs on record																					(15.9 hrs at review time),N/A
76561198006756264,36,Fantasy General II,Strategy,Recommended,This game is 9+/10 easily. - cool setting - great units variety - branching mission choices - compelling RP decisions - flavor matches mechanics - it's pretty - units earn new levels and traits so you can tailor your unique army - great community (zero elitist flavor) - there are no cookie-cutter builds that you must discover to do well - it's cool to be a barbarian king - you can bear arms - you can arm bears,107.9 hrs on record																					(7.8 hrs at review time),N/A
76561198006756264,36,EMPYRE: Lords of the Sea Gates,RPG,Recommended,"Great setting, nice art and many good ideas, all buried under horrendously bad user interface that makes it borderline unplayable for me. Seriously, it was already done right by all isometric rpgs over 20 years ago, why can't you just copy their solutions instead of trying to reinvent the wheel.",0.8 hrs on record,N/A
76561198006756264,36,Wars Across The World: Innsmouth 1928,"Indie, Strategy",Recommended,Great scenario. AI is really good on this one.,0.0 hrs on record,N/A
76561198006756264,36,Unheard - Voices of Crime,"Indie, RPG, Simulation",Recommended,Boring,0.4 hrs on record,N/A
76561198006756264,36,Far CryÂ® Primal,"Action, Adventure",Recommended,Best Far Cry,26.5 hrs on record																					(5.9 hrs at review time),N/A
76561198006756264,36,We. The Revolution,Strategy,Recommended,Thumb up,6.1 hrs on record,N/A
76561198006756264,36,RAGE 2,Action,Recommended,This game is so cringy that even 20 years of playing stupid games haven't prepared me for that.,0.4 hrs on record,N/A
76561198006756264,37,They Are Billions,Strategy,Recommended,It's good,11.8 hrs on record																					(1.5 hrs at review time),N/A
76561198006756264,37,"Warhammer 40,000: Mechanicus",Strategy,Recommended,"Wow, it's great",36.3 hrs on record																					(2.5 hrs at review time),N/A
76561198006756264,37,Twilight Struggle,"Simulation, Strategy",Recommended,thumb up,9.1 hrs on record																					(7.5 hrs at review time),N/A
76561198006756264,37,Dark Future: Blood Red States,"Indie, Strategy",Recommended,"New patch made my game obsolete and now I'm back to tutorial. No, thank you. Refund.",1.6 hrs on record,N/A
76561198006756264,37,Generation ZeroÂ®,"Action, Adventure",Recommended,Great coop experience.,48.4 hrs on record																					(5.5 hrs at review time),N/A
76561198006756264,37,Outward Definitive Edition,RPG,Recommended,There are a lot of neat concepts in this game and a lot of things right. 3 showstoppers for me: - day and night cycle is like at least 3 times too fast - no experience / level character progression - hero models are really f ugly,7.0 hrs on record,N/A
76561198006756264,37,South Parkâ„¢: The Fractured But Wholeâ„¢ - From Dusk Till Casa Bonita,"Sexual Content, Nudity, Violent, Gore, RPG",Recommended,Stopped at half. You are playing as the villain here ruining kid's party. It's pretty lame.,0.0 hrs on record,N/A
76561198006756264,37,South Parkâ„¢: The Fractured But Wholeâ„¢,RPG,Recommended,Thumb up,46.6 hrs on record,N/A
76561198006756264,37,Sherlock Holmes: The Devil's Daughter,"Action, Adventure",Recommended,Worst Sherlock of the series,18.0 hrs on record,N/A
76561198006756264,37,The Occupation,"Adventure, Indie",Recommended,It's the worst game I've played in over 25 years of gaming. It redefined my whole concept of what a bad game is. In a way it changed my life cause after this experience every game I'll play will seem great.,0.7 hrs on record,N/A
76561198006756264,38,Metro Exodus,Action,Recommended,"First 2 hours are really bad, I almost stopped playing at that point. All the linear levels are dragging the game down in fact. But when the (semi)open world begins with side quests, exploration, npcs and crafting, game jumps from 2/10 to 9/10 and just stays there. Most of the locations you visit are pure eye-candy, really unique and detailed. Though story is pretty stupid when you think about it too long, characters are well written and really likable and their dialogues are fun to listen to. I'm amazed how the game I almost refunded became one of the best titles I played in some time. All Stalker references are in order as this game is really closer to Shadow of Chernobyl and Clear Sky than previous instalments of its own series. Last but not least, f.uck Epic store, Gaben rules.",39.1 hrs on record																					(26.9 hrs at review time),N/A
76561198006756264,38,Far CryÂ® New Dawn,"Action, Adventure",Recommended,Unpausable cutscenes,0.5 hrs on record,N/A
76561198006756264,38,Element Space,"Action, Indie, RPG, Strategy",Recommended,"Why the team calls their leader in a rank of captain ""rookie"" ?",0.3 hrs on record,N/A
76561198006756264,38,The Lord of the Rings: Adventure Card Game - Definitive Edition,"Adventure, RPG, Strategy",Recommended,"As an avid fan of an original tabletop LCG with hundreds of hours in it I was pretty sceptic after learning that it's not 100% accurate conversion. But it turns out it's even better than the original ! It's way more balanced and tactical now with all cheesy combos thrown out the window. UI is good, new rules work well and gameplay is still complex (maybe even more). Good effin job !",45.2 hrs on record																					(12.5 hrs at review time),N/A
76561198006756264,38,Undertale,"Indie, RPG",Recommended,An open mind is like a fortress with its gates unbarred and unguarded.,0.8 hrs on record,N/A
76561198006756264,38,Warhammer Age of Sigmar: Champions,"Free To Play, Strategy",Recommended,Warhammer Age of Pokemon,1.6 hrs on record,N/A
76561198006756264,38,Warhammer Quest 2: The End Times,"Adventure, Strategy",Recommended,Thumb up,22.0 hrs on record																					(17.8 hrs at review time),N/A
76561198006756264,38,"Dr. Langeskov, The Tiger, and The Terribly Cursed Emerald: A Whirlwind Heist","Free To Play, Indie",Recommended,No,0.7 hrs on record,N/A
76561198006756264,38,Robothorium,"Indie, RPG, Strategy",Recommended,Thumb up,19.6 hrs on record,N/A
76561198006756264,38,Shieldwall Chronicles: Swords of the North,"Action, Adventure, Indie, RPG, Strategy",Recommended,It's not horribly bad but it's not too good either.,1.5 hrs on record,N/A
76561198006756264,39,The Cat Machine,"Indie, Strategy",Recommended,It's very fun and legit puzzle game,0.9 hrs on record,N/A
76561198006756264,39,Deadnaut,"Indie, RPG, Strategy",Recommended,"Good idea, poor execution.",2.0 hrs on record,N/A
76561198006756264,39,Battlefleet Gothic: Armada 2,Strategy,Recommended,"I loved the first Battlefleet Gothic but this one is bad both storywise and in terms of gameplay. Also, chained unskippable and unpausable cinematic-cutscene-cinematic-cutscene-cutscene 20 minutes long does not allow you to have any life except Battlefleet Gothic. God forbid your telephone rings or someone knocks the door.",2.0 hrs on record																					(1.3 hrs at review time),N/A
76561198006756264,39,"Mafia III: Faster, Baby!","Sexual Content, Nudity, Violent, Gore, Action, Adventure",Recommended,"Stupid cutscene and all my equipment from Stones Unturned gone, no way of getting it back.",0.0 hrs on record,N/A
76561198006756264,39,Mafia III: Sign of the Times,"Sexual Content, Nudity, Violent, Gore, Action, Adventure",Recommended,"This DLC is about horror known as ""make it so dark that you can't see anything so you pump up your screen brightness to the max but it doesn't really help so you just wander around looking at your minimap"" Also, correct me if I'm wrong but crazy chick armed with strange voice and a kitchen knife isn't exactly an adequate opponent for a SOG ex-commando armed with assault rifle, grenade launcher, shi.tton of ammunition and explosives. It's like Arnie vs Predator all over again but this time Predator is an old lady. What were they thinking? Cutscenes with Father James are the only bright side of this DLC as he is really cool character.",0.0 hrs on record,N/A
76561198006756264,39,Mafia III: Stones Unturned,"Sexual Content, Nudity, Violent, Gore, Action, Adventure",Recommended,"Excellent DLC, way better than the vanilla game in fact. Clay and Donovan have great chemistry and it's pure joy to follow their adventures. Interesting new locations and vietnam war references. Thumb up",0.0 hrs on record,N/A
76561198006756264,39,Return of the Obra Dinn,"Adventure, Indie",Recommended,"Well, it really is as good as everyone says.",8.9 hrs on record,N/A
76561198006756264,39,Gary Grigsby's War in the East,"Simulation, Strategy",Recommended,After 2 launches it just stopped working. Reinstall does not help. Refunding.,0.2 hrs on record,N/A
76561198006756264,39,Warhammer: Vermintide 2 - Back to Ubersreik,Action,Recommended,Thumb up,0.0 hrs on record,N/A
76561198006756264,39,Warhammer: Vermintide 2 - Shadows Over BÃ¶genhafen,N/A,Recommended,Thumb up,0.0 hrs on record,N/A
76561198006756264,40,Call of DutyÂ®: WWII,Action,Recommended,"Silly but fun gameplay, quite decent storyline, lots of exploding things and a tad too short but all in all I got my money's worth considering I bought it on a sale.",10.2 hrs on record,N/A
76561198006756264,40,Mutant Year Zero: Road to Eden,"RPG, Strategy",Recommended,"Good gameplay, cool setting, neat dialogues and superb voice-acting. Thumb up.",29.5 hrs on record,N/A
76561198006756264,40,Injusticeâ„¢ 2,Action,Recommended,TMNT/10,13.6 hrs on record																					(8.4 hrs at review time),N/A
76561198006756264,40,Jagged Alliance: Rage!,"Adventure, RPG, Simulation, Strategy",Recommended,"No, no, God no.",0.1 hrs on record,N/A
76561198006756264,40,War of Rights,"Action, Indie, Massively Multiplayer, Simulation, Strategy, Early Access",Recommended,Thumb up,3.3 hrs on record																					(2.8 hrs at review time),N/A
76561198006756264,40,Call of CthulhuÂ®,"Adventure, RPG",Recommended,Better detective stories & more faithful to Lovecraft mitology: - Dark Corners of The Earth - Prisoner of Ice - Peppa Pig: Mr Dinosaur is Lost - Elder Sign: Omens,7.9 hrs on record,N/A
76561198006756264,40,Panzer Corps: Allied Corps,Strategy,Recommended,'tis good,0.0 hrs on record,N/A
76561198006756264,40,Squad 44,"Action, Indie, Massively Multiplayer, Strategy",Recommended,"My 40 minutes playtime compromised of: 10 minutes trying to join any server, 10 minutes trying to join any team, and 20 minutes to walk to the frontline. I'm not patient enough for this game.",0.6 hrs on record,N/A
76561198006756264,40,Holdfast: Nations At War,"Action, Indie, Massively Multiplayer, RPG, Simulation, Strategy",Recommended,Helluva fun,7.4 hrs on record																					(5.3 hrs at review time),N/A
76561198006756264,40,Thronebreaker: The Witcher Tales,"Adventure, RPG",Recommended,"Yup, it's good",39.6 hrs on record																					(24.8 hrs at review time),N/A
76561198006756264,41,Space Hulk: Tactics,Strategy,Recommended,"Such a huge step back when compared to Ascension. It was clearly made with console players as a marketing target in mind - simplified, tons of useless animation, awkward AI, horrendous UI and ugly maps.",1.2 hrs on record,N/A
