UserID,Page,Game,Rating,Review,Playtime,PostedDate
76561197985705149,5,N/A,Recommended,"This is a depressing game that is frustrating to play. After many hours of play I figured out one of the huge problems. The woman who plays the main character isn't actually looking at anything.  So she just looks spaced out. Combat is a total pain. Discovering the runes to doors is fun at first but then is a horrible chore. The main story just sucks, but the minor stories which are BIG myths are great. The developers are so ego filled with their graphics that you spend way too much of the game looking at this woman's face. Unless you use cheats you will most likely give up within the first 25% of the game. The main storyline is sooooo repeative about darkness and doesn't balance it enough with light.",6.2 hrs on record																					(5.1 hrs at review time),N/A
76561197985705149,5,N/A,Recommended,"I am a kickstarter backer. Sadly they focused on being like every other MMO but with ♥♥♥♥♥♥ graphics. They wasted time on PVP and crafting, instead of focusing on gameplay and storyline. Thus the game is pointless and boring and looks terrrible. I loved the Ultima series, but this game tells you that it wasn't Lord British/Richard Garriot who made these games great. There are silly quests that direct you to zones where you will be destroyed upon adventuring into. You will have to love grind grind grind as you stand with attacking dummies to raise skills, just so you can survive fighting in different Teirs that make no sense. You have no idea if you can handle a certain teir. You will have no idea what you are doing with anything, because the entire UI sucks and never helps you figure out anything without going and Googling. You aren't a hero right out of the gate. You are stupid scavenager trying to get as much gold from looting bodies, it is so lame. There is no story. The conversation with NPCs just sucks and is a click fest.  The entire game is a mish mash of different ideas that don't actually work together.  Pretty Sad. The worst is the map as it takes forever to load.",11.2 hrs on record																					(7.0 hrs at review time),N/A
76561197985705149,5,N/A,Recommended,"Too complicated, not much fun and very very frustrating.",0.8 hrs on record,N/A
76561197985705149,5,N/A,Recommended,"I was a backer of this project and from the beginning the game was fantastic. The demos were games in themselves. But the finished version has destroyed all the fun, makes no sense and might as was just be a video instead of a game. The storyline is a huge problem. The main character is just stupid and his story makes you encounter moral issues, all the while being forced do immoral acts that you have no choice but to participate in. This makes me hate playing the game because I don’t like playing characters I hate and being manipulated into thinking I have choice, but the reality is that there is no choice. Then there are the horrible gameplay features: Saving the game requires getting drunk. Who remembers much of anything when they are drunk?? Not to mention I want to save the game, but now I am stumbling around and can’t play because the screen is blurred. Who thought this was a good idea? Lock picking is so hard that you end failing 90% of the time. They make the lock picks super expensive and the majority of locks are hard or very hard in the beginning areas. You have to be a master of the mouse. Zero fun here. Horse back riding on the PC requires you to have 3 hands.  W held down while you try to double tap the left shift key, while hitting S and D while moving the mouse with your right hand. This tells the story of how they ended up leaving the PC behind, while they focused on console. If there is one thing that screws up games, it is making the game console compatible. I had to get my daughter to help me play the game by having her hold down the W key so I could actually escape with the horse. Pickpocketing is another skill like lock picking where you are going to suck and get caught like 80% of the time. You will also accidently hit the pickpocketing key and have all the guards go after you on a regular basis. Sometimes the guards will just randomly hunt you down for some unknown crime. Once you commit a crime you are screwed because it takes forever for it wear off. Same with wounds. I fell accidently from a ladder and had to bandage myself and the wounds take forever to heal. So you might think “Oh I will just sleep and move time ahead.” You can forget that because apparently following the liner storyline quests are more important than gameplay and you will be forced out of moving time forward. You get hungry all the time, who eats 10 times a day and if you eat too much you are considered a pig and have a penalty that slows you down. Don’t eat food that isn’t in perfect condition otherwise you are going to get 100% poisoned. Skills are poorly thought out. You have a notification that you have skills to spend, but all the main skills have annoying negatives that go with them. Like annoying notifications on your phone, the skill notification is going to bug you until you choose one. The skills now seem to have no real noticeable affect on gameplay, which means you have to gain a lot of skill to actually be any good at anything. Haggling is strange now and just annoying that it doesn’t seem to be worth doing. People everywhere that don’t have any interaction. When you interact with anyone who isn’t a main character, the dialog is pointless and boring. Even main characters is just click and listen with choices that are meaningless. The demos were way better when it came to dialog. The demos were all about exploring and discovering the wonders of the world. Well now there doesn’t appear to be much to find. Everything is quest centric, so going off the beaten path is meaningless. All choices are the almost the same outcome to keep the story on track. The gameplay is so frustrating that you will want to cheat with a trainer or quit the game. Everything in the game is full of penalties as some way to make you think the game is sooo realalistic, but actually just drains all the fun out of the game.",7.0 hrs on record,N/A
76561197985705149,5,N/A,Recommended,The best game I have ever played.,4.1 hrs on record																					(2.4 hrs at review time),N/A
76561197985705149,5,N/A,Recommended,Amazing game! An impressive unique gameplay and reminds me of the old days on my Commodore 64. I couldn't stop playing the game until I reached the areas that are not done yet.  Can't wait until new content comes out. A few minor bugs and wishing I had a place to store special items or lock items so I don't accidently sell them.,8.7 hrs on record																					(7.1 hrs at review time),N/A
76561197985705149,5,N/A,Recommended,"This game totally sucks. The game is linear and you can't interact with anything but what the developer has assigned. You are given no back history or story and no understanding of the controls. There is no voice over and the scenes are abrupt and thus make no sense. Weird things like pick flowers for no reason in a field. There are also long pauses between trying to tell a story. Weird scenes where you see your own body. After about 30 minutes after being dragged through weird mental head trip, I quit.",0.7 hrs on record,N/A
76561197985705149,5,N/A,Recommended,"I paid for the collectors edition and this game is total crap. People can block doorways, you die constantly. The story is totally lame. Unless you are an expert at FPS you will need to group with other players to get through missions. The game just sucks on so many levels.",3.2 hrs on record																					(3.1 hrs at review time),N/A
76561197985705149,5,N/A,Recommended,"Awesome game and storytelling, just wish there was more branching in the possiblities.",9.0 hrs on record																					(3.8 hrs at review time),N/A
76561197985705149,5,N/A,Recommended,"This is just a horrible remake of CIV. There are so many problems with this game. Here is the list: 1. Horrible confusing UI 2. Confusing tech tree that is difficult to figure out what to research to get what you want. Meaningless tech names. 3. Terrible AI, you can sit there bombing a city and the opponent sends nothing against you. 4. Repetitive conversations from the other AI players, had to turn off the sounds. 5.  Difficult to manage troops on the map due to overlapping graphics and troops being blocked by other troops you have. 6. Millions of pointless aliens. You never meet another alien race or visit other planets. You just fight humans, so you might as well play the previous CIV because at least you get historical achievements. 7. The game just feels like it was made by lazy uncreative people. ""Lets make a space CIV by creating some new graphics and overlaying it on top of the last CIV game and rip out all the stuff we don't need. Then we can make some quick money.""",9.9 hrs on record																					(9.8 hrs at review time),N/A
